urgent sident erdogan propos enquê sur attaque ankara responsables seront poursuivis justice 	objective
alerte attentats turquie erdogan admet probables fautes pouvoir romandie	objective
bruno retailleau pas accord avec sarkozy sur hollande pas fini habilet politicienne publicsenat mgrossiord	objective
alerte attentats turquie erdogan admet probables fautes pouvoir ©afp octobre 	objective
ebp pro news alerte attentats turquie erdogan admet probables fautes pouvoir 	objective
turquie attentats ankara trouvent origines syrie affirme erdogan 	objective
alerte attentats ankara trouvent origines syrie affirme erdogan 	objective
turquie attentats ankara trouvent origines syrie affirme sident erdogan	objective
attentats ankara erdogan ordonne enquê sur ventuelles failles sein etat 	objective
erdogan principal responsable attentat contre opposant clame enquê comment tenter faire blanchir 	negative
syrie frappes ont civils truit centrale lectrique medias occidentaux parlent pas 	negative
poutine dit ricains sont capables voir eau sur mars mais pas position etat islamique 	objective
turquie erdogan admet probables fautes pouvoir aprè attentats ankara	objective
pas majoritairement mal demande exemples mauvais libéralisme quoi ponds bah regardes sarkozy	negative
itele turquie erdogan admet probables fautes pouvoir aprè attentats ankara	objective
ordure erdogan complÈtement loupÉ false flag turquie bord Évolte 	negative
manif bas chez moi gueulent erdogan assassin sais pas quoi mdr	mixed
turquie attentat place erdogan face conséquences politique 	objective
attentat ’ankara erdogan admet probables « fautes » pouvoir afrique moyen orient 	objective
les cahuzac sarkozy oivent rien tout mais ouvriers pour coup points prennent ans sais	negative
retour sur espoir que lection potus stimul afrique ans plus tard obama and africa 	objective
monde actu attentats ’ankara erdogan admet probables « fautes » pouvoir trois jours lemondefr	objective
universsolutions attentats ’ankara erdogan admet probables « fautes » pouvoir trois jawadmelloul	objective
myriam lui parle kurdes non monsieur erdogan 	negative
À attentats ’ankara erdogan admet probables « fautes » pouvoir topstories	objective
actu attentats ’ankara erdogan admet probables « fautes » pouvoir 	objective
info news attentats turquie erdogan admet probables fautes pouvoir 	objective
ebp pro news attentats turquie erdogan admet probables fautes pouvoir pointe 	objective
erdogan plonge turquie dans guerre civile qui peut durer longtemps via figaro	objective
francoisbaroin sarkozy veut duire bureaux vote faute volontaires consulte ê pas militants volontaires honteux	negative
hara kiri erdogan mis turquie sens dessus dessous quand seme vent recolte tempete mister 	negative
afpfr erdogan tueur	negative
sident turc recep tayyip erdogan reconnu possibles fautes etat ordonn enquê aprè 	objective
les observateurs attentats turquie erdogan admet probables fautes pouvoir 	objective
critiqu aprè attentat ankara erdogan annonce enquê sur probables fautes press yahoo	objective
sarkozy rien contre morano fait partie famille politique nain craint représailles 	negative
attentat ankara sident erdogan admet faillance etat turc via francetvinfo	objective
attentats turquie erdogan admet probables fautes pouvoir actualit ankara	objective
frappes pourquoi bombarder centrale lectrique importe quoi 	negative
attentat ankara erdogan reconnaî probables fautes pouvoir news	objective
erdogan plonge turquie dans guerre civile qui peut durer longtemps via figaro 	objective
attentats ’ankara erdogan admet probables « fautes » pouvoir 	objective
reuters attentat ankara erdogan voque faille renseignement 	objective
point attentat ankara erdogan reconnaî fautes pouvoir û sans conteste avoir 	objective
actu europe attentats ’ankara erdogan admet probables « fautes » pouvoir 	objective
aprè attentat ankara guerre fait rage entre erdogan parti prokurde challenges challenges 	objective
euro sans hollande pas normal	negative
pourquoi barack obama fait plus êver etats unis 	objective
impô hollande privilégie base lectorale via figaro sauf sait pas compter abstinence 	negative
hollande ira pas euro	objective
hollande chahut par cgt fur mesure change journalistes sont cart par service com 	objective
popularit hollande valls jupp hausse sarkozy marine pen baisse via parisien	objective
fhollande dommage pour quipe hollande monsieur sident 	negative
baroin assure que ’immense majorit chiraquiens soutient sarkozy non jupp pour primaire ope pas accord 	negative
sident françois hollande aujourd hui elys an louis borloo sident fondation energies 	objective
nom ’ mistral cach veille visite françois hollande 	objective
democratie quand journalistes risquent relayer mauvaise info ecartes hollande face cgt 	mixed
france congo ’opposition rapproche ’ ami françois hollande via sharethis	objective
les pays bas limin pour hollande perdra 	objective
sarkozy voit juppe hollande comme couilles molles fillon eunuque ê temps difficile voir plus haut pour nain 	negative
françois hollande instagram “cet aprè midi tais saint nazaire avec ouvriers 	objective
quipes hollande absente albanie sente euro	objective
yaourt t vers macron hollande apostroph cgt fie gouvernement – metronews via metronews	objective
camp milles françois hollande met chaire ’éducation citoyennet miles moiredel internement	objective
que reste anaphores moi sident publique 	negative
saint nazaire lyon hollande macron pris partie images journal via mytfnews	objective
hollande passee orange rouge carrement qualificazionieuropee	mixed
qui quand ê fou sous gvt dictateur holl que sont jamais eux mais tjrs faute sarkozy incroyable 	negative
hollande doit vraiment etre bien entourer pour faire oublier dans dias alors principal responsable que vivons	negative
derniè fois que hollande pas qualifi pour euro tait xfeb xff gagn histoire è euro	objective
echange tendu entre hollande représentants syndicaux saint nazaire video 	objective
boblecentriste sudradio hollande type è intelligent mais qui repris cyniquement tous bobards ext gauche stasiland	mixed
que peuple oublie jamais hollande gvt dias collabo ont fait vivre depuis election oubliez jamais 	negative
faudrait plus appeler affaire bygmalion mais celle comptes campagne sarkozy ô lavrilleux dans lenouvelobs	objective
fillon passe dessus sarkozy chez sympathisants pour jupp que plus embêtant 	mixed
hollande gvt medias collabo ferons tout faire oublier ont imposer par dictature surtout oubliez pas 	negative
fabrice luchini su t françois hollande chez drucker via youtube	objective
euro sans hollande triste franchement	negative
but turquie bye bye hollande	objective
pas euro pour hollande	objective
attentat ankara erdogan reconnaî probables fautes pouvoir pourris tout 	negative
minutes fin hollande doit marquer buts pour qualifi euro wikiboul jpehaiti	objective
camarade sident france bas serres pas main mais parle parle 	negative
hollande besoin reconstruire	objective
ils sont ù suceurs hollande ahahaha 	negative
françois hollande emmanuel macron dans collimateur cgt via figaro	objective
salari noncent «violences patronales» hollande pond «dialogue social» — minutes via minutes	objective
« russie ’engagera pas sol syrie veut voir compromis politique» assure poutine — français 	objective
turquie qui gagne tchèques hollande islande xff xff xfc xffc 	positive
sondage ascension nadine morano chute sarkozy genial naime pas morano encore moins sarkozy que sarko continue perdre 	negative
turquie qui arrache billet direct pour france hollande limin comme quoi foot serve bonnes surprises	positive
nicolas sarkozy ment dit lavrilleux alni htan 	objective
hollande sera pas euro norme sillusion triste 	negative
hollande chantiers stx syndicaliste cgt refuse serrer main hollande explications via 	objective
les pays bas aussi nul hollande 	negative
syndicaliste refuse serrer main fhollande saint nazaire via parisien	objective
françois hollande marisol touraine ministre sant financer recherche pediatrie pour 	positive
marine pen fend nations devant chanceliè merkel vice chancelier hollande 	objective
euro turquie brise ê hollande sortie par petite porte 	objective
hollande pas qualifier pour euro 	negative
que français souche savent malgr dictature gvt hollande sont pas seul combat sommes plusieurs millions	negative
hollande pas qualifier pour euro mais qui remettre coupe capitaine qui remport alors 	mixed
hollande pas euro encore chec politique holandouille gauchiasse dictature	negative
dire que avais dis que hollande gagnerait peut être euro mdr	mixed
hollande perd kazakhe gagne avait tout pour être qualifi bimm coup franc selcuk inan turquie qualifi euro xff xff 	mixed
sident turc recep tayyip erdogan voque faille services renseignements sur attentat ankara 	objective
hollande qui représente lection crois trop pas courant que suites sont pire attendez dit que saga	negative
“sarkozy fausse sait pas assumer ” ’est mec droite qui dit ump bygmalion	negative
mmho hollande mission	negative
france apais hollande nazaire peper pris parti macron flan manif police hollande valls ami avec etc situation agrave danger 	negative
bfmtv hollande conspu ê par propre camp serait hausse blague 	negative
« burkina faso modè pour ’afrique » françois hollande 	objective
intéressant change entre deux hommes gauche 	positive
sondage hollande sarkozy coude coude morano hausse sident publique passe 	objective
bygmalion que branches pourries soient coup plus rapidement possible 	negative
sum quinquennat hollande faire prendre vessies pour lanternes faisant poches vivement 	negative
suis aussi perdu dans vie hollande sidence moment dur	negative
colè policiers «nous voulons voir hollande personne » via figaro	objective
hollande montre optimiste saint nazaire pour mistral via boursorama	objective
hollande plus bas dans sondages 	objective
Échange entre francois hollande sebastien benoî cgt par ouestfrance françois embrouille 	negative
syndicaliste cgt refuse serrer main françois hollande solidarit avec air france 	objective
comme deux sont pas connus pour être sanguinaires voir sarkozy seront dit discrétion gendaire 	negative
eurasies syndicaliste cgt refuse serrer main françois hollande solidarit avec air france 	objective
françois hollande chant amour pour israë via bfmtv	objective
saint nazaire hollande ô dialogue social via boursorama	objective
mal pour bien hollande pas euro joueurs pourront profiter coffee shop pays moins	mixed
turquie aurais pas erdogan arda lukums lahmajuns sais pas aimerais autant	mixed
algerie peu comme hollande ont ê quipe mais gagnent 	mixed
parisien bygmalion lavrilleux accuse sarkozy « fausser» pas «assumer» 	objective
antoine nantes salon agri qqn dit pas bjr hollande tape lui aussi dira pas casse toi pauv con lui 	mixed
fausse vit dans monde irr sait pas assumer lavrilleux propos sarkozy dans lenouvelobs bygmalion	objective
quel cin hollande nom ’ mistral cach veille visite françois hollande via sputnik 	negative
delegue cgt interpelle hollande nazaire que denoncez violence patronale reponse evasive 	objective
lavrilleux ’ pas envie ’apprendre nager dans centimètres ’eau comme robert boulin 	objective
presse devoir rendre compte chute hollande hollande tombe devoir rendre compte chute regime	negative
françois hollande rainbow flag via lenouvelobs	objective
bruno retailleau françois hollande faut pas sous estimer moins chef etat habile manoeuvrier 	objective
france hollande plaide pour dialogue social sur orange finance 	objective
notre dame landes hollande procédures doivent être poursuivies via presseocean	objective
hollande alerte israë morts plusieurs bless pasmot compation comme dias honte gouv qui peur ombre 	negative
françois hollande dans antre latinistes 	objective
françois hollande ’enterrez pas rapport winock bartolone sur institutions via lemondefr erepublique	objective
militant cgt qui pas serr main hollande respectueux ferme poli meilleure maniè procéder 	positive
video deux syndicalistes refusent serrer main françois hollande 	objective
turquie attentat ankara erdogan admet possibles faillances via rfi	objective
hollande grande gueule devant peuple avec gardes corps derriere tele micro mais tout teux xfe devant syndical	negative
hollande chantiers navals saint nazaire plaide pour dialogue social 	objective
lavrilleux ’ pas envie ’apprendre nager dans centimètres ’eau comme boulin hikaru 	objective
louis sarkozy aime bien mentalit 	positive
sondage hollande sarkozy coude coude morano hausse ouest france 	objective
mlp officiel «nicolas sarkozy ment» nicolassarkozy ment eur jlavrilleux 	negative
presidentielle voterai fhollande tour via tweetvoteorg	objective
«contrairement claude ant ’ jamais coffre fort dans lequel pouvait entrer debout» 	objective
pour sauver cop amis bygmalion qui ont tourn argent ump lavrilleux enfonce sans apporter preuve 	objective
intégralit interview ù lavrilleux enfonce nicolas sarkozy bygmalion 	objective
visiblement hollande france largement assez lespaystrèsbas	negative
interview exclusive bygmalion ô lavrilleux enfonce nicolas sarkozy bygmalion	objective
attentat turquie erdogan reconnaî possibles fautes etat via franceinfo stratégie lections 	objective
fugi lourde responsabilit duo sarkozy bhl via youtube	objective
primaire droite pas remise question bureaux vote selon ’entourage sarkozy 	objective
hollande valse croatie ira france 	objective
french news attentats ’ankara erdogan admet probables « fautes » pouvoir trois jours that all 	objective
les observateurs video deux syndicalistes refusent serrer main françois hollande 	objective
les observateurs « race blanche » morano monte dans sondages sarkozy baisse 	objective
interview exclusive bygmalion lavrilleux enfonce sarkozy 	objective
faut appeler affaire bygmalion mais celle comptes campagne sarkozy lavrilleux lenouvelobs 	objective
sarkozy ramè hollande qui tape dedans	objective
lavrilleux faudrait plus appeler affaire bygmalion mais celle comptes campagne sarkozy 	objective
françois hollande raconte failli clater rire entendant marine pen traiter vice chancelier 	objective
les policiers sainte rita ont rejoint opposants noncent nullit hollande taubira Ç sent fin 	negative
sarkozy jupp accord france pas pays immigration vers quota immigration 	objective
politique actualit popularit hollande valls jupp hausse sarkozy baisse politique	objective
interview exclusive ô lavrilleux via lenouvelobs	objective
fxs finance interview exclusive bygmalion lavrilleux enfonce sarkozy finances matières premières 	objective
bygmalion lavrilleux soutient an françois cop accuse nicolas sarkozy Ç tanguer 	mixed
attentas turquie hdp pro kurdes nonce implication erdogan vostfr via youtube	objective
candidate juppéiste profite grand meeting limougeaud nicolas sarkozy pour enfin marrer campagne nslimoges	objective
hollande macron dans collimateur cgt 	objective
ment ô lavrilleux enfonce nicolas sarkozy dans affaire bygmalion dit menac 	objective
primaire droite sarkozy veut diminuer nombre bureaux vote brilit malsain via lemondefr	negative
info news bygmalion lavrilleux accuse sarkozy pas assumer 	objective
thode hollande bat 	objective
aprè sarko parle responsabilit bygmalion sarkozy fausse sait pas assumer accuse lavrilleux 	negative
qui connais pr t politque hdp akp non haha mais vote quand ê trop fort erdogan inconscience controlenatioparentale	negative
echec sarkosy echec hollande pendant ans pas photo	negative
violence hollande qui reste poste savou par majorit français gouvernement incompétents qui ruinent france 	negative
bilan hollande plus sident ouvriers cqfd saintnazaire 	mixed
bygmalion ô lavrilleux enfonce nicolas sarkozy via lenouvelobs	objective
untempsdepresident donn image positive françois hollande tweetvotez via tweetvoteorg	objective
mais lavrilleux homme qui renseigne presse pas tord celui qui parle hein lavrilleux 	mixed
bygmalion lavrilleux enfonce sarkozy dans itw obs fausse sait pas assumer 	objective
droite croyait avoir parti bureaux vote pour primaire avant intervention sarkozy via lemondefr	mixed
photo jour mappa mundi albi class patrimoine mondial unesco 	objective
avons nouvelles onarda derniers mots françois hollande avant ’être fusill janvier 	negative
interview exclusive bygmalion ô lavrilleux enfonce nicolas sarkozy 	objective
françois hollande russeurope que è discours hollande devant parlement europ 	objective
france aujourd hui hollande dit non ayrault 	objective
primaire lesrepublicains voterai nicolassarkozy 	objective
Échange entre francois hollande sebastien benoî cgt vid dailymotion 	objective
sondage hollande chute libre 	objective
cabinet noir lavrilleux qui accuse sarkozy dans affaire bygmalion espè pour lui sait nager 	objective
bfmtv medef sait plus quoi dire face hollande	negative
pour gagner tout prix quipe campagne sarkozy bafou ègles calcul itw lavrilleux par vlazard bygmalion	objective
sarkozy fait meeting pour vpecresse lendemain agents municipaux distribuent tracts thodes bygmalion jaichoisivalerie	mixed
salopard françois hollande veut gagner sidentielle devrait envoyer lettre deschamps pour que giroud joue plus 	negative
hollande bien fait pas facher pour main retiree car commencer comprendre que dialogue fera sans licenciement	positive
une femme violemment interpell macron lyon disent dias moi vois que violence gorilles 	negative
sarkozy clara compatibilit publicains ump devint publicains pour lui sont publicains sauf 	objective
lavrilleux sarkozy vit dans monde irr grands chefs sont pourtant ceux qui assument» 	objective
sarkozy parle fnps reconnaî juste ’insu plein ’ phase que compatible avec pen qui parla umps 	negative
popularit hollande valls jupp hausse sarkozy baisse bfmtv compo sarkozy	objective
france maroc amis com sarko hollande 	objective
directeur adjoint campagne nicolas sarkozy livre rit sur rapages financiers pour lui 	objective
sarkozy force chuter dans sondages ont trouv trole 	objective
fonctionnaires ternelles cibles magogie exump vpecresse dans lign sarkozy touchepasàmonservicepublic avecbarto	mixed
les policiers qui manifestent saveu cinglant taubira hollande valls qui è faire èche babouches arabie 	negative
bygmalion lavrilleux accuse sarkozy pas assumer lepoint	objective
lavrilleux livre journaliste qui sorti affaire bygmalion 	objective
vot hollande mais pkoi complice apartheid israë honte selon onu regarde plus octob	negative
€ pour conférence avec nicolas sarkozy – zapping actu 	objective
heure ù sont nocyd par ami taniahu idiot hollande veut solution onu pour irak mali octo	negative
françois hollande laurence smith doit pas mourir signez tition team	objective
campagne sarkozy aurait û € selon lavrilleux bygmalion itw è riche infos politique 	positive
emmanuel macron chahutÉ plein discours À lyon 	objective
popularit fhollande manuelvalls alainjuppe nadine morano hausse nicolassarkozy baisse 	objective
opposition intensifie attaques contre erdogan aprè attentat ankara institut kurde paris kurdish	objective
turquie orhan pamuk critique erdogan aprè attentat contre kurdes institut kurde paris 	objective
protè personne mais ’arrive ’avoir peur ’ pas envie ’apprendre nager dans centimètres 	objective
lavrilleux parle ’antisémitisme ’égard cop quand ê pas rien 	mixed
pub avec poutine mcdo aimez moi pas certain 	negative
françois hollande rattrap par conflit air france via francetvinfo	objective
violences air france hollande macron dans viseur cgt journal via mytfnews	objective
sondage ascension nadine morano chute sarkozy lejdd normal faut assumer que dit 	negative
hollande dit non ayrault sident publique françois hollande ferm porte management	objective
bygmalion lavrilleux ’ pas envie ’apprendre nager dans ’eau comme robert boulin 	objective
minutes hollande mains tellement salles faut nettoyer pays profondeur lieu occuper autres 	negative
comptes ont bord ô ’ que sarkozy pour dire dans position que affaire concerne pas campagne 	objective
popularit hollande valls jupp hausse sarkozy baisse 	objective
quand vois lavrilleux dis triste doite molle Être fusible triste destin pour gloire sarkozy plus 	negative
etais pas trompee votant aubry primaires presidentielle vote hollande pour choisir moins mauvais	negative
ump fausse vit dans monde irr sait pas assumer ô lavrilleux pas main morte concernant sarkozy 	mixed
hollande violemment heures mans annule tour piste 	objective
ump grands chefs sont pourtant ceux qui assument continue ô lavrilleux pour tacler nicolas sarkozy 	objective
international interview exclusive bygmalion ô lavrilleux enfonce nicol see more	objective
ump ô lavrilleux site ici pas critiquer nicolas sarkozy sur fameuse valeur responsabilit 	objective
annamartin partez principe hasardeux que sarkozy serait meilleur adversaire face hollande rien moins û 	negative
françois hollande voix sidentielles tour bretagne ille vilaine 	objective
tait pas quand rien dire court risque voiler françois hollande russeurope 	negative
attentat ankara erdogan reconnaî probables fautes pouvoir europe 	objective
expression quotidien erdogan rompt silence lexpressiondz 	objective
affaire bygmalion ô lavrilleux accuse nicolas sarkozy fausser pas assumer francetvinfo	objective
finalement merci pour moment sera pas adapt cin 	objective
hollande walls macron seraient contents changement qui retrecit porte monnaies vont avoir peur aussi	negative
est bien pris qui croyait prendre bygmalion sarkozy enfonce cop justice via lepoint	negative
pense que hollande walls macron doivent suivre volonte peuple francais qui croient plus	negative
video yaourt t vers macron hollande apostroph cgt fie gouvernement 	objective
hollande triste relent rien foutre destin français ômeurs autres	negative
Énormément è plus pays turquie erdogan palestineresists	positive
françois baroin explique pourquoi soutiendra nicolas sarkozy non alain jupp primaire 	objective
primaire voil ennemie pour sarkozy 	objective
budget hollande pas convaincu par ayrault 	objective
affaire bygmalion sarkozy « tais sident ump tais courant rien »	objective
budget hollande ferme porte amendement ayrault via lepoint	objective
hollande rocard « ’est ’ami qui distingue ’homme» via libe	objective
primaire mauvaise excuse sarkozy via lepoint 	objective
top infos flop intox interview exclusive bygmalion ô lavrilleux enfon see more 	objective
lavrilleux charge sarkozy 	objective
cortexcrime fholonde plus mauvais sident hollande françois	negative
clinton pense faut pas laisser faire face poutine demdebate	objective
les attentats ankara trouvent origines syrie affirme erdogan 	objective
clinton assure ira plus loin obama pour gularisation immigrants 	objective
poutine critique etats unis sur question frappes syrie savesyria	objective
europalia festival belgique qui sert propagande sultan erdogan veille 	objective
attaques ’ankara impact sur gislatives novembre via france	objective
visionnaire hubert drine mois « bien chance ait pas pire que poutine» 	positive
force montrer muscles risque ponse plus plus grand obama « reculerons 	objective
fxs finance attentat ankara erdogan reconnaî fautes pouvoir finances 	objective
erdogan admet fautes «probables» 	objective
tait ê chose obama tait inconnu bataillon avant monte que criviez romans sur lui 	mixed
erdogan proximit avec daech extrêmisme religieux pol anti kurde favorisant attentats provoquant 	negative
poutine turquie important partenaire russie 	objective
turquie erdogan recueille sur lieux attentat ankara ankarabombing	objective
itele turquie erdogan recueille sur lieux attentat ankara ankarabombing	objective
sident turc recep tayyip erdogan recueilli matin sur lieux attentat ankara	objective
attaques ankara intensifient conflit parti kurde avec erdogan auto pickup wikyou	objective
turquie erdogan recueille sur lieux ’attentat ’ankara afp	objective
turquie erdogan recueille sur lieux attentat ankara sident turc recep tay press yahoo	objective
alerte turquie erdogan recueille sur lieux attentat ankara ©afp octobre 	objective
revue presse attentat turquie erdogan reconnaî possibles fautes etat 	objective
turquie erdogan recueille sur lieux attentat ankara 	objective
afpfr turquie erdogan recueille sur lieux ’attentat ’ankara afp	objective
turquie erdogan recueille sur lieux attentat ankara 	objective
erdogan recueille sur lieux attentat sident turc recep tayyip erdogan recue lefigaro	objective
faillance services curit turcs ayant men attentat ankara erdogan peut pas appliquer 	objective
attentat turquie erdoğ train colter sem 	objective
ebp pro news turquie erdogan recueille sur lieux attentat ankara 	objective
û sans conteste avoir faillance assur sident turc trois jours aprè attentat plus 	objective
poutine ordure fasciste âtard kgb qui roule caniques sur peuple russe mat 	negative
turquie trois responsables police ankara limog aprè attentat yahoo actualit france via yahooactufr	objective
turquie trois responsables police ankara limog aprè attentat 	objective
congo turquie erdogan recueille sur lieux ’attentat ’ankara 	objective
erdogan rend sur lieux ù fait faire sauter hommes nosra pour renforcer opinion publique turcs	mixed
revue presse attentats ankara erdogan ordonne enquê complè 	objective
revue presse attentat ankara erdogan admet probables « faillances» 	objective
À ankara erdogan recueille sur lieux attentat 	objective
turquie trois responsables police ’ankara limog aprè ’attentat afp	objective
turquie trois responsables police ankara limog aprè attentat par afp 	objective
afpfr turquie trois responsables police ’ankara limog aprè ’attentat afp	objective
que voulez sourtout oubliez pas carte identit gang mangeux poutine 	negative
