sarkozy compatible avec publique ans aprè tellem bien devant que ump devant paraî moins publicain 	negative
matin quipe blm tait sur march canet roussillon quelques jours tait saint laurent 	objective
inquiétant moignage ancien policier etat islamique sur orange actualit 	objective
abou moussab policier daech dans flux fugi pour rejoindre europe 	objective
cimentier lafarge goci avec ’etat islamique syrie 	objective
françois fillon « ralisme administratif fini » peuple britann ump 	objective
syrie offensive sol dans airs nord alep syrie guerre etatislamique	objective
vladimir poutine chine pour renforcer coopération conomique via rfi	objective
’inquiétant moignage ’ ancien policier ’etat islamique aprè faut pas tonner que brexit ait gagn 	negative
pourquoi dsk tweet partie ruzzle 	objective
russie analyser conséquences brexit selon poutine 	objective
quenelle poutine pays euro atlantistes ont foi satan 	objective
vladimir poutine insulte barack obama hollande defend puis booba 	objective
amande lafarge pour avoir donn millions tat islamique ainsi ôner terrorisme faire tuer français sur sol	negative
ret rat faux ump ignore sur palesti ump limin gisla doubs jupe ridiculise claq que but pour sarko june	negative
ump coude coude intenti vote dit ’ils bouche bouche intenti pote flirt trisomiq sarko ’amante religieuse 	negative
qui vladimir poutine 	objective
’inquiétant moignage ’ ancien policier ’etat islamique facilit pour type franchir frontières	mixed
’inquiétant moignage ’ ancien policier ’etat islamique qui dit que avons pas dup beccanada	negative
poutine « pro t grande eurasie bien videmment ouvert pays ’europe » vid 	objective
paris match syrie russie bombarde province contrô par ’etat islamique 	objective
bfmtv pas quipe suisse mais quipe ’État islamique dieux tait avec pologne chrétienne bravo polonais 	positive
syrie russie bombarde province contrô par ’etat islamique 	objective
poutine monde train ’être pouss dans direction irréversible 	objective
europe garnison usa 	negative
train manger poutine mexicaine klc axorm 	objective
syrie – ’attaque surprise russe met fin manœuvres dilatoires kerry extraordinaire poutine vive russie 	positive
État islamique officiellement province philippines 	objective
les observateurs ’inquiétant moignage ’ ancien policier ’etat islamique turquie aide directement 	objective
appel sesp poutine politique internationale via wikistrikew	objective
europe islamophobe pas nouveau mais lui erdogan comme cible flipp jaouad naser bfmtv nicolassarkozy	negative
captive ’etat islamique aura ’autres orlando ’êtes plus curit 	objective
erdogan envisage rendum pense que turcs majoritairement veulent pas europe jaouad naser bfmtv nicolassarkozy	mixed
guerre contre pkk pas kurdes qui sont turcs turquie ont massivement particip lire erdogan limportant 	negative
brexit poutine nonce attitude superficielle gouvernement britannique via matins	objective
publique française encore pas plus que ump veut proportionnelle gislatives rendum 	negative
poutine daech grand vainqueur brexit	mixed
poutine aucun obstacle ’adhésion iranienne ’ocs via dznews app 	objective
poutine mosqu moscou « djihadistes figurent ’islam » 	objective
chine russie affichent proximit lors visite poutine breaking now	objective
quel rapport avec erdogan considérez merkel comme hitler jozefiakjp limportant 	mixed
syrie russie bombarde province contrô par ’etat islamique parismatch	objective
blasphemons pas parti pas pro poutine fend qui juste critique qui pas point	positive
nicolas sarkozy ô france être leader europe sarkozy ump	objective
sident chinois jinping homologue russe vladimir poutine sont engag approfondir mani 	objective
« laurent berger fait manuel valls » selon cfdt haut viennoise via lepopulaire 	objective
erdogan demande enlever trump immeuble istanbul û islamophobie trump 	objective
valls dames landes manuel valls dans remake zelda par militants anti roport 	objective
bhl onpc parler sang contamin sofitel ’antisémitisme fabius dsk dis israë tue car palestiniens suis antisémite	negative
poutine puis dille poulet restaurant chez patrice 	objective
sarko cout pris flagrant lit fillon cout avec jouyet ump pas accord fbi lui coute fifa inculpe pour corruption 	negative
rtl chine russie affichent proximit vues lors visite poutine belga side 	objective
pollution dans oural poutine russie pollution	objective
vladimir poutine visite kin « alli proche » via lemondefr	objective
comment sarkozy ump ont offert sur plateau agent regardez parmi vid sur bisoubinours youtu 	negative
poutine demande humanit rentrer sistance pour viter eme guerre mondiale via stopmensonges	objective
françois hollande valls suffit signez tition via change	objective
pourquoi pas dsk sur liste candidats aussi mise examen anciens condamn compétences prime pour nation	mixed
hassak ’arm syrienne milice sutoro reprennent villes ’État islamique via christianophobi	objective
insist auprè hollande valls ayrault pour promouvoir erasmus apprentissage longue dur 	objective
bfmtv valls condame toujours tout avec hollande soutiennent aussi moi sais faire avec mots mais font rien 	negative
erdogan rencontre chef hamas avant conciliation avec israë contenu 	objective
hollande valls quand ont appris brexit desnuls dehorslessocialos	negative
manif officiellement interdite officiellement autoris tourner rond statique valls obtus confus manifjuin	negative
schengen merkel donne raison marine fait passer hollande valls pour billes 	objective
syrte sur ligne front entre forces progouvernementales ’etat islamique via lemondefr	objective
afpfr snowden snowden idiot utile poutine	negative
plus hypocrite que manuel valls meurt	negative
juin nouvelle journ action contre loi khromi loikhomri valls initiativespubliques social	objective
exclu intégrale interview nicolas sarkozy sur lci 	objective
nicolas sarkozy cgt menace gouvernement 	objective
derniè provocation porc dsk	negative
rendum sur europe nico sarko pas accord entre eux 	mixed
bmoon bee valls amateur compar erdogan 	negative
lelab communautarisme chez sarkozy stes condamn mis examen lesrepublicains eciotti	negative
vie selon valls casse necker affaire etat suppression postes forme sant bonnes vacances sale con	negative
exclu dreuz – message nicolas sarkozy bnvca « toujours ô dans lutte contre ’antisémitisme » exclu dreuz message nicolas sarkozy bnvca toujours cotes dans lutte contre lantisemitisme 	objective
actu politique video brexit nicolas sarkozy envisage rendum sur nouveau trait europ 	objective
Ésultats êtes penser que manuel valls doit quitter gouvernement 	objective
turquie erdogan î avec transexuel aprè avoir envoy police briser gay pride ’istanbul turquie erdogan dine avec transexuel apres avoir envoye police briser gay pride distanbul via 	objective
quel vivre ensemble valls quand voulez bannir voile femme musulmane universit que voulez blancs whites blancos	negative
primaire cnip petit parti droite courtis par sarkozy cop lejdd 	objective
poutine fait tout petit depuis hier rase murs kremlin lui foutre brexit sur dos allez voir 	negative
« chevalier noir » nouveau enregistr par russie cot station spatiale iss via stopmensonges	objective
liban demande que russie fournisse davantage ’aide soutien liban dans combat contre 	objective
incapables corrompus èche bottes crif sinon aurait pas taux ômage diversit discrimi palestine sacrifi june 	negative
’inquiétant moignage ’ ancien policier ’etat islamique via lobs	objective
important lire ordures umps mentent trompent danger guerre ’appel sesp poutine 	negative
nicolas sarkozy prend vraiment français pour imbéciles 	negative
brexit sarkozy demande nouveau trait europ incroyable 	mixed
notre dame landes pour valls « non ’emporte pro t sera abandonn » kongossa	objective
nicolas sarkozy sur france demain partir 	objective
ïeul sarkozy eme ècle crois qui fut capit par ottomans pas tout lang agent secrettr aurelien	mixed
est que sarkozy regarde cropor sur site strinic 	objective
russie offert samedi vedette quip missiles croisiè supersoniques moskit marine 	objective
russie offre vedette lance missiles egypte via sputnik 	objective
u tue u gardiens sont ômage beincenter	negative
erdogan annonce rendum sur candidature turquie entr dans unioneuropéenne brexit	objective
quand massacre lieu syrie que auteur soit coalition russie assad breaking news suis untel 	objective
plus grande mosqu monde xfe xfe xfe xfe russie tout simplement pas assez grande 	negative
qui sont ouvriers ’aujourd’hui 	objective
revirement sarkozy sur organisation rendum sur europe rediff	objective
finalement aussi tiens avait oubli courbe ômage france inverse pas ballot faute brexit sic	negative
brexit françois hollande sonde chefs partis impression partag par 	objective
refondation europe devient è ma ur primaire droite via figaro	objective
investiture polémique balkany sarkozy lui ê mis examen invoque somption ’innocence lablaguedujour	negative
coup soleil fait taille russie	objective
une captive ’etat islamique met garde « aura ’autres orlando ’êtes plus curit » ancienne captive letat islamique met garde aura dautres orlando netes plus securite 	objective
brexit nicolas sarkozy appelle refondation europe 	objective
pourquoi traître valls soutient israel nom vrai scandale 	negative
daction figaro attendant ordres sarkozy pour primaire ripoublicains 	negative
primaire cnip petit parti droite courtis par sarkozy cop 	objective
aprè brexit sarkozy veut nouveau trait europ via figaro ❓ ❓ ❓ rendum pas nouveau trait 	mixed
cameron fait tudes kgb dans ê classe que poutine tout explique è bien quand lucide 	negative
aprè brexit sarkozy veut nouveau trait europ via figaro referendum sur lequel assis 	negative
emploi hausse nombre ômeurs mois mai 	objective
pour qui roule snowden via anfouche usa nsa russie	objective
sarkozy niveau vigilance doit être adapt sans lai 	objective
chute popularit françois hollande manuel valls stabilise sident plus bas juin 	objective
actu politique chute popularit françois hollande manuel valls stabilise 	objective
sarkozy qui veut refaire coup nouveau trait comme 	mixed
brexit hollande fait tourn partis politiques 	objective
notre dame landes valls met pression zadistes 	objective
guerre contre syrie guerre contre russie arm 	objective
chine russie signent plus accords coopération — chine informations scoopit 	objective
investiture polémique balkany sarkozy lui ê mis examen invoque somption ’innocence via lelab 	objective
nouveau record impopularit pour françois hollande via wordpressdotcom	objective
profitez arrivera pas souvent poutine europ 	mixed
afpfr gros mou hollande tellement incompétent gagera 	negative
sarkozy frexit faut pas avoir peur peuple quid non rendum trait lisbonne pour passer force 	negative
poutine avec brexit encore fait conneries fie toi encore multiplier manœuvres militaires frontières 	negative
marine pen aprè entretien avec hollande « ’ clam rendum refus » meme pas etonne 	negative
ils veulent referendum pour brexit avec palier faire pareil avec lection hollande 	negative
chute popularit françois hollande manuel valls stabilise politique	objective
les premiers virer avant union europeenne gvt hollande serait medias merde bon rien juste bon foutre bordel xfa xfa xfa 	negative
lafarge arbre qui cache forê entreprises françaises qui gocient avec 	negative
incarnez manuel valls dans «notre dame landes u vid » via libe	objective
farange instar hollande compris mocratie plus sur moyen pour être passe par mensonge politicien à	negative
coup fait comment angleterre gagne euro dieudonn kebetu	objective
finalement rien chang depuis sauf que ump sont limin ux brexit peut être 	mixed
ils ont temps pourri mines ferm ômage plus haut maintenant cropor respect suislensois	mixed
brexit propositions hollande sont bricolages pour an europe europebrexit pro 	objective
faites suivre voil explication pourquoi gvt hollande gocient pas car allemagne qui commande 	negative
brexit hollande consulte chefs partis elys 	objective
aprè brexit sarkozy veut nouveau trait europ via figaro 	objective
russie ’odyss franco russe dans ’espace poursuit degaulle soyouz iss esa exomars kourou	mixed
appel sesp poutine comment poutine sait sans doute parle dans sert journaliste 	objective
sarkozy soumis diable fera toujours politique diable	negative
hollande ferme tagueuleconnard 	negative
quel pantin sarkozy vraie girouette clown qui fait pas rire affligeant blm ripoux	negative
quand fait plaquer rien exiger hollande incapable comprendre contrô rien 	negative
ômage devrait pas exist fais oui oui avc hochement ê continue sur colonisation que mal patatipatata	negative
ômage entraî mort français par 	objective
bygmalion vol vers israë ’ami dsk suicide madoff sarko politiq ’enrichissent sinon sont arabes voleurs 	negative
hollande qui pensait assoir sur pont commandement seul ô merkel surpris par souhait associer renzi 	objective
brexit hollande consulte pour finir stratégie française vidÉ sident publ politique	objective
nicolas sarkozy pisse dessus essaie faire croire pleut 	negative
hollande deja pas faire passer loi travail mais veut rer aprè brexit	negative
cri alarme vladimir poutine menace nouvelle guerre mondiale bien elle 	objective
match rappel hollande argentine coupe monde cropor	objective
brexit pays fondateurs veulent que londres engage sortie plus vite france via france	objective
les decins ralistes demandent millions euros hollande via bfmbusiness	objective
oubli consulter citoyens que locataire sommes propriétaires 	negative
voici pkoi france hollande cie risibles que dible del discriminati croissante silence sur 	negative
quand peuples re ttent qui opprime symbole chec europe sociale hollande pond curit immigration 	negative
primaire droite affranchis qui osent fier nicolas sarkozy politique via lepoint	objective
planche billets bce ecb doit êter directement etats cancres politiques nicolas sarkozy mlp officiel 	negative
direct brexit didier seeuws nomm pour gocier sortie royaume uni via minutes	objective
hollande accroche tel moule ê stratégie ê vision politique ê sensibilit ê look ê 	negative
capupatriote hollande assis comme gosse pieds vitation piti vivement 	negative
bygmalion vol par amis cop vers israë ’ami dsk suicide bas madoff ’impression ’israë vit vol june	negative
russie femme ayant habitude bronzer cul fenêtre agace voisins 	objective
inacceptable sauf pour hollande israë ait moy terrasser gaza juste pour pargner soldat palestiniens agress rien june 	negative
euronews kin poutine ressert liens avec chine proche alli points vue afrique	objective
Élys rescap quinquennat françois hollande kongossa	objective
appel sesp poutine faut parer guerre ventuellement nucléaire xfa 	negative
viens tomber sur photos grand poutine fest envie poutine terrible avec bacon xfd yummy	positive
nicolassarkozy sur francetv demain dans partir 	objective
brexit fillon demande aussi rendum sur nouveau trait paris juin ump 	objective
brexit françois hollande prend température politique france avant berlin 	objective
france ômage repart èrement hausse mai 	objective
edward snowden nonce loi « big brother » « surveillance masse » 	objective
françois hollande emmanuel macron nicolas sarkozy rama yade âche sur classe 	objective
primaire gauche françois hollande sentera via teads labs	objective
russie syrie ’arm arabe syrienne pulvérise camions citernes daesh 	objective
lagarde ’union européenne doit affirmer clairement ’elle reste ouverte ecossais irlandais nord 	objective
À russie edward snowden nonce loi « big brother » « surveillance masse » topstories	objective
erdoğ menace ’ ’ rendum sur ’entr turquie dans ’europe 	objective
occident pour exclure russie qui propres raisons occuper crim pkoi jamais pour israë june 	negative
ptdrrrrrrrrrrrrrrrrr mais vida deux doigts rejoindre etat islamique	mixed
croatie fait penser russie 	objective
pas pire injustice depuis limination russie demi 	negative
abroger loi sur ’interdiction statistiq ethni ’est pas ’int ê enfants sarkozy hollande tte ’oligarchie constitutl 	negative
â poutine russie ’est relev ans tout apporter france 	objective
françois hollande brexit interrogation pour toute planè conomie	objective
primaire droite affranchis qui osent fier sarkozy pol comme mam qui propose revenir ans lafolle	objective
aveuglement bleu grecs mayas mantique tymologie miologie linguistique chine mayas 	objective
aprè brexit hollande chefs parti elys 	objective
poutine brexit «personne envie subventionner conomies faibles» 	objective
russie edward snowden nonce loi « big brother » « surveillance masse » adopt press yahoo	objective
russie merdes donc rabat sur pologne	negative
sarkozy finit schizophrè fait faute politique qui coupe base autre morale absurde pour perdu ’avance 	negative
valls qui ’ cherch gard dophilie ’église ’aut traîtres politiq compatibi islam raie publiq èsera pas lourd 	negative
poutine demande rsquo humanit rentrer sistance pour viter eme guerre mondiale via stopmensonges	objective
chine lance nouvelle fus longue marche fus deux tages qui doit devenir prin voa	objective
hollande avait solutions pour sauver pays lors primaires cela sera sacr surprise pour tout monde pour lui onpc	negative
nicolas sarkozy dimanche invit laurent delahousse dans france 	objective
chine racheter europe via figaro	objective
basoutos plus guerre sur continent europ â quilibre terreur entre usa russie pas â 	negative
ptdr maillot russie sont vente flash bon laissez trql	mixed
candidats pour primaires chez publicains peut donner envie valls senter onpc onpcofficiel	mixed
investitures gislatives jupp craint hold sarkozy 	objective
sarkozy tais situation proposerais pro t cinq points pour jdd	objective
chine lance avec succè fus porteuse nouvelle ration longue marche chine lanc avec 	objective
erdogan propose que ’ teste sang put allemands ’origine turque erdogan propose que lon teste sang deputes allemands dorigine turque via expressbe 	objective
’opi favo qui être ans cisions boulettes penser que hollande représente pour pas dirais 	negative
plus que marre donneurs ons adeptes partisocialiste gofh qui nigre vraie gauche pas celle valls macron 	negative
honte rien sarkozy tais situation proposerais pro t cinq points pour lejdd 	negative
politique ômage syndicats èmes abord par coluche ’ont pas perdu actualit trente ans 	negative
tais situation sarkozy sur brexit via lejdd	objective
aprè brexit sarkozy veut nouveau trait europ 	objective
françois hollande brexit – russeurope 	objective
brexit poutine nonce attitude superficielle via newsrepublic 	objective
quand lafarge travaillait avec ’etat islamique syrie obs sanctions viennent quand 	negative
chine veut riger grandemuraille sous marine merdechine	negative
vidÉ vote britanniques met gravement europe preuve dit hollande 	objective
europe disloque pendant que État islamique devient plus fort choisir gagnant	negative
fait ans rit plus trop triste regardez attendant retour sarkozy another hour 	negative
les flops euro turquie burak russie ukraine portugal	objective
brexit hollande prend température politique france avant berlin bruxelles politique via lepoint	objective
brexit marine pen clame rendum fin non recevoir hollande via bvoltaire	objective
pour sauver soldat hollande ruquier fait hebdomadairement taf onpc	mixed
olivier besancenot invit politique onpc xfd 	positive
nocide centre afriq visible avec juste soldats français ptit hollande lourde responsabilit crimineljune 	negative
temps accueillir invit politique olbesancenot onpc	objective
quand aura politique sarmement haiti plan curit nationale 	mixed
funérailles samedi militant politique Élusca charles	objective
festival lin chine pire truc monde atroce gens rigolent devant 	negative
propos absurdes stupides centrafricains ont sollicit intervention france cenfrafrique merci pdt hollande mialdon	negative
vous croyez chomage westeros 	objective
piti pas olivierbesancenot è philippepoutou avec lui moins rit sens que itw politique sera longue chiante onpc	negative
olivier besancenot invit politique onpc enfin personne intéressante dans mission 	positive
bygmalion coutes sondages affaires qui pourraient freiner nicolas sarkozy – metronews via metronews	objective
vladimir poutine veut chef ’etat islamique “vivant” “exposera cadavre” ’ 	objective
local sud poste vast avons jamais soutien maire ministre evry valls 	objective
politique ’autruche chakib khelil ’épreuve justice italienne 	objective
allez dans province zhejiang chine mangerez peut être tongzi dan agit 	objective
bibliospective livres moi bouquin chine clandesototi japon livre the	objective
royat toujours parmis feux artifice compétition voici chine seul que 	objective
onpc que capitaliste henry ford avait compris augmentant salaires ouvriers françois hollande infoutu penser	negative
medias xfb bfmtv itele quand hollande ete que lamoiti dupeuple ete contre avez pas parler avez touchercombien 	negative
union européenne assume loi khomri via figaro	objective
utilisation ment crise politique olbesancenot onpc france	objective
mocratie moix craqu ê hollande contre enfin celui avant onpc	negative
chine faire maroc base africaine 	objective
valls vraiment merde pire que rend ê pas compte	negative
politique encampement dans monde voulons vivre 	mixed
chine russie affichent proximit vues lors visite poutine 	objective
vraiment bon besancenot mais pourquoi pas plus loin politique qui vote pour lpna onpc	positive
cfdt cfdt cfdt dites leasalame pas besoin être journaliste politique pour constater toujours pli tout	negative
brexit nicolas sarkozy veut que france prenne initiative è forte via bfmtv	objective
valls casse toi pauvre con toi complices politique morte	negative
hollande peut être â par majorit lecteurs onpc	negative
discours lors congrè ’union nationale associations familiales politique	objective
onpc besancenot voulait faire partir sarko mettre hollande maintenant vient donner ons ê bon rien	negative
des camionneurs craignent nouvelle mesure curit frontiè complique travail 	objective
syrie ’attaque surprise russe met fin manœuvres dilatoires johnkerry russie	objective
gitimit hollande marche sur è nen jamais pour français avec politique socio libérale patrons onpc	negative
deadangelcatch sais Ç rend autant plus folle que avais haine france sarkozy ê chose 	negative
franfran hollande fait penser ravioli 	negative
aprè brexit hollande consulte partis monde	objective
olivier besancenot homme politique que aime plus ellement militant onpc	positive
onpc loi rate qui plus tait pas programme candidat hollande 	negative
quand yann moix parle littérature poustouflant quand parle politique êtissant onpc besancenot	mixed
brexit hollande trump rajoy merket pen agissent 	objective
vous avez terminer nouvelles lois raison parcours politique construire pour couvrir unproblè courvert par gouvernement	negative
poutine remet bush place 	objective
poutine demande ’humanit rentrer sistance pour viter eme guerre mondiale 	objective
certains ont rage contre sncf mais pas contre gouvernement tsais pour trouver excuses valls sont 	negative
Ç beau être sident diocre hollande plus ô que kev adams	mixed
qualit philippepoutou que ouvrier qui pas professionnel politique olbesancenot onpc france	objective
nouveau trait europ possible fin pour sarkozy presse 	objective
politique devrait pas être tier onpc	mixed
faut pas faire confiance personnalit qui vivent politique 	negative
onpc besancenot pas image politique parle avec tripes lea yann lui avais dis que allait deservir 	mixed
pour olbesancenot sidentielles faut pas voter pour pro politique mais vaut mieux représenter soi ê onpc	objective
prochaine coupe monde russie quipe sud ricaine qui gagn quipe avec nain numero oui jparle argentine	negative
besancenot entend que ann lections pas professionnel politique lol	negative
edernjimmy adhésion analyses upr fait pas re ter bloc aide être termin sans concession sur su t 	mixed
brexit cohn bendit tempê mais pas fin lepoint europe paralysee par interÊ nationaux oui 	negative
chine tisse route soie 	objective
olivier besancenot train casser baraque dans onpc onpc quand politique sens	positive
preuve que capitalisme accommode importe gime politique compris totalitaire intolérant etc onpc	negative
rentrant soir ptit zap sur onpc savais pas faisaient dans paléontologie politique besancenot fossile non 	negative
edernjimmy comme dit sont doutes sur qui mont fait tourner vers upr pas upr qui fait douter 	mixed
valls dit que chance pour pays que ’islam soit è religion fait rire mois tard ’islamo fascisme june	negative
selon assange wikileaks assez preuves pour traduire hollande justice awd news 	objective
syrie ’attaque surprise russie met fin manœuvres dilatoires kerry usa syrie	objective
facebook obliger employ suivre cours neutralit politique via lesechos	objective
suis officieusement vacance officiellement chomage devenue su t qui vexe pas peu honte 	negative
espagne demain matin ouverture bureaux vote pays dirige vers seconde âcle politique mois 	negative
pour fois invit politique pond questions pos pond pas ô plus tient propos plutô cens onpc	positive
ils sont moins marrant que trolls lotes clique traîtres hollande valls promoteurs loitravail medef	negative
deadangelcatch chirac seul qui gagn quelque chose quinquennat sarkozy popularit 	positive
syrie lafarge serait «arrangé» avec État islamique 	objective
selon julianassange wikileaks assez preuves pour traduire hollande justice wikileaks fra	objective
bravo sebastiendenaja denaja corrompu doit plus pouvoir être candidat via lepoint france	positive
