rencontre avec dodo saumure « connais pas dsk mais aurais aim rencontrer » carlton	objective
galè dimanche matin sur dsk marthe ans veut faire calins tout monde pourquoi pas être sident parce que 	negative
ann noire pour pqr seuls quotidiens gionaux ont pas ventes baisser tout palmarè ici 	objective
procè civil affaire dsk dans bronx aura pas lieu avant fin but avocats 	objective
heureusement que candidat pas dsk car lettres dsk sur ob t distribu bourget û bizarre	negative
voir soir sur excellent doc sur affaire carlton dsk francetv affaire carlton doc inedit 	positive
matin pour semer photographes dsk pas sit foncer sens interdit volant mini gareauxpv	objective
ben choisi ligne porte parole entre mensonge hulot calomnie dsk grandit pas madame nkm	negative
quand dsk voulait pas «rater» journalistes «tous pourris» 	objective
dsk adore pas journalistes litote touspourris	negative
garde vue dsk termin pas mise examen 	objective
video dsk ressort libre aprè garde vue lille carlton 	objective
mars mise examen pour prox tisme aggrav recel ’abus biens sociaux dsk aubry marrakech 	objective
garde vue dsk termin pas mise examen avant mars 	objective
rmc dsk pas fini avec justice dominique strauss kahn sorti libre mercredi longue garde 	objective
sarkozy hollande tait pas candidat que socialistes voulaient voulaient dsk maroc maghreb	objective
sarkozy pas hollande que voulait dsk 	objective
nicolas sarkozy pas hollande que voulait dsk via lepoint	objective
sarkozy socialistes voulaient dsk pas rigolo hollande 	objective
selon sarkozy voulait dsk pas hollande rigolo chose û français veulent plus sarko demago 	negative
hollande candidat suite pbl dsk espè être par antisarkosysme france pas besoin sident par faut 	negative
vous pensez quoi affaire dsk coupable innocent mme diallo myto pas fouinysondage	objective
cambridge dsk ’est pas bienvenu entre ’affaire sofitel celle carlton dominique strauss kahn 	objective
quand nicolassarkozy attaque dsk anne sinclair tranche dans vif Ç rite ê pas ponde lgj	mixed
depardieu dans ô dsk aime pas donc vais faire via lemondefr	objective
nouvelles saillies rard depardieu sur vision suisse aime pas trop français vid 	objective
depardieu aime pas dsk français 	objective
rard depardieu jouera dsk parce aime pas 	objective
quand soudain vidence pas depardieu qui devrait jouer dsk dans film bernard tapie 	mixed
sarkozy risque donc être â dsk toulouse faits divers comme jamais auparavant comment veux pas être parano 	negative
sarkozy plus faible moment mandat fait divers ouf dsk toulouse comment pas être parano sur élection 	negative
bientô debats camp dsk sous feu questions juge avocats diallo ont pas encore dit mot immunité	objective
juge tacle avocat dsk êtes pour dire que qui pass avec diallo pas mission chef fmi ouch	negative
coup â juge hausse pourquoi dsk pas invoqu immunit procédure nale 	objective
comprends toujours pas comment programme sarkozy passer d llaba mohamed merah slip dsk 	mixed
’affaire carlton prend tournure politique politique france gions france via addthis fhollande dsk	objective
dsk pas libertin mais homme brutal lire sur courrierinter	objective
affaire banon dsk hollande affirme pas connaître faits dans tail via lemondefr	objective
dsk aurait sans doute pas commis erreur mexicaine hollande car signe inexpérience relations internationales	negative
bfm instant matin dsk gliss galement bulletin dans urne sais pas pourquoi nerfs sans doute 	negative
effet papillon — second tour aurait différent dsk avait pas tir coup mohammed merah avait pas tir sept coups 	mixed
sarkozy veux pas gauche qui voulait mettre dsk elys pas comme avait soutenu pour nomination fmi 	negative
accepterai pas ons morale gauche qui voulait installer dsk elys dit celui qui install fmi 	negative
pensais pas iraient aussi loin accuse dsk sans dire plus sur via the guardian 	objective
les clarations dsk montre ventuels nostalgiques avait vraiment pas toffe chef tat nom pipe 	mixed
suis pas nkm quoi intervention dsk qui vise camp aurait oblig faire diversion grossiè avec kfi 	mixed
connerie dray avec dsk fournit dias texte pour pas parler kadhafi mediapart	negative
figaro flash actu dsk pas donn interview guardian via figaro	objective
royal valls moscovici fuient pour pas croiser dsk avant gens taient amis mais tait avant 	mixed
dsk pas donn itw guardian selon lemonde source diapart vaut pas euro demande pour lire article 	negative
quelqu pour signaler sarkozy que affaire dsk concerne pas pas scandale État 	mixed
dsk pas dans campagne pas revenir quelque maniè que soit dimancheplus 	negative
hollande renvoie dray dsk dans cordes pas être dans images qui laisseraient entendre revient dans vie pol 	objective
françois hollande dimanche dsk plus dans vie politique pas revenir 	objective
hollande dsk pas revenir dans campagne sidentielle crucifixion	negative
hey dsk nadine morano fait petite ê soir voulez pas aller seriez tellement place pour fois 	negative
selon plusieurs moins sents hier anniversaire dray proches hollande ont salu dsk ont pas chercher fuir 	objective
françois hollande dsk plus dans vie politique française pas revenir affairedsk 	objective
affaire carlton lille pour dsk soir libertines taient pas organis intention 	objective
matin partialit incroyable eur extraits pas cop menti sur diapart dsk toutes sauces rien autre camp	negative
carlton lille dsk assure avoir cru libertinage pas prostitution 	objective
france inter matin mettait sur ê plan document mediapart îner avec dsk genre partout pourtant pas ê chose 	negative
sidentielle direct sarkozy attaque moscovici valls sur dsk hollande gociera pas avec bayrou 	objective
forte tentation diatique mettre sur plan dsk financement illégal campagne pas temps parole 	mixed
invit pour dsk thomas hollande qui fait campagne pour è tait hollande savait pas honte mentir 	negative
royal qui quitte anniversaire dray parce que dsk Ç gueule pas violer hein 	negative
ump ont plus que dsk comme argument politique alors devrait pas avoir problè 	mixed
dsk chappera pas procè civil 	objective
face attaques sur anniv dray avec dsk gauche dignit pas rappeler voyages ric mitterrand thaïlande	mixed
royal sarkozy «doit pas chapper bilan» hollande non plus bilan corrézien soir samedi pour dsk car menti 	negative
point dsk sarkozy prendrai pas parti qui voulu retrouver avec enthousiasme derriè dsk 	objective
connaissais pas vie priv dsk ponce pilate pluscestgrosplusçapasse avecsarkozy	negative
sarkozy â cartouche dsk aurait sortir fiche banon trop classe pas fait	negative
roger petit sur dsk nicolassarkozy pris propre piege par fhollande pas possible dire comment connaî vie priv 	objective
les angles attaque choisis entr par nicolassarkozy matin dsk flanby montrent sait pas gagn hier soir 	mixed
roue secours pas tenu rang comment être surpis singeant tonton dsk ridiculis 	negative
fhollande ans premier secrétaire affirm connaissait pas vie dsk lgj	mixed
ans hollande pas capable moraliser guerini dsk comment faire ans pour france bayrou	negative
hollande connaissait pas vie privee dsk maintenant connait alors pourquoi etat major etait samedi anniversaire dsk	negative
parties fines ènes bestiales brutalit sexuelles viols union carlton mais heureusement connait pas dsk carlton	negative
hollande peut remercier valls comme ministre immigration lui avoir dit pas venir anniversaire dray car dsk tait 	negative
hollande nie avoir vent soir avant diffusion sur internet pouvait pas ignorer organisation 	objective
beau hein hollande ouiiiiii connaissez pas dsk vile menteur hollande votens 	negative
pour eme accusation viol dsk explique nouveau que victimes sont pas dibles 	negative
affaire dsk pas plainte pour viol washington 	objective
franchement dsk aurait pas toutes histoires aurait sident 	mixed
veux pas casser ambiance mais affaire dsk tait jour pour jour peut être changer histoire france	objective
lang sur condamnation ayrault tout pas grave lui qui avait dit pas mort homme dans affaire dsk retraite	mixed
honte sur lui tiens avais pas dsk clame million dollars nafissatou diallo 	negative
dsk demande million dollars femme nage sais pas que mec dans ê pour avoir aussi peu dignit 	negative
plainte dsk consulter brigittedusseau manque pas piquant apprend que 	objective
sarkozy assur croiserait pas dsk marrakech 	objective
comprend ê pas pourquoi fameux chris bieber tend avoir fans veut juste cho dsk ° 	negative
certains aiment pas france ênent pas pour quitter sarko qui connaîtra pas lagê marrakech 	negative
quand pas fini recommence dsk 	mixed
lautre veux clash salop mais travaill avec dsk regard violeur femme sans fense pas onte sorcier village	negative
les avocats dsk contestent fait puisse pas parler journalistes devant tribunal lille 	objective
viol faire amour femme sachant pas envie petitlexiquesocialiste dsk	negative
polémique lagarde bizarre comme peut insurger propos qui pas fait agir mois quand prononc par dsk	negative
lagarde vient finitivement enterrer dibilit fmi avait pas encore fait dsk malgr couteau surtout bite 	negative
benoithamon dans navette fluviale fait dsk qui adorait moyen transport rappelle pas normal tout 	negative
bouches ô candidat ump ê retirer faveur pour faire perdre pas dsk camp différent 	mixed
lire bonnes feuilles bacqu chemin sur dsk sais que lirai pas hop conomie 	negative
portrait valls point vrai regard sur ô è moins aussi intéressant que saga couple dsk pas lien 	negative
carlton prostitu qui mis dsk cause pas sent police 	objective
affaire dsk procureur police veulent pas que diallo ait accè dossier 	objective
èques fric etats unis ’est pas problè mais femmes ’est pas pareil 	mixed
bien pas être triste fin judiciaire sarko quoi changer avec dsk 	negative
dsk gomis ont pas ê maillot mais ont ê passsion violer	negative
’eternel veut pas mort cheur mais ’ repente ’ vive pour dsk 	objective
voil que pense nouveau sident pdt publique ’est pas aubry dsk ’est apocalypse now bartolone	objective
programmes dsk censure pas fiction rie figaro via tvmag	objective
suis peu perdu dans actu importante jour carla enceinte pas dsk sinclair par pas 	objective
quand afp emboî pas closer officialise rupture dsk sinclair via sociablesite 	objective
selon proche famille dsk traverse è mauvaise passe pas passe tout fait and that the problem lepoint	negative
filippetti dsk dangereux pour femmes sita pas soutenir avant sofitel 	negative
pas rater soir sur dans new york unit ciale pisode affaire dsk sens bien golri 	positive
vous aimez trop salir dsk alors pas touch fiouh 	mixed
aime qui facilement ans moins que certainement pas sortie dsk celle nyus	positive
affaire dsk crois autant que attentat septembre dire pas tout manipulationbonjour	negative
comprenaient pas comme tais poire pommes mais comme dsk espè jour trouver bonne 	mixed
depuis accusait complot contre dsk bartolone pas chang toujours aussi con 	negative
les affairesdups changement pas pour maintenant dsk guerini kucheida kaltenbach hollande 	negative
moment ann ù pas scrupule mettre dsk wong kar wai dans ê paragraphe 	negative
bientô aussi mission pour lang autre pour rocard tiens mission dsk sur drague serait pas mal sinon que normale 	negative
figaro france hollande entendu dans affaire dsk banon via figaro pas melange prive 	negative
figaro affaire dsk hollande tait pas tonn sapin via figaro propos contraires surprise moment	mixed
regarde pas adp mais tweets amis amussent drole humour blagues seconddegre 	positive
dsk cemomentoù colles main fesses alises aprè que pas femme hugobouhalassa aha	negative
nouvelle affaire dsk pas affaire moeurs change 	negative
fini lire night watch lindafairstein sur affaire dsk finit plus mal pour lui que dans non fiction dis pas 	mixed
voit saloperies grosdidier masson ’intérieur ê ump comment pas croire traquenard contre dsk fdg	negative
oui dsk pas dans rue chopait harcelementderue salonfeutré	mixed
pour premières vacances depuis quinze mois ont pas arrê depuis affaire dsk mai 	objective
dsk violence faite femmes ê phrase ministe franchit pas mantique tuvasavoiruncourrier	mixed
kahn shonnor lors affaire dsk clar pas viol simple troussage domestique 	negative
ecoeur par ’acharnement envers dsk crois pas violer femme plus grande que lui bonsens	mixed
aime pas tout acharnement fait dsk dois dire	negative
coup pensait avoir ussi coup mais non françois hollande bande encore mais pas autant que dsk 	mixed
certes concubine françois hollande pas aussi riche que madame dsk mais rit actions dans 	objective
affaire dsk inspire pas phane zagdanski express 	objective
camabdélis condamnations ancien bras droit certain dsk donc courant tout pas gag 	negative
« dsk candidat pendant quelques ann » mais tait candidat ditocrates certainement pas cdanslair	negative
film sur dsk ira ù fait mal pas politiquement correct dans film bas sur faits non nawak 	negative
gonfl mme photoshop adjani pas imiter annesinclair dans film sur affaire dsk vais pas prendre 	negative
visiblement xdeg connait pas somption innocence pour journaliste lci ê corse cela peut être problè dsk	negative
À « » corse matin ê pas fait divers mais avec dsk 	objective
anne sinclair « vais è bien merci mitterrand avait è belle phrase « ’offense pas qui veut » dsk	objective
anne sinclair ment pas paration avec dsk 	objective
donneur ons hollande oit dictateur ê dsk aurait pas fait usurpateur imposteur	negative
vacances corse dsk fait chasser propri rtl corses pas trouillards gauche 	positive
ami dsk finance cel trompe normèmment pas habitude partager normal trop è finance 	negative
breaking news dsk trouv nouvelle nana pourra pas dire connaissait pas envies 	mixed
toute vidence dsk cache pas explique vsd qui publie une photo avec nouvelle compagne 	objective
hollande qui parle redressement pendant devant chazal heureusement que dsk tait pas place aurait encore jas 	negative
dsk qui payait pas impô quelques ann faisait quoi liberation info 	objective
trouvais incroyable ait pas tenir marisol touraine furieuse contre dominique strauss kahn dsk	objective
pas con pas con tout lesechos dsk pour sauver euro 	positive
dsk pour sauver euro fait petit buzz dans monde dias depuis heures non pas que 	objective
dsk fait ere apparition diatique pendant que booba sort clip nement caramel ïncidence crois pas futur	mixed
dsk futur ministre budget gouvernement ayrault aprè tout socialistes sont pas connerie è 	negative
affaire carlton kojfer « suis pas prox è » 	objective
selon avocats dsk « savait pas » que meufs taient prostitu carlton bien manqu lire bile dites donc 	negative
gare tgv avignon dsk montait dans beau porsche cayenne blanc nacr pas temps gainer iphone pour photo 	negative
carlton dsk enquê pour viol class sans suite pas viol mais actes sexuels non consentis via lepoint	mixed
dsk clare dans point pas riche mais conseiller communication lui dit dire importe quoi maillot	objective
quand dsk pas empêcher penser qui encore bais lui 	negative
euros chez lue verte eelv ose demander combien touche sarkozy pour conférence pas celle dsk dias	negative
une crise direct ump battra pas affaire dsk nement plus diatis depui 	objective
accord amiable dsk nafissatou diallo annonc par times mais pas chiffre sur ventuelle transaction saura peut être jamais 	objective
nytimes voque accord entre avocats dsk diallo rendez avec juge semaine prochaine pas montant cis 	objective
selon nytimes accord finitif pas ete sign par parties qui retrouvent tribunal semaine prochaine dsk diallo	objective
ministre ump raoult jug pour violences sum sur femme pas dsk qui veut 	mixed
serait pas bon signe pour mocratie française dsk revenait politique pascalperri	negative
somme millions circule pour relation consentie entre adultes comme dit dsk pas consentie combien 	mixed
millions dollars heureusement que dsk innocent sinon dit pas èque ohwait	negative
affaire dsk diallo pas accord selon avocats dsk dsk	objective
vous êtes tellement moche que ê dsk voudrait pas violer dream zerrie live 	negative
image insolite thompson monte dans voiture pour chapper journalistes mais pas chauffeur dsk diallo	mixed
philippot seul rite affaire que avons pas dsk elys onvpsm	positive
selon patron put socialistes bruno roux dsk reviendra pas politique dsk dominiquestrausskahn 	objective
dire que nafissatou avait pas fait âterie dsk hollande serait toujours corrè tient peu choses 	mixed
vous savez dsk doit millions dollars naffissatou mais pas alors appelle cetelem dsk 	objective
aura pas ann plus sans dsk pourquoi dominique strauss kahn bientô reparler avec antoandre	objective
avocate dsk droit pas gagn 	objective
aime pas procè intention dsk tir profit financier galipettes seuls idiots croient	negative
avais pas compris que livre sur dsk couv tait dit par express 	objective
oublie pas dsk initiative conversion mariage gay ayrault oppos 	objective
faisant buzz sur cassez rends service copain dsk pas journaliste lille pour montrer chez juge 	negative
avons pas recevoir eux qui voulaient porter dsk sidence publique ump è plombs directan	negative
heureusement que pas dsk parce que avait û recaser toutes dans institutions publique 	negative
obs pas titr cochonneries avec cochon dsk plutô que histoire par pudeur sans doute aucun 	negative
lol jour contrairement nouvel obs express aurait pas publi bonnes feuilles 	negative
nouvelle affaire dsk marianne ditions stock ’avaient propos qui fut pas cas 	objective
’aime pas voyeurisme dont chacun devient complice lynchage collectif sign bhl 	objective
affaire dsk iacub livre pas interdit encart devra être ins publi nouvel obs 	objective
’aime pas mauvaise littérature suis pas û que bonne donne tous droits sign bhl 	objective
achèterai pas bouquin qui parle dsk aucune dignit morale quand couche avec mec juste pour crire livre 	negative
selon avocate dsk fait pas journalisme par trou serrure 	objective
livre sur dsk pas interdiction mais obs stock iacub condamn dominiquestrauss kahn 	objective
fameux mail dsk dont marcela iacub «souvient plus» qui met mal comm 	objective
livre sur dsk stock fera pas appel condamnation 	objective
nous sommes gouvern par anciens amis dsk premier su t sexualit œurs mariage pas condition peuples	negative
affaire iacub dsk jjbourdin rmc è avec lenouvelobs pas conception tier qui sali par monsieur joffrin 	objective
isabelle adjani jouera pas dans film sur dsk 	objective
chine cochons morts dans riviè pour fois dsk pas concern 	negative
« sir dsk plus fort que ambition politique» rard miller êtes ceux qui sont pas 	objective
oublions pas magouilles qui ont plac usurpateur dsk elys partisocialiste ump	negative
jour peut être laurent ruquier fera flop ten sans parler dsk jour peut être mais pas encore soir onpc	negative
gerard miller offre interprétation freudienne cas dsk doc que michelonfray ratera pas 	mixed
clip campagne dsk pas dit hein trouve peu partout depuis 	mixed
vous avez manqu clip campagne dsk sur musique panthè rose instant sur france pas grave 	mixed
dsk homme qui voulait tout pas seul avis personne droite dans document propagande dulcor 	negative
écoutez dsk pas plus ans canteloup europe	positive
hollande savait pas pour dsk pour cahuzac pour rini pas anticip dur crise mais que fait pouvoir	negative
fraudeur ministre budget pourquoi pas dsk ministre famille lang ministre petite enfance avec eux rien impossible	negative
rhalala moscovici pas chance chaque fois soutient quelqu cata dsk cahuzac 	negative
harlem sir exclut cahuzac normal mais rini dsk dray lui ê condamn pour recel pas problèmes 	negative
hollande sait jamais rien crise avait pas dsk homme cochon savait pas guerini connaî pas cahuzac savait pas	negative
info lci film sur dsk nafissatou diallo jouera pas propre ô people mytfnews 	objective
film sur dsk non nafissatou diallo jouera pas propre ô 	objective
interview exclusif tunisie ï ben ali « ’ jamais voulu faire mal qui que soit » depuis 	objective
auberge espagnole huffingtonpost gouvernement serait presque ô jouait pas ainsi avec pays 	negative
affaire sofitel dsk pensait pas que opposants iraient loin lejdd pens amis 	negative
quand dsk gratigne gouvernement via figaro demeure pas moins vrai politicien è lucide 	positive
rard depardieu sera pas pay pour incarner dsk dans welcome new york 	objective
« welcome new york » depardieu ’ pas pay pour film sur dsk dsk cannes	objective
journaliste france lit haute voix tweet su t film sur dsk mais ose pas dire gros porc 	objective
bande annonce film sur dsk sortie depardieu qui annonçait vais jouer parce que aime pas 	objective
depardieu ressemble pas dsk bisset sinclair mais sosie diallo lui sans quivoque rien voir	mixed
homme qui dit non leila ben ali frere belhassin achat orascom license tunisiana 	negative
« lagarde ’est pas dsk » tapie « colorful millionnaire » pour presse anglo saxonne 	objective
fmi renouvelle conf contrairement lache dsk cherche pas abriter derriè immunit 	negative
franchement tous signes apocalyptiques sont pas dsk sur tapis rouge bordelmondial	negative
question pourquoi alicebloodygirl rite pas vues ponse fait vanne sur dsk mai mai 	mixed
festival cannes pas gation forum davos rit philosophique accomplie mich 	mixed
peut pas faire tout client prox è ître malka avocat dsk carlton lgj	objective
affaire carlton dsk ficiaire mais pas pour autant prox è pour parquet via midilibre	objective
carlton dsk ficiaire mais pas prox è estime parquet lille atlantico 	objective
adp adore karinelemarchand mission niale â trouve ouverture courrier top naturelle gentillesse humour	positive
affaire carlton pourquoi procureur estime que dsk ’est pas «prox è » 	objective
jacqueline bisset joue pas anne sinclair dans film sur dsk 	objective
dsk donne nat estrosi juge pas normal politique via lepoint	objective
maire ump corbeil garde vue tout pour faire ombre cahuzac dsk pas è sympa 	negative
cette citation dsk laisse perplexe souhaite pas fustiger instrument pas utiliser mauvais escient 	negative
cile duflot ’aurait pas fait auditionner dsk nat cause pass ê fmi 	objective
chantal jouanno « pas udi qui penche vers modem modem qui droit rejoindre udi» 	objective
retour dsk serait pas improbable voir apparaître politician lover expressyourself	objective
video lors arrestation dsk comprenait pas passait 	objective
video dsk pas dig terrible arrestation par charlescarrasco	objective
affaire sofitel comprenais pas qui passait 	objective
sais pas qui effraie plus dans retour dsk homme expert conomique bfmtv	negative
dsk pas problè avec femmes par charlescarrasco	objective
lol jour via ellefrance dsk pense pas « avoir problè avec femmes » 	negative
bien non pas non lieu dsk renvoy devant tribunal correctionnel pour prox tisme via parisien	objective
derniè avocat dsk savait pas que filles taient prostitu sans commentaire 	negative
différence entre dsk hollande dernier bien bais mais pas accus prox tisme pourtant paye cher	negative
quand dsk donne conférences mun choque pas gauche mais quand cop drame poidsmesures	negative
alerte info figaro parquet fait pas appel renvoi dsk devant tribunal pour prox tisme 	objective
carlton parquet lille fait pas appel renvoi dsk correctionnelle afp	objective
dsk jug parquet fera pas appel 	objective
renvoi dsk correctionnelle pouvait pas ignorer ’ ’agissait prostitu sudpresse	objective
affaire carlton abattage pas libertinage afp dsk	objective
pour juges dsk pratiquait abattage pas libertinage mais finition juridique 	mixed
dsk femmes abattage carnage selon magistrats pas excuse paie prix 	negative
toi non plus comprends pas pourquoi dsk bringuebal entre renvoi correctionnelle non lieu carlton 	mixed
fil presse û excision afrique fes travail mais pas galit real women baird gais juges dsk 	objective
petite entreprise connaî pas crise dsk euros chiffres affaires par mois 	objective
ï ben ali surnomm « femme plus test tunisie » via parisien	objective
valls itele contrairement que peux entendre aucun laxisme laxisme ceux qui ont laiss passer loi dati 	objective
« pas hollande que voulait comme candidat voulait dsk » nicolas sarkozy	objective
pense que ’analyse politique conomique dsk doit pas être pass par pertes profits karine berger 	objective
’ arrive demander dsk ayant put voteriez pas ’absorption bromure dose guliè 	objective
dsk anne kaaris bigle doit jou dans bigdile fdp mdr off fait pas 	negative
souhaite pas serbes ê destin que etat grec lui aussi conseill par experts dsk	negative
cahuzac avait raison lutte classes existe pas prenez dsk preuve pauvre type peut diriger banque 	negative
hapsatousy dsk ê banque pas club strip tease legrand	objective
video affaire carlton pour ren kojfer sans dsk pas affaire 	objective
dans affaire leonarda regroupement familial peut pas être utilis aucun membre famille visa rach dati dimanche	objective
ils ont fait ègles pour aucun modifie systè gauche droite ê aprè dati rama tour ghali 	negative
les amis dsk dans media toujours manoeuvre ration dsk retour doutent rien pas gagné	negative
index xml titre quand ê surtout quand article aucun rapport fail metronews index xml 	negative
golè royal chaî toujours autant passions aime teste laisse aucun cas indifférents bien jou madame 	positive
quelle humilit golè royal fait aucun tweet sur initiative âtrale alors rencontr franc succè diatique hier 	positive
carnage suis û que met dsk dans sondage popularit fonce tout ’ pas u mots 	negative
internet fixe illimit deutsche telekom pas droit brider bit del certain plafond 	objective
pas parce pourri tort dsk 	negative
quand dsk viole femme chambre racisme pas 	negative
barbier allez tout ê pas comparer marion dsk mlp officiel bouff charpe 	negative
bref crois pas comme pour dsk mohammed merah compagnie savent font 	mixed
