exergue livre valls phrase vaclav havel ’avez pas propos poste pour que mente tour 	objective
françois rugy pas parti ù ministres donnent tempo pour ensemble eelv vallsàmatignon 	objective
cinéaste claude lelouch qui avoue avoir vot pas regretter pour sarkozy rare dans milieu alors rite être soulign 	positive
jacob ump su t aujourd hui politique hollande pas valls majorit politique directan	objective
obama tait dans gion voix nord pas grill poisson avril vdn 	mixed
poutine rite petite claque mais bon peu pas tuer â russe faut juste essayer comprendre crimeetchatiment	negative
debbouzejamel anne hidalgo crois pas que soit bonne nouvelle pour parisiens rien changer comme hab 	negative
accords ump udi vendredi soir jpb qui sera maire pas bianchi 	objective
yacinezerkoun « peut pas permettre ’avoir identitaires racistes nophobes » 	objective
electro font pas bon nage positiv festival musique lectro quitte beaucaire lindépendant 	negative
emmanuelli abstiendra sur vote confiance gouvernement valls avec autres put crisederégime 	negative
remaniement passation pouvoir entre ayrault valls aura lieu mardi pas maroc maghreb	objective
ration pas calais rebelle contre solférino 	objective
cologie politique doit pas serter responsabilit causes clich con sur personne manuel valls gauche 	mixed
passe quoi pourquoi militant front national follow vient adhè pas jamais 	negative
bilan catastrophique oui pire pas tarder 	negative
que vont jouer eelv aime moi non plus sans doute remaniements servent carrièriser amis pas autre chose	negative
exclusif pro t secret eelv pour paris minibus sans conducteur pour relier gares mobilit ransport 	objective
noel mamere monde consc que cologie primordiale bien pour faut pas confier imbéciles eelv 	negative
valls couvre difficult ’exploration gaz schisme eelv	objective
ces put eelv qui montrent gros bras contre socialistes ont put car investis par eelv fauxculs	negative
dadou comprenez chose colos tout monde ravi que gagiez gouvernement vallspremierministre eelv 	negative
eelv poser loi pour transgenres via figaro	objective
union eelv risque être peu chaud	negative
les lus eelv opposition pays basque anglet georges daubagna bayonne marie picard felices ustaritz cecile stmartin	objective
sondage lecteurs sympathisants eelv pour participation ministre cologistes gouvernement 	objective
shumacher devient quoi lui faite 	objective
shumacher dans coma aprè accident ski cristiano ronaldo dans coma aprè accident voiture qui tour 	objective
manuel valls fendu publique comme jamais dans affaire dieudonn rite être promu onvpsm	positive
sais pas dois rire pleurer voir royalsegolene retour gouvernement remaniement	mixed
nouvelle ministre Écologie royalsegolene pas particulièrement favorable pro t nddl 	objective
’aime pas ligne soc lib mais royalsegolene najatvb chtaubira voil ont trucs faire ’est important	mixed
ouf golè royal pas ministre Éducation nationale joititude 	positive
remaniement energie faut rappeler que royalsegolene ministre cologie nergie agit pas redondance	mixed
tais pas fan golè royal avec temps appr discours contente rentre gouvernement 	positive
imagine pas que royalsegolene ait pas obtenu garantie que chasse familles roms trangers cessera stopracisme	negative
sais pas laquelle deux entre trierweiler gayet plus folle rage voir royalsegolene ô flanby 	mixed
revivez annonce nouveau gouvernement valls — via liberation info 	objective
remaniement couvrez nouveau gouvernement images paris nouvelles 	objective
fleur pellerin absente nouveau gouvernement arnaud montebourg ê numérique 	objective
remaniement gouvernement qui rappelle celui pierre govoy via figaro	objective
gouvernement trouilloteur aigu quoi nouveaut encore enfumage premiè 	negative
ump moque gouvernement « digne ive publique » via lemonde pol	objective
ministres sur sur twitter voici liste flaviennoel 	objective
golè royal gouvernement faire tout que voulait hollande dans semaines annoncent sont couple 	negative
remaniement ministériel lool	negative
remaniement jour ù verts ont arrê faire cologie express via lexpress	objective
remaniement pacte solidarit doit passer par numérique hautcommissaire via figaro	objective
taubira garde sceaux publique menti mais reste car populaire gauche hallucinant remaniement	negative
roman maikin vainqueur tape sochi pas suspendu 	mixed
remaniement Ç être dur pour tchobiloute suppl dominique baert sauf dans fourn secrétaires tat roubaix	negative
peillon part laissant «refondation» ’école inachev via lesechos remaniement	objective
remaniement ministériel composition gouvernement composition gouvernement matin 	objective
equipe france appris que jamais rien perdu verra match retour 	positive
rolalalal shumacher veille ’espè tous œ aura sacr quelles wake mickael	mixed
fense monaco givet rodriguez squillaci ibarra evra Ç fait pas super peur 	negative
Ç fait ans que suis jamais truc pareil peur dernier rendeznouslom omaca teamom	negative
maiwenn tomauriault ehliminateur stahflo supporters supporters soutiennent jamais baise	negative
football clas qui prouvent ’anelka veut toujours domenech 	objective
jour proche lyon redeviendra philo mais marseille redeviendra jamais 	mixed
anelka porte couilles plus rien perdre 	positive
comment mangala peut pas être quipe france place evra kolscieny 	negative
voila pris places pour psg handball phenomenes abalo hansen airbus mais qui gagne jamais	mixed
’ toujours cru que faisais ’ jamais mis genou terre anelka	objective
anelka trop bonhomme argent rien respect tout	positive
jamais finale real madrid psg fais soir ldc jpaye bouffe tise tout tombera quand serai seul	mixed
ils respectent pas ribery	mixed
ils foutent gueule lautre signe nazi rien anelka juste quennelle ramasse presque € amende	negative
qui noie quelqu pas plongeon mais fait rester sous eau paulo coelho citation	objective
rtssport suivi skieuse fannysmith titre mondial ception sotchi par rtssport	objective
europe nouveaux parcs attractions ouvrent sotchi russie ungersheim france rome italie 	objective
valls conseil ministres pour leonarda dieudonn pour france puis cantine pas terrible bricq	negative
malgr toutes barres fer que eues dans roues suis toujours debout jamais mis genou terre anelka	objective
’espè ’ mettra autant ’énergie redresser pays ’ mis combattre dieudonn ê crois pas dans lespoliticiens	negative
que soit insultes domenech quenelle nicolas anelka regrette rien pour savoir plus 	objective
qui doute psg encore lui ferme gueule tout jamais 	negative
fondation lilian thuram Éducation contre racisme coles parrain stephzibi ducation thuram	objective
folies sont seules choses regrette jamais pastore psg teampsg	objective
selon sports anelka avale pas quenelle	negative
montreuil dans pas calais homme tague messages pro dieudonn sur propre maison 	objective
« choix ravanelli ’imposait pas ajaccio»	objective
“ jay tordjman fresque alis dernier murs commanderie tagu etait pas utile	negative
boukacheche suis pas sur soit non plus hauteur è pas chaos moncef marzouki	negative
quand joueur atteint sommets êtise anelka avale pas football sports 	negative
ils ’ont ê pas respect club peu être saccord avec dirigeants mais fresque histoire ’est antiom 	negative
nicolas anelka « dieudonn tait ami ’est devenu è » croah 	objective
affaire quenelle anelka juste voulu faire « dicace è dieudonné» france french	objective
nicolas anelka dis tout domenech dieudonn valls sum interview brulante via dawgzfr	mixed
nonce premier faux pas scandaleux ministre sports lors psg chelsea toulouse 	objective
quenelle jour quenelle tjrs nicolas anelka «dieudonn tait ami ’est devenu è aujourd’hui» via galafr 	objective
quel idiot anelka valls combat dieudonn parce que femme juive 	negative
ê fou nuit retourn accrobatique complètement rat toivonen danze suit ê plongeante vsl pas monition fcgbsrfc	mixed
presse francaises journalistes merde arreteront faire chier psg pourra jouer tranquillement	negative
labrune anigo vis par tags insultants teamom ligue 	objective
gaudin veut que club paye loyer teamom ligue 	objective
tags injurieux envers labrune anigo centre ’entraînement teamom ligue 	objective
psg blanc enfin prolong 	objective
murs commanderie tagu 	objective
psg pastore parti pour rester 	objective
psg ibra encore prim 	objective
romao « peux mieux faire»	objective
yvan littolff « sport vecteur ’intégration»	objective
part couille rende fou tous dirigeants merde	negative
bientot but javier sur bein sport pastore psg beinsport	objective
chance jlaisse incapable pas talent ribery fini mort placard	negative
shumacher michael schumacher dans coma depuis fin cembre montre moments conscience veil 	objective
les courses jour tape triptyque monts âteaux dans hainaut tape tour maroc tape sotchi	objective
coach qui ’ jamais rien gagn part titre champion tournoi toulon anelka sur domenech hahaha	negative
franck rib femme wahiba big love sur parquet 	positive
ann prochaine ligue champions avec psg inside asmfc monaco losclive faut montr ’europe que france sente 	mixed
bilan ligue champions psg chelsea ldc	objective
quipe france ètre sur central palais sports an weille daviscup	objective
plus ibra heureusement pour psg cavani 	positive
edf anelka regrette rien pour domenech lors mondial attaquant nicolas anelka avait insult 	objective
franck rib wahiba amoureux joyeux ê quand bayern perd 	objective
psg pourrait être interdit utiliser recrues estivales ann prochaine 	objective
vid equipe france minine angers 	objective
voici compilation meilleures actions capitaine quipe france boris diaw sous maillot 	objective
interview exclusive anelka dit tout 	objective
une quipe combat unie resserr expériment pour redresser france dans justice equipevalls	positive
lentement mais ûrement shumacher commence reprendre conscience formule formula 	objective
pas mal maillot extérieur quipe france fff 	positive
psg anelka aurait revenir sans club depuis part wba quelques semaines nicolas anelka 	objective
anelka toujours cru que faisais jamais mis genou terre »	objective
anelka charge encore domenech «  insult coach que tout peuple français insultait » 	objective
anelka « messi cristiano ronaldo sont deux extra terrestres jamais joueurs qui marquent buts par ’existe pas »	objective
ldc real benzema « gagn avec maniè » 	objective
vous aimez trop interdire trucs pour rien jumu moubarak dis voila	mixed
lafarge holcim gocient fusion pour ant ciment 	objective
dictateur mauvais toutou dans œ porte kadhafi saddam moboutu	mixed
onu veut bizarrement pas intervenir û kadhafi devait être vraiment dangereux que terroristes	negative
holcim discute fusion avec lafarge qui erait ° mondial 	objective
ciment lafarge holcim veulent fusionner lapresseplus 	objective
les ont tent vendre sinaï juifs moubarak dans enregistrement audio salauds jusqu bout 	negative
zine elaabidine ben ali leila avaient fait ê pourtant plus surprenant encore sont personnes 	mixed
syrie interview opposant haytham manna change conneries nanalyses experts balles 	positive
pas difference entre separation politique religion politique chef chaine tunisie tunisia tnelec carnetdoute	mixed
meilleur ô an dujardin öbius loup wallstreet non dans mois ferme dure sec voir 	positive
plus grande erreur que jai faite durant scolarit pas demander bourse 	negative
ciment lafarge holcim gocient fusion entre gaux hinfo alors aura plus concurrence benmer	mixed
est que usain bolt court plus vite que ben ali îtregims	objective
plus temps passe rencontre que nine marx avaient raison finalit capitalisme monopole 	mixed
bce modélis effet rachat milliards euros actifs sur inflation via newsrepublic	objective
appris vente pechiney arcelor rien voir futur lafarge dieu rit hommes qui plaignent 	negative
moncef marzouki donnerait pas pour moments pure populisme bourguiba pathétique	negative
syrie bachar assad front soutien ’etat islamique peuple syrien syrie assad	objective
« eclipse sur ’afrique – fallait tuer kadhafi » – an ping ballera tout sans langue via lecongolaiscd	objective
seul problè politique budgétaire française donner excuse bce pour rien faire 	negative
bce distribu milliards banques fin banques êtent plus pas argent comprenez pauvres 	negative
ciments français lafarge fusionner avec suisse hocim 	objective
comment peut defendre sacr fdp comme bachar creve lui nasayri alaouite couilles	negative
bce pare assouplissement quantitatif modèles sont ê mais rien cid bce 	objective
reportage vision nationale sur bourguiba pas seule fois nom ben ali cit falsification histoire 	negative
ciment bientô ° mondial lafarge holcim voileront lundi pro t fusion economiste via sharethis	objective
’espè que michel sapin pas inverser cours bourse 	mixed
ils soutiennent assad mal log sont envi par alain soral super reportage sur ofascistes romains 	objective
donc gens qui soutiennent bachar assad gime qui èrent poutine videmment 	mixed
situation ras dir centre ’ entretien phonique marzouki abou sahmin 	objective
aurais mort sans bachar allasad	positive
loup wall street triplement ê pas ussi regarder jusqu bout 	negative
financement sarkozy par kadhafi patron dcri entendu par juges 	objective
bce lations mario draghi font baisser euro finance 	objective
bce parerait assouplissement quantitatif atlantico 	objective
tunisie fais peur peu mecs comme ben ali peuvent peta tout royaume enfuire sans scrup 	negative
lafarge holcim voileront lundi pro t fusion via newsrepublic 	objective
lafarge ° ciment fusionne avec suisse holcim ù sera è social futur groupe suisse royaume exil fiscal 	negative
loup wall street pas dingue tout regarde juste pour dicaprio 	mixed
bce pare terrain pour baisse prix ’euro voici comment 	objective
bce in cter monnaie dans conomie oui mais pour qui destin principe banques quanti 	objective
lafarge sfr etc fusions maintenant dans ans rejouera air small beautiful pour redécouper tout 	negative
’ publi nouvelle photo sur facebook 	objective
prsdt assad ussit sistance patriotique syrie accompagn ’ processus formes mocratiques 	positive
ciment pourquoi lafarge holcim veulent fusionner 	objective
bce pare terrain pour baisse prix ’euro voici comment dailyfxfrance 	objective
è coles pour enfants reconverties casernes militaires parmi pro ts veloppement assad	negative
nike abusent sur prix	negative
loup wall street comment dire nul ennuyant oui ê pas fin tellement tait long 	negative
sfr vendu numericable pour milliards euros tss incapables valent ê pas millions 	negative
viens regarder loup wallstreet vraiment super ador 	positive
face menaces flation bce promet soutien banques mediapart scoopit 	objective
ciment fusion entre lafarge holcim annonc lundi revue presse bfm	objective
fusion lafarge holcim conseils ont donn feu vert 	objective
affaire sarkozy quinze ans dans ombre kadhafi lejdd via lejdd	objective
comment curiser windows sans mises jour microsoft informatique	objective
tranch sfr sera rachet par numéricable pas par bouygues 	objective
ciment fusion entre lafarge holcim annonc lundi 	objective
sfr faignant ê pas ont service client 	negative
numericable lancera augmentation capital mds€ 	objective
loup wall street chire vrai 	positive
lemondefr numericable lancer augmentation capital pour rachat sfr 	objective
lemondefr borloo rwanda afghanistan sfr coupe davis infos retenir week end 	objective
rachat sfr bouygues accuse coup doit inventer figaro ironie histoire 	objective
prochain sponsors fus maroc Éton lafarge	objective
gros lol pub numéricable avec sebastien loeb	positive
sfr cassez couilles	negative
allo sfr que toi qui compte mdddddddr maaevapeereiira	mixed
numericable pay mds€ pour sfr ensemble èsera mds€ clients mobiles internet fixe via capucine cousin	objective
rachat sfr avenir pour groupe bouygues 	objective
sfr numericable alliance qui repose sur convergence fixe nouvelle publique mobile 	objective
dixrit loup wall street jordan prison fin boite saisie 	objective
aime bien loup wall street mais tant donn que comprend rien bourse bah trucs qui chappent	mixed
avenir fait vraiment peur niveau travaille encore personne ômage 	negative
chomage sorte guerre 	mixed
toujours pas voqu putes soir bizarre bernard villardiè cialiste enqueteexclusive	negative
portrait nanard villardiè dans lenouveleco nomiste û pas cher acheter journaliste pute peu coke 	negative
premiè bernard villardiè dans pas droit erreur 	objective
aprè pas trop ripoux zoneinterdite cest heure vrais dans enqueteexclusive avec bernard berger villardiè tpmp	mixed
villardiè « pas droit erreur » vision figaro via tvmag	objective
quoi sert faire matraquer par fisc ficit toujours pas que dette baisse pas 	negative
ouf craignais être plus vieux candidat lection sous publique mais alainjuppe remporte palme bravo 	positive
dette française progress depuis ’élection françois hollande que rajouter plus twystsky	negative
sera pas lection sera insurrection jlmelenchon lenchon 	objective
royalcalin € rien ô ont û fraude bygmalion duc fisc sarkothon c ssey sarkothebest 	negative
lection sidentielle è gogos ù robinet magogie sudradio bordetsudradio	negative
pour faire clic lection hollande pas mal non lisent apparatchik socialiste what happened next was incredible 	negative
pas remaniement faut nouvelle lection sidentielle 	negative
primaire montebourg voterai pour françois hollande yeux meilleur rassembleur 	objective
donc mine rien gauche campagne pour lection sidentielle vient commencer 	objective
gouvernement valls plus courts publique via figaro 	objective
jours premier gouvernement valls restera plus ères publique 	objective
valls pas super ros imagine être	negative
hollande valls croyait avoir touch fond mais fond plus profond que croyait catastrophe pour françaises 	negative
mitterand rocard ans plus tard valls montebourg remaniement	objective
sic par valls gouvernement impopulaires pour boire coup pour faire fous pas payer verres 	negative
europe • valls vire rebelles via courrierinter	objective
“ mission gouvernement aussi affaire franco allemande” 	objective
direct remaniement verts refusent intégrer Échos 	objective
point constit peut utiliser que sur texte par session être compliqu pour valls majorit troite 	negative
baromètre ipsos point manuel valls chute libre politique via lepoint	objective
direct action sur franceinfo chaos personne peut liciter chaos 	objective
jocondeofficiel bonjour elysee pour remaniement propose candidature parle pas agis pas bon 	negative
marine pen appelle dissolution assembl nationale sidente 	objective
communiqu ’elys tellement tellement mais tellement 	mixed
palestine ice bucket challenge fait avec gravats via lehuffpost	objective
une è ê palestine occup sera dur gime apartheid sioniste respecter engagements pas û 	negative
ptdr badr hari dit faites rien pour palestine fais pas ice bucket machin bien intelligent 	negative
patronne fmi christine lagarde mise examen pour gligence france via newsrepublic fmi tapie 	objective
air france desservira plus freetown sierra leone comme vient recommander gouvernement français 	objective
certains juifs ont besoin rapie profonde fatiguez pas plus rieux que toiles ebola 	negative
è madame lagarde place resterais washington reviendrais plus faire appas politique tribunaux fhollande	mixed
air france suspend vols sur freetown pays touch par ebola plus plus isol via emailit	objective
savoir plus sur ebola precaution prendre	objective
actu belgique christine lagarde mise examen pas commentaire fmi fmi assur sport showbiz 	objective
eve avait pas croqu pomme aurait pas sales maladies comme ebola pfff	negative
affaire tapie christine lagarde mise examen pour gligence directrice fonds monétaire international entend pas mis 	objective
une autre ê incertaine gaza tant que indépendance palestine pas acquise massacres reprendront jour autre 	negative
bambino afpfr christinelagarde femmes plus compétente doit effrayer certains politiques vue lections futurs	positive
ebola air france suspend vols vers sierra leone pas trop tot via parisien	negative
uneviedecombat culture rale discriminatoire culture syndicale comminatoire pas combinatoire 	mixed
arretez dire que belkacem desir sont pures français ont nationalitees française alrgerien 	mixed
instrumentalisation cole belkacem âche pas mots 	mixed
video vallaud belkacem remplace hamon forme rythmes scolaires sera pas touch via francetvinfo 	objective
ministre enseignement aurait rable ritable ministre education qui vient être nomm 	negative
sous sarkozy comme fmi lagarde meurt mais rend pas 	positive
quelle injustice ceux taxe sont non respons erreurs politiq finance comme palestine pas payer pour france 	negative
vallaud belkacem investissement avenir € pour quartiers sensibles rien najat mais changera rien comme hab august 	negative
lorsqu’ ’ aucune intuition dagogique peut avoir que occupations ologiques poke najatvb oct 	negative
bonjour perd pas temps pour essayer lancer nouvelle polémique ministre — christian aud 	objective
clementravaud lagarde fmi now tirent balle dans pied comprend plus rien 	negative
video christine lagarde exclut missionner poste fmi via francetvinfo bien trop beau poste 	negative
quand ’école servira plus ’ construire sera devenue lieu non pas formation mais formatage 	negative
lorsqu’ ’ aucune intuition dagogique peut avoir que occupations ologiques fxbellamy najat 	objective
gouvernement valls vallaud belkacem veut «pas 	objective
tarmo lagarde pas que lagarde tous corrompus passeront jour autre 	negative
nvest avenir belkacem mais com centralien ô depuis car arabe emmerde fad françois jacques nicolas najat aug 	negative
fmi • christine lagarde mise examen aussi presse anglo saxonne rappelle que ’est pas pre 	objective
actu europe fmi • christine lagarde mise examen aussi presse anglo saxonne rappelle que ’ 	objective
barberis dominiquelunel lagarde moment sont bien tristes car ont plus rien mettre sous dent canine pref 	negative
hdebonnevolonte ytheze pas è brillante belkacem 	negative
ebola air france suspend vols vers sierra leone cision caractè provisoire qui prendra 	objective
forum • israë palestine 	objective
interroge sur que pourrait reprocher lagarde avoir pas diligent recours qui auraient û millions supp 	mixed
ebola inquiè conséquences conomiques bad mobiliser millions dollars aprè avoir octroy 	objective
ebola entraînera baisse pour cent pour cent pib afrique ouest bad 	objective
flexion belhassine claire paysage sociale sur frontières internes 	objective
affaire tapie christine lagarde mise examen pour gligence 	objective
plus personne parle palestine plus trop mode	negative
ebola population ’ikela appel viter viande singes chauves souris radio okapi 	objective
ebola onu bloqu million dollars pour aider rdc 	objective
ebola air france annonce suspension provisoire vols vers freetown è udi sante	objective
severine serres lagarde art simplifier pour noyer poisson 	negative
enquê sur directrice fmi pour affaire corruption src nouvelles	objective
plus belle chanson sur palestine avec coeur raison kery james coutez version longue	positive
enquê sur directrice fmi pour gligence dans affaire corruption france 	objective
tapie christine lagarde paie donc pour conciliation priv cid elys 	negative
palestine enfants existent mais enfance existe pas	negative
shit fmi fait carton plein 	negative
mais christine lagarde pas dame 	objective
orie genre application dans èches najat vallaud belkacem via youtube	objective
exclusif document confidentiel qui accable najat belkacem valeurs actuelles via valeurs	objective
najat vallaud belkacem nomination politique hauts risques polared nvb esr 	negative
heureux otages lib occas pour rappeler que oublions pas palestine otage occidentale heu journalistes aussi 	mixed
israéliens par palestiniens dias fra causent palest par israë cherchant personne parle 	negative
gourmo abdoul plus cinglante faite ’israë depuis ation 	objective
cesser feu tient bon gaza netanyahu cuit ègle u israë gagnes pas guerre perds è 	mixed
affaire zara haut toil arrive pile quand soi disant cessez feu entre palestine israë 	negative
benjamin pas kif thevoice	negative
regarde the voice kids replay pas encore	objective
pas dire dans the voice meilleurs allemands australiens 	positive
coach thevoice allemagne dans lit peux dire que vais pas dormir dans canap 	positive
regarde the voice kids autres pays clair sont beaucoup plus dou que chez nous	mixed
viens regarder the voice kids non mais chantent bof bof hein pas tout comme dans autres pays waaaa suis 	negative
nerfs contre petits the voice kids savent chanter pas moi factsaboutme	negative
avais fait the voice quand tais gosse que personne serait retourn aurais prim toute vie	negative
cousins eloign second degr jsp faut the voice ann derniè mais connaissais pas ptdrrr	objective
non mais faut avouer que alis the voice kids savait pas chanter 	negative
nifer failli pas être coach dans the voice kids 	objective
styliniam indirects julie sespè moi nnifer the voice jsais pas quoi pire	negative
les allemand plus avoir voler cdm être fdp gosse the voice kids chantent comme dieux pnt fils pute 	negative
vous prenez ê avec vid mode the voice À chaque fois que clique attends voix mais jamais attend	negative
team yang yoseob dans the voice kid korea pas dire chire 	positive
liam encore ans factor liam ans ann prochaine aura qui appelle vie	objective
quand liam auditionne pour fois factor ans pas baiss bras revenu ans aprè memoriesaboutliam	objective
À zara ont pass wishing star factor avec jls toute compagnie etais choqu 	mixed
regarde premieres auditions xfactor trop choux onedirection	positive
demain the voice kids personne chante let è âble thevoicekids	negative
