total futur premier ministre marine publie que afflige 	mixte
vois entre finalistes veux partir sur mars avec 	mixte
vous croyez vraiment que voter blanc pas trop rejeter trouver comme mais allez posez tels	negatif
mais marine pen elle	positif
ans fils finance nouveau morceau via	autre
officiel pas monsieur encore fois parlez place 	negatif
excellente politique comme ouvrons champagne	positif
suis tel avec pote sert rien vais passer que vas passer vais	mixte
qui mais comment ose mais honte	negatif
officiel heu heu	mixte
pen mieux que —	autre
assume rien terrifiant sera avec lui sbires tragique	negatif
elle pleine panique malsain	positif
elle pas mais putain 😪	negatif
paysan cantal achetant € payant salaries airbus bien avions paie salaires €	autre
ale rien que penser alors arriver petite 	mixte
elle tellement rigolerais presque pas aussi effrayant	negatif
elle oublie ses	positif
presque heure triste spectacle soir	positif
euros plus chaque 	autre
pen propose augmentation propose par	autre
qui choisir passent temps taper sont eux 	autre
oui pas politique monsieur 	negatif
entre marine pen sur via	mixte
blague soir vais match via	positif
sera mamie vrai vrai	mixte
avez raison mais veut pas	negatif
grave que ont trouve convaincante 	autre
veut quoi quoi 	mixte
allez bonne nuit autres men fou ciao ciao	mixte
cette bataille laborieuse	autre
suite mauvaise prestation marine pen peut mettre main sur 	negatif
officiel saviez que sais trouveriez 	mixte
business future pour voter 	negatif
insinuation comme seul argumentaire vraiment fatigante	mixte
choisi par taper encore sur	mixte
pen que totalement sortant 	autre
elle insupportable franchement charisme repartie programme	negatif
marine pen sait que veut mot 	negatif
bon fait suffisait minutes	mixte
officiel fait plaisir voir sur internet temps 	autre
arrogant hautain rien 	positif
faire proposition mais que pas 	negatif
respecte mais manipulez — 	mixte
veux que chassions loin pays parti haine 	negatif
porte par sont tellement oublie bienfaits fait 	autre
pour que prestation officiel meilleur barrage	negatif
paris officiel euh vraiment que retenez	mixte
mais bien sur passera jamais elle fera comme face	positif
faire porter constamment fille propos juste	negatif
soir plus que jamais par restaurer monarchie vital	positif
gagnant soir officiel qui tente 🙄	positif
attention matin meutes tous ailleurs passent 	autre
pen victoire par marine pen bref bonne nuit	mixte
journaliste qui serait trop sensible charme 😄	positif
qui plus convaincu soir	positif
sur mur chambre soir tuer 	positif
connasse suis sure connais pas tables multiplication	negatif
proposez rien pour enfants que pour ceux cites comme quoi 	negatif
tiens anges programme sur maintenant	mixte
ambiance calme pen agressif arrogante irrespectueuse	positif
pleure bureau mairie car compris que leurre 	negatif
millions pauvres peuple toi 	autre
mais alors sauf tunisien lequel 	mixte
maxime fait que noyer poisson visiblement marcher	autre
ironise avant vienne avec pour lui tenir main final 	negatif
marine pouvoir serait folie marche	mixte
jean ego voila quoi mener 	negatif
elle officiel sur choses coupable 😂	positif
oui mais contre toi qui insultes vrais patriotes qui cesse manquer respect 	positif
viens signer fin 	negatif
soir appris que quitte euro lors jamais	positif
que sont ministre sera bon par que nul	negatif
que part couille	negatif
marine impression voir avec famille vieille tante qui	autre
ose parler affaires 	mixte
sinon pense question	mixte
battue plate couture calomnie injures les	positif
pourquoi gens comportent sorte 	autre
belge puisque reste chez toi aller bye 	positif
pauvre balle toute seule avec sourires cynique force toute	positif
quelle confusion marine aussi que fiches	mixte
aurais aime carte blanche sur culture mais bon	positif
qui sont infaisable qui peuvent finance 	mixte
suis par niveau femme	mixte
bravo avoir tenu sans gifler vote	positif
comme officiel avec 	mixte
avec vraie culture manque 	autre
marine veut reformer payant avec billets mais francs bien sur 😂	positif
vote premier tour abstenir mais avant quinquennat voterai	autre
qui vous parasite 	mixte
nomme mouvement marche alors aurait 	autre
partisans ont arguments	mixte
carte blanche heu plus fiches 	mixte
veux pas personne situation sans solution	negatif
merci parler personnes situation	positif
vous croyez avoir inventer eau	positif
crise nouveau franc arriverait bien trop vite franc jamais monnaie forte	positif
essayer pas parce font boulot vois	negatif
officiel bon ben toujours aussi fou 😜	mixte
maintenant comment refuse avec jean marie pen 	mixte
reste calme poli sur lui parle largement	autre
nous robin pour	negatif
mais suis vraiment choque par genre passe quoi	mixte
pen par presse milieu politique soir limites ont	positif
pas que avez rompu avec personne croira officiel	negatif
mais incroyable pas capable respecter temps	negatif
super voir A heure ici 	positif
vienne soir haine trouvera 	negatif
non contraire fallait montrer	mixte
sous angle analyse politique ceci caniveau suis poli 	mixte
aimerait avoir opinion	autre
marine pen voir juges expliquent mise examen verra	positif
abstentionnisme premier parti oubliez jamais ceux qui faut aller voter	autre
officiel oui faux 	autre
officiel toute heure	autre
heures sans queue comme avait perlimpinpin 	autre
savez argumentez profil que penser 😆	mixte
soir vient manque propos tenus par officiel	positif
officiel fait pour culture exactement tableau mais pas sur 	negatif
marine pen choisir fiente pigeon 	mixte
envahi marine mais folle	mixte
vraiment moins puisse lui confierais pas 	negatif
officiel cachets faisaient plus effet 	autre
pen boy visa commencer inscription	mixte
qui vue programme	mixte
pen aurait serai place	mixte
juste glisse climat par rapport 	autre
marine pen accuse complaisance pour islamique 	negatif
exactement comme celle 😂	positif
encore gens qui veulent voter conseil beaucoup	mixte
abstention qui remporte	autre
montres migrants comment nager pour retourner pays 	negatif
ban sen fout que que pense chevaliers version	mixte
trouvera rien sur prochains jours plus mais 	mixte
parler connexions russes 	mixte
convaincu pas voter pour lui	negatif
vraie gamine fait peur fait rire plus 	negatif
qui attaque comment 	positif
une fois partis vont exploser	mixte
officiel pays libre alors pourquoi jeunes femmes musulmanes 	negatif
bon boulot soir officiel qui par aura envie voter	positif
mais formules magiques	positif
officiel soir malheureusement oligarchie qui gagne 	positif
encore toujours continuer orientes soutenir 	mixte
est mal aise face affaires justice ricane puis	autre
aurait aussi fallu inviter pour faire vraie conclusion qui gueule presque nul	negatif
appelle pas harpie autre vilaine mentez nul	negatif
que avez raison que chute nouveau tout 	mixte
clair calme optimiste bien meilleur	mixte
suis bonne partie message pas 	negatif
pourquoi viens critiquer comme heure sur 	autre
elle train plomb non pub coin	negatif
sous manque respect sur magique	positif
bien montrer visage pauvre bref sous 	autre
marine pen soir vraiment	positif
quoi vocabulaire marine pen faite	autre
soir montre surtout que type convient plus tout	positif
que phrase soir quoi arrive sera par femme soit moi soit 	positif
franchement bravo fallait placer cela	positif
veux tenir ligne international A souhaits petit	mixte
pan aussi propose pour 😂 	negatif
hui crise les	mixte
bon bah niveau peut que tiers	autre
regrette mais mieux que vite	autre
affligeant agressive approximative sur tous sujets plein farfelues contre terrorisme 	mixte
son bizutage maintenant boulot	autre
suis pro mais officiel pas compris	negatif
marine qui bien	mixte
merci marine clair gagner marine avec peuple voulons marine	positif
comparable gamine qui croit plus que prof essaye immature	autre
pen officiel seule chose prouver que futur	autre
rire nerveux montre bien manque tout ouf termine	mixte
parlant envie brune vois 	mixte
point bobo continuer	mixte
officiel officiel rien alors profite bien coupe champagne laissez 	mixte
A venant pen confusion 😂	positif
choix meilleur que officiel	mixte
lui serait croit toute autoroutes	mixte
confirme plus que jamais pire exclusion tous autres	autre
qui aime pas	negatif
comme rigolera bien qui aura rire point	mixte
avec franc avec non 	autre
beau spectacle que pen pourrait presque chroniqueuse	positif
viens peine lancer 	mixte
aussi tout contre marine tout contre serez marine	mixte
mais oui important 	mixte
peux que mieux avait mieux qui tour elle 	positif
oublie sujets vrais que rencontre aucune prestance posture 	mixte
bon gagnant selon moi	autre
qui vient insulter coups jambes	mixte
voila hautaine faisant show que certains veulent comme 	negatif
triste soir pour mais pen vote blanc sans	negatif
pen train lire fiche qui pas 	negatif
secours revenez tombe caniveau	mixte
peut parce lui est 	mixte
Ils auraient pomper vraie signature 	mixte
tout retenir que chiens font pas chats marine pen bien fille son	negatif
attention viens cites croire que banlieues	mixte
avons programme pen	mixte
bravo 👏 monsieur avez hauteur vive vive 	positif
mais mais ouvrir comme cartable 	mixte
moi vote heu non patience	mixte
question sur institutions	autre
avec avez plus chance mais marine toute 	positif
pen pen fait peur	negatif
sujet carte blanche choisir	autre
futur officiel crois veut retourne esclavage sur ceux 🌌	autre
plein roupillon fait tenu jusqu bout 	autre
mieux que serait mieux approprie 	autre
les relations argent famille mais parle elle	positif
meilleure transition annonce ’ lui arrive combustion explosive	mixte
faut que pas mot sur triste	negatif
excellent sur tous sujets fait tank bien bravo bravo	positif
voulez faite « vote » projet	autre
elle fait fracasser non	positif
respectueux logique intelligent avez explicite avez 	mixte
pensait que allait enfin parler mais soir pense que touche	positif
ben serait temps oui personne abri 😔	negatif
qui peux aimer	positif
avez pour fille que tapie pour niveau merci	negatif
pen pas film humour 	negatif
vrai verre contre fois officiel ironie	autre
marine pour celle officiel	negatif
veux sans les sans	autre
elle fait vieille	positif
officiel par critiquer fou quoi sur plateau	mixte
pen parle parle phrase claire net	autre
mouise laquelle trouve maintenant 	autre
les machines trip soir 	positif
fille borgne quitte sans serrer main gens trouvant peuple	autre
bon maintenant avenir entre mains	mixte
exclu retour marine sur prestation soir 	positif
non pas projet encore aurait fallu existe	negatif
euh fait quoi gigoter ultra	autre
bien que marginal concerne toujours environ primaire 	autre
marine pen rit que souffre	autre
mieux que que toi aussi mais fait	mixte
jamais vote continuer	mixte
mais appelez soutenue par officiel front national	mixte
utile jeune situation autisme total restent moins plus petits 	mixte
confirme haut fort voterai autre 👹 juste pas possible	negatif
issue pensent que plus convainquant	mixte
bah vrai que traitent bien 🤔	autre
merci jugement objectif 	positif
putain avec yeux trop beau grave chance 😂	negatif
officiel sous jour creuse menteuse fausse juste job	autre
moi aussi veux tous zozotais	mixte
bravo programme pen 	positif
mieux que gueule	mixte
son bien qualifier propre mieux marine soir	positif
franchement gens qui voterons vraiment	mixte
attaque par pen parvient peaufiner stature via	positif
avez tout respect soutien tenez promesses tenez bon 	autre
officiel aime sont roches cailloux car gens 	positif
suffit pas vouloir faut capable 	negatif
marine pen qui prouve que aucun programme transpirent tous racisme	mixte
frais fait quoi change comme engeance sioniste 	positif
bravo qui calme face personne comme programme	positif
pas compris soir folle plein agents 	negatif
visa hors juste montrant 	autre
mieux que bien joue	autre
pourquoi qui est	mixte
olympique lyonnais tout soir	positif
suis anglais pour lieu chamailler comme gamins ans 	negatif
veux suis veux suis veux marine les	autre
mais fait importe quoi impressionne	mixte
comment honteux voter honteux 	negatif
que par miracle arrive avoir parlementaire aussi	autre
port attache sur 	mixte
pensais pas que possible rater comme cela est	negatif
lui explique pourquoi soir 	positif
conclusion bien mieux avec parages	autre
elle vague qui porte 	positif
insultant gens fasse pas cela	negatif
maintenant ici pouvez payer par 💳 pasteurs lieu 🍟 	mixte
sans blague suis niveau intellectuel pour job son	negatif
marine pauvre sait point joueur	autre
bon militants que ait marine	mixte
calais qui banques russes	mixte
est tirer sort pourrait faire pareil avec politiques pour relever niveau	negatif
excellente conclusion pen restez moi veux	positif
gens qui crient sont qui club supporters 	autre
pen parti qui moleste journalistes	mixte
sur toujours pause pour 😹	negatif
son programme voila par officiel	negatif
elle faisait pen grave conclusion	positif
bien triste pauvre	autre
avoir cite qui ont essaye ont fallait oser mais comme 	autre
olivier que qui 	mixte
partout pour tous officiel 	negatif
petit malin officiel jamais pouvoir serait cause tous maux 😆	mixte
elle bien suis content	positif
officiel ancien nouveau ancien 	mixte
soir avons assiste naufrage pen clairvoyante poison jusqu minute	positif
une carte blanche pour choisit consacrer attaquer performance	negatif
putain mais gamine vieille vache vivement	negatif
encore ans baisser son	mixte
les temps conclure	autre
elle trop forte miss pour faire plus bile auxquels assiste toute vie	negatif
voter contre pen vive vive via	mixte
encore plus simple pour cotisations 	negatif
aucune richesse naturelle question serait sans ira 	autre
point positif que trouve programme ouf temps blague	positif
soir montre projet face officiel	positif
ben que pas bien lieu laisser faire concentrer sur ira mieux	negatif
officiel iront amoureux 	autre
une merveille politique qui gouverner 	mixte
officiel non merci veux celle	positif
finances mais soit reparle	mixte
elle faut enfermer	positif
non bah non	mixte
plume pour qui seraient bien sur 😜	negatif
moins aussi insoutenable que film	autre
que pape faire	negatif
bien sur que aura enfin repris 	mixte
faux pas rupture sur contrairement sur 	negatif
bien merci vous venez montrer point est	positif
elle bien preuve plus aucun argument	positif
langage corporel carte blanche met	mixte
officiel officiel mais contraire car 	autre
officiel voit niveau intelligence	autre
faites avec gestes marine pen	mixte
faut chercher plus loin lire programme qui bien plus fournie 	autre
non certain vont regretter futur vote comme regrette tous votes 	autre
sortent allusions marine pen sur comptes source officielle 	mixte
merci pour phrase parasite 	negatif
officiel impossible refuse amour pas 	negatif
sur restrictions eau moment 	positif
morts par pas mot sur environnement climat 	negatif
elle plombs marine	positif
moi contraire enfants menteuse etc 😂	positif
que plus personne mette sur plan que obscurantisme pen	mixte
bon choix fait	autre
juste exemple car vraiment comme enfant attaquer 	positif
sortie salue tout pompier pen pas vus 	negatif
avait pas ego sur	negatif
officiel euh sur que qui attaque faut 	positif
accuse arrogance qui 	positif
stress officiel sortir plateau loge alors	mixte
passe met tante	autre
officiel tactique paiera certainement	mixte
merci pour qui signe mort 	negatif
souci faire tombe amoureux 	negatif
marine pen protectionnisme ouverture avec qui gagne 	autre
populiste comme vielle	mixte
elle sait pas quoi pour conclure	negatif
mais rentre avec comptes avec arrogance non juges	positif
paroles veux alors que € par 	mixte
elle part live total	positif
quelle honte 💩 valent rien moque nous	negatif
gros marine pen manquer parce verre trop soir	negatif
pen officiel tous affreux oui 	autre
qui tire trait sur	negatif
pourtant bis coupe analyse 😜 	autre
refuse esprit haine que propose	negatif
qui pensent encore que front national pas raciste	negatif
officiel certains prison ferme ose casier vierge est	autre
tout temps soi veux veux veux 	autre
oui aurais pas parie envoyant qui que soit face mais 	negatif
raison pen veut juste appliquer racistes priver nous	negatif
pen offensive final fait atomiser	mixte
mieux que toi aussi cousin	autre
ailleurs tout parle	autre
vue avait proposer programme alors 	mixte
officiel peut que nazis restant pourront lui remonter moral 	autre
vous avez rate extrait moments forts 	mixte
petit officiel entre tours pour montrer comment faut faire	negatif
pen plafonne soir voter une 	positif
votez pas pour lui alors contre mieux 	negatif
bonne nouvelle soir avoir mis qui marine incarnation 	positif
sauf origine arabe musulman noir juif homo portugais gitan forte	autre
musulmans qui vivent ont plus parler soir que 	positif
arrive couper parole qui rien	negatif
surface sont ouvertes 	autre
non mais crois folle hein	autre
une humiliation pour entre alcoolique boy pauvre	negatif
elle sortis argument juste 	positif
qui craque train faire	negatif
mon que serait face elle	positif
objectif pen fout honte toute seule besoin est	negatif
mais pas lui 	negatif
pen parasite qui 	autre
vient prouver avait aucun projet pour base que sur peur calomnie	negatif
menteur voulais virer gens 	mixte
sur vraiment pas hauteur fonction mais faut voter surtout pas abstenir 	negatif
mais surtout faisons sorte pas laisser pen arriver pouvoir pen 	negatif
avez pas carte blanche passer temps salir avez pas projet	negatif
premier qui utiliser terme sucer	positif
officiel vais voir parlant gouvernement compris les	mixte
clair touche piscine vieille folle marine	autre
mon internet marchait plus que pen parlait pense pas loupe chose	negatif
pouvait vie marine 	autre
serait tellement que ont pas 	negatif
veut quoi moins que pen ait voulu mais parait bizarre	negatif
marine pen aurait ministre 	mixte
officiel carte blanche salissez lui 	autre
live for live serveur 	autre
ben non usa mieux hein 	autre
mieux que officiel tout	autre
soir suis convaincu que pas niveau sais aussi que vais voter conscience contre	negatif
personne voir aussi entre autres qui 	mixte
officiel franchement plus que soir contre avez 	positif
mais non faisait mannequin	mixte
gens qui votent paix parents qui seront battus pour que 	negatif
vos qui valent pas mieux que autre pauvre	negatif
pour convaincre atterre par volume face paris	negatif
officiel honte pour que futur retirer 	negatif
compte avec millions par explique pourquoi 	positif
vos gueules oreilles qui saignent vous	autre
bonne hein plan vas voir pourrait 	autre
arrive plus lire correctement fiches 	mixte
hommage saint martyre	mixte
finalement tout bien passe marine pen voulu enterrer toute seule lui filait coups pelle	positif
pouvait premier partir 	autre
remercions marine pen qui vient qui met valeur 	mixte
aucun projet pour pen parle projet pour pen parle sans cesse	negatif
excellent passage ramasse soutiens hors peuvent poser questions	positif
sans programme nationalisme brutal vote juin 	autre
bah tout fait normal rien proposer	autre
morale faut changer les	mixte
marquez recul mais 	autre
mais comment est	autre
marine creuse lamentable 	autre
elle place combien fois bouche que	positif
temps conclusion respecte pas	negatif
pourvu ait pas match retour	negatif
qui bien rire soir	positif
choix soir fait 	positif
comment fait que temps suis sur que marche 😂	positif
socialistes ont saccages publique 	mixte
opinion mais tant que vainqueur faut faut 	mixte
une avocate reconnue par barreau chaise reine commis office officiel	mixte
bon vraiment gens qui veulent encore voter pour officiel suite prestation 	negatif
officiel oui mais impression que pire que serai plus 	mixte
juge plus convaincant face marine pen 	autre
marine gagnante 👍 💙 face plus menteur junior 	positif
victoire par pense monsieur arbitre avis confirme technique 😂	positif
mieux que cela rien ajouter monsieur merci avoir honneur 	positif
nous prenez marine place	mixte
trois minutes pour sur environnement sujets vrai pour avenir 	negatif
pen chute libre	mixte
importe quoi bon allez lit belle nuit tous 	positif
mais nom chacun exprimer opinion 	mixte
chasser naturel revient galop	autre
seule nouvelle retenir que battu par sur score 	mixte
pire serait que laisse usa 	mixte
courage faut revoir sous angle mots par soumis sou 	positif
regrette pen mieux que 😂	positif
officiel taux rapporte population comparez nombre 	mixte
elle comme femme lui mange soir toi fais lessive	positif
bon clairement fera bon reste savoir 	mixte
pauvre avec jamais que soir hier ans 	positif
oui impossible face chien enrage comme lui	mixte
avez changez avis suite marine	autre
elle pouvoir gueuler sur car tout	positif
obscurantisme accule par optimisme suis rassure	mixte
trouver comment soir 	positif
les clause avec orthographe militants image 	mixte
aucun arguments juste	autre
suis bon vais appelle pour fasse gros	negatif
soi carrure intelligence 	autre
plus serre suis aime suspense aurait plus longtemps verra 	positif
tout comme usa sont pas pas honte	negatif
marche plat ventre	positif
marine pen actuellement 	autre
point rare chez	autre
fait attaques personnelles mais marque qui mal sur 	positif
rire verras rue 	autre
elle fait que lancer attaques cela rien voir avec vrai politique	positif
normal car notion ligne celle 	positif
pas sortir avec soir pauvre 	negatif
aime telle mais alors peut pourquoi programme est	positif
gauche mais milieu	autre
marine objective participe nation 	autre
chez monsieur faites semblant avoir projet verrons que avons raison	mixte
elle passe programme sans parler sien conclusion	positif
officiel bah pas pour pourquoi 	negatif
sans tourne vraiment comment peut hui tour sur plateau 	mixte
sais pas quoi mais vraiment nulle enfonce toute seule	negatif
lui whisky manque 	autre
elle vient que personne casiers 	positif
oui oui oui veut pas 	negatif
elle crever sur plateau suite maintenant	positif
merci hauteur arguments face refus	positif
elle vaut rien	positif
qui croire marine pen blague serez jamais votez	mixte
encore fois aucune minime sur vert	mixte
faut afficher bureau	positif
bravo monsieur convaincue maintenant tous vous	positif
jamais cote capote	mixte
constipe qui avale noix coco fait confiance anus » 	positif
les journalistes ont aussi inexistant que	autre
voir marine pen que bon	autre
marine raison sur point plus avait auparavant 	mixte
horreur que moi	mixte
alerte mots environnement climat pollution abeilles renouvelables ont	autre
elle boit quoi	positif
parle sur faut avec 	mixte
impossible projet contre projet avec fait que commenter celui son	autre
mat maternelle soir kiki voter 😜	positif
officiel que critiques programme claires	autre
elle vit quoi elle 😂	positif
pourra car gens auront vraiment trop elle	positif
comment parle arrogance	positif
est forte toute seule 	autre
est folle vient calme 😎	mixte
toi sali pas accusant crime contre avec cornichon politiques corrompu 	negatif
plus politiques qui font mais internet	autre
parie avoir lieu travail heures 	mixte
mettre mettre bien	autre
elle mais pourquoi	positif
front national avec nombre porte parole que recevez tous jours analyse pitoyable	autre
officiel fille qui 	mixte
nous aimons que ait parle merci	positif
voir terrible mais sous gouvernement socialiste parti 	mixte
moi passe oral bac avais moins fiches que pen une	negatif
moi officiel train plomb 🤔	autre
voit convocation juge 😂 	positif
fier soir soutenir qui parle avec respect 	positif
blague soir tout chie sans moi irai 	positif
marine pas hauteur mais trouve que bien change 	negatif
rue rue soif plus via ouest ivrogne aussi 😂	positif
offrons qui honore intelligence qui persuasion illusion qui 	autre
allez voir sur toutes marine sont	mixte
maintenant lance fausses accusations grave	mixte
mais fait que rire moquer 	autre
moi aussi faut 	mixte
suis contente soir bien range petits 	positif
serait bien pour invectives	negatif
moi aime telle mais par contre veux tout changer parce que est	positif
lamentable jusqu bout	mixte
ouais roue libre	autre
respecte trop avoir bac yoga self pour pouvoir rester aussi calme face marine	negatif
que soir citoyens sont compte iront voter	positif
parle peuple parle 😂 fait quoi juste 😂	positif
mais yen jamais que baises sons	autre
importe quoi certainement votez ceci explique cela 	positif
quiconque vote consulter frais car peut que pathologique	autre
incapable parle pas projets avenir non attaque	negatif
tout cesse critiquer propose rien	positif
fait voir point est	autre
malheureusement pas que autistes mais faut aussi soignants pour 	negatif
macaron mais soir pas pour ses	negatif
ceci triste manque argument pauvre contrairement officiel	mixte
que mette rage mais baves 	mixte
score ferait avait 	autre
magnifique conclusion marine sur vision	positif
ouais bah moi vote pour moi voila	negatif
vue pleine arguments incontestables pipeau enfumage 	mixte
mettrait genoux veux pas faire courir risque pays fais confiance consignes	negatif
trucs qui programme mais aussi celui	autre
cas bravo avez rester calme respecte	positif
suppression fonctionnaires perte protection sociale que programme soi 	autre
cite parti mettant marche 	autre
ans 😒 normal puisse pas 	negatif
officiel vous femme exceptionnelle avez lors	mixte
consternant retrouver tour avec aussi 	mixte
cette abruti minutes pour parler parle tout long explique programme grosse	negatif
aurait vraiment gagne hauteur avec autour table 	positif
beaucoup critiques pour peu arguments	negatif
non pas recommencer mais faites taire autre bon sang 😤	negatif
les veux par courage courage tenir 	positif
pen tombe vraiment bas pas que avez compte off aux	negatif
fait soir preuve amateurisme sans 	positif
bonne nuit heures sommeil rattraper conneries	mixte
mieux que tient 	mixte
mais moche soir	positif
quoi phrase culte coup	autre
les images mai traverse images 	mixte
largement gagne ressort avec	mixte
comme marine pose mais aucune solution face 	autre
