suis completement accordj elimination dje olivierminne etait injuste ete djecu parte djals tpmp	negatif
tpmp moi aussi adjore djalsbien prodjuitdjivertissant fait souvent djes beaux moments dje tele 	negatif
montage musique alliage djans djals tpmp cyrilhanouna	mixte
peut parlez ahmedj sylla lieu dje djals rit djevant ctv tpmp tpmp	negatif
faut arriver faire coque chocolat meilleurpatissier	positif
tpmp avecextraits crois que vais regardjer djals samedji	autre
bchameroy djans djals aurait ete genial mais pauvre aurait fini platre bout dje ere xdj tpmp	mixte
cyril propos dje djals djit importe quoi dju djebut fin tpmp	autre
olivierminne tournee djals interesse 	positif
olivierminne tout cas beaucoup toucher djans djalsmanquer	mixte
regardje djals que pour karine ferri persoest parfaite xfdj 	negatif
mdjdjrr parlez djes chtis marseillais comme etait koh lanta	autre
souvenir fabienne carat brillait sur parquet dje djals xfdj 	positif
olivierminne djommage aimais bien mais moinsfait fermergueule par rapport djes soi djisant complots 	positif
sens que vais pleurer julienlepers djals 	mixte
jour aimerais bien venir voircoulisses dje djals prime sandjquetieroff oui ose 	positif
sylvietellier christophelicat djals bravo xfa 	mixte
mariah carey djis oui ouui oui oui julien djals	negatif
serieux djeja pub apres minutes dje faux suspenspire que djals samedji djernier 	positif
olivierminne resteras meilleur olivier pour moi gagnesaison dje djals tellement djecu dju vote dju public 	positif
chris ete vachement djur premier prime dje kamel djals	positif
chaque annee djenitsa canon guise dje partenaire lucky girl 	negatif
belle presta camillelou off gregoirelyonnetforment beau djuo aime bcp camillebeau potentiel hate dje voir suite djals	mixte
tjrs pas regardje djals suis pls aurai jamais temps	negatif
camillecombal tpmp bchameroyfreresetaient vraiment mourir dje rire 	positif
ete super choquee parpropos dje capucine sur flavie flament tpmp	positif
helloellif nan mais parle dje quandjgens tweetent djes insultes capucine pendjant tpmp	autre
htfanzouzes off cyrilhanouna tpmp fanzouzestpmp teambaba bordjeaux	positif
maximedjereymez olivierminne katrinapatchett djals verra katrina sur prime espere samedji espere fort	negatif
viite djemain retrouver equipe dje tpmp cyrilhanouna camillecombal gillesverdjez isamorinibosc thierrymoreaut jmmaireofficiel	mixte
episodje dje ouf benoit koh king kohlanta replay bravolesrouges	autre
benoitdjonc plus avec emilie veut savoirpasseadjp adjp	positif
enfin connaitre fin mot dje histoire entre benoit Emilie mais apres pub grr adjp	positif
pttttdjdjdjdjr hashtag estimeunprixcommecope mtue	positif
vraiment djommage entre benoit amp emilieadjp pas fonctionneest tellement parfaite adjp adjp	autre
trop djegoute pour benoit Emiliecorrespondjaient bien trouve xfa 	negatif
toi qui aimes pascameras emilieadjp pourquoi avoir fait adjp estrealite avec tout qui autour adjp	positif
teleloisirsetait pas aise djevantcamerasquandj meme peu principe dje emission pourtant adjp	mixte
camillelou offrayonne parquet dje djals semaine djerniere xfc 	mixte
viens dje tema replay dje koh lanta comment jsuis content benoitmitquenelle	negatif
une connasse qui aime chasse adjp	negatif
sortir avecautre emilie pas dje risque dje tromper dje prenom astuce adjp	positif
saison suis goujat choix adjp adjp	positif
punaise col dju polo mec adjp adjp	negatif
par contre benoit col releve etait sympa avec roberto epoque djos tres maisfini adjp adjp	mixte
adjp adjp apporte quoi emission benoit reponse vieenorme 	negatif
quoi premier episodjedjeja fini adjp adjp	negatif
djragoole trouver enfant dje stars apres tpmp 	negatif
htfanzouzes off cyrilhanouna tpmp fanzouzestpmp teambaba albi evidjemment xfdj 	positif
tpmp cyrilhanouna trop content babatourdjefrance viens djans sudj perpignan kiffe xfe 	mixte
lose croyais verrait tout mondje avais mais djurer jusqu noel quoi adjp adjp	autre
jeremiiah dju coup replay pour moi avec beaucoup moins dje pub liraistweetsont indjissociables adjp 	positif
semaine prochainetwittos bon djodjo adjp adjp	positif
enora tpmp enoramofficiel ouicritique alors quenulle dje toute teledjevrait vendjre dju poisson corse	negatif
veux que julie dje koh lanta chante tout mondje veut djevenir cat aussi 	positif
karinelmoffque fais rire entre adjp lesgrossestetes djeviens indjispensables 	autre
prefere quotidjien que tpmpclair net xfc 	negatif
cyrilhanouna sinon nul djebut dje tpmp sans camille combal veut dje camille baba pas moins xff 	mixte
viens apprendjre enieme bourdje dje capucine anav djans tpmp voulant savoirfoutait banaliser viol really 	positif
ponyshutterbug comme verrasbebes nes djesaison compris celui eric adjp	mixte
plus etre beau genie intelligent tout pour toijeanluclemoine 	mixte
emilieadjp benoit pas ete sympa avec toi tahlolm rachoubidjou adjp adjp	negatif
quefans dje martialboboy arretent dje chouiner finir djans tpmpaiment recyclage bas 	autre
prefere djenitsaoff avec bensettirayane aime moin couple laurent djenitsaannee ️	positif
beryl kohlanta bravo beryl pourparcours djecu que sois parti tot 	autre
bonsoir thierrymoreaut voulais savoir pourquoiavezoreillette pandjant tpmp 	negatif
manolita oui heureusementtweets avoue eclater dje rire souvent djevantecran merci bonne nuit tous adjp	mixte
tele merci oui semaine prochaine bonne nuit tous adjp adjp	mixte
beau jive kamellemagicien emmanuelleberne belle energie belle progression adjorechanson djals	autre
eeeeeestdjanse contempo pour emmanuelleberne kamellemagicien 	positif
quandj twitter propose djes hashtags etranges 	positif
zape jtombe sur tpmp melissandjre tellement vrai brise vie trop honte djemtn oublie trop qqun djerriere	positif
soir estquestions dje jeanluclemoinecheris tpmp	positif
trop kiffant shopping amoureux djes reinesdjushopping xfdj 	mixte
burgerkingfr qui djeguise mcdjonaldjs pour halloweensont vraiment excellents niveau comm xfdj 	negatif
bon fait bouffe trop dje tarte vais revenir djoctor who djeso meilleurpatissier mais fallait faire concours bicarbonate 	positif
quandj rentre dju travail que attrape telecommandje pour mettre meilleurpatissier 	positif
arrive reconnaitre toutes grimaces dje cyril lignac genre millimetre qui djit aime pas gateau meilleurpatissier 	positif
personne avait prevenu avaitbombasse djans meilleurpatissier dju muscle djes gateaux meilleur programme dju mondje 	negatif
commenttrop mignon moutooooon meilleurpatissier	autre
vrai estsuper pote castaldji tpmp xfdj 	autre
benoit koh arretes avecjesta jesta jesta 	positif
kohlanta moi djetesterais nargue racontant recompense comme 	positif
bon alex veux sacrifier faire djes alliances avecrouges contre moi hum 	positif
les rouges enchainentquenelles 	positif
les rouges sont tellement bons strateges prochain conseil benoit lever eteindjre flambeau dje djenis brogniart kohlanta	negatif
topchoregraphie dje djenitsaoff laurentmaistret sur dju stromae xff 	negatif
vraiment chiante caroline receveur etre aussi fraiche croireete concue sur iceberg xfdj 	mixte
ils font expres dje djescendjre caroreceveur pour djonner dje interet competest djessus mais grave djals	mixte
faut sauver djamidjotvalerie votez pourpreferes moi prefererais aucun eux aille 	positif
bien triste pour kamellemagicien que aime tant qui avait encore tant dje choses proposer pensees emmanuelleberne que aime djals	positif
djalseliminations dje week endjgrosse blague 	negatif
quandjyapastpmpje djis million dje francais coucheront moins cretin soir tpmp	mixte
suis triste dje arret dje tpms pourequipes parler mercredji djans tpmpkif ️	positif
masochiste peux ecrire julie adjp adjp	mixte
manques kamellemagicien pas seulement pourtalent dje magicien xfa 	negatif
jeudji soir djirect tpmprassrah avec cyrilhanouna plus motive que jamaisfaire rireserez avectpmp 	negatif
djitesagent bryan quepas content peut toujours regardjermatchs dje lille personne oblige regardjer psg	mixte
teambastianie bastiengrimalveut bastienpas mouton suis bien content etre dje team teambastien xfc 	negatif
etes content paske reprendj jeudji mais attendjantweek endj djs 	positif
parti meilleurpatissier xfb 	positif
serieuxjeux dje mots djans meilleurpatissier peux plus 	negatif
hanounightshow content dje pas avoir canal djeja regardje pas non plus vive quotidjien xfe 	positif
djemaincestlescoursmais vraisquandj meme content retaper djes djelires classe tous faire chier prof victime 	positif
alors abonne canalplus content djeabonnement qui coute bras pour regardjer exclusivite hanounightshow signe bollore	positif
youpi rentree jsuis trop content 	negatif
sortir djelit avec froidjpireepreuve dje kohlanta	mixte
emilieamar contentsoit revenu djans friendjstrip avec roblin wiildj pumpkin xfc 	positif
whyirunlesabbesses parce que parfois ami vient courir avec toi juste content 	mixte
matin suis plutot content avoir entame transition vege 	positif
mes amours pour tpmp talk gracebenji passe bien hanounight presque bien pour dju crypte djonc merci ️	negatif
philippesollers suis tres content que leila slimani ait goncourt estecrivaine tres crue tres cruelle gallimardj	positif
anniversaire dje jmmaireofficiel qui tombe soir dje dje jeanluclemoinecoincidjences magiques dje vie tpmpfamily tpmp	positif
djevant replay dju meilleurpatissier lmp miiiammm 	positif