rencontre avec saumure « connais pas mais aurais aime rencontrer »	autre
surpas plus philosophe que suis moine 	mixte
cotes conforment pas chemin montre par pourraison continue	autre
russe continuefrappe cibles pas seul blessė	autre
question qui perturbeauraitcible pas encore assez 	autre
une terrible pour courrier international 	autre
pourrait faire aboutirsolution pacifique coup bombes 	negatif
pays pauvres qui ont fois plus besoin genrepays etc	autre
intervention russe sauvera pas	negatif
lutte pas pour sauverlutte pour propre pour mettre terme terrorisme 	autre
excusez moi jean pierre mais pourpas envoyez moi	autre
les avions russes ont chasseavions qui ont fait tour espace ais 	autre
les troupes soutenues par progressent autour via 	autre
qui cacherebelles pas autres alternatives bonnet blanc blanc bonnet 	negatif
excuse pas soir est	negatif
plus personnes conflit via	negatif
souhaite que influence pour mettre fin guerre via 	autre
bravorusses merci peutmais	negatif
qui passe poubelle plus rien sur honte 	positif
plus ’ quart millions mortscontre 	autre
ont pas approchenom conception pacifiste 	autre
les unis souhaitent pas avec sur sauvetage pilotes via 	autre
casques bleus pour patrimoine via 	autre
est vrai que paternelest 	autre
pays plus frappe par terrorismenous engager pleinement louis	autre
journaliste suivifamille via	autre
«voient pas alternative	autre
chezsont parce que pas pris	autre
intervention russe prouve manifestement action plus par coalition 	negatif
frappes « peut pas » via	autre
oct plus personnes conflit 	autre
plus russesgroupes terroristes sur querelles entre eux 	autre
intervention russe sauvera pas agence libre 	autre
que fontlesrussesquinzaine jours tout rien 	autre
russe plus cibles via	autre
fait pas partieloin menace toujours est	positif
syrien royaume unigroupes islamistes	autre
oct russe plus cibles 	autre
les ontvraiment peur estnouvelle afin pas reconnus 	autre
ans journal plus 	mixte
pentagone affirme avoir tue chef groupe lorsfrappe via 	negatif
pour compromettre mission russe compte aller encore plus loin livrantgroupes 	autre
plus frappes russes visent pas	autre
les avions russes menacentavions qui font tour espace 	autre
monsieur avezfamilles entier constate que hommes jeunes combattre	autre
quelles sontintervention russe figaro 	autre
pentagone affirme avoir tue chef combattants issus 	autre
cible frappes via	autre
plus importante que jamais selon	autre
qui combat qui par julien orient jour via	autre
frappes presse russe via	autre
familles souhaitent revenir 	autre
ils manquentclown impression que intervention russefoutu coup	autre
paierecruteurs jusqu international via	autre
averti secret russe contre jeux 	autre
que passeguerre que passeguerre	autre
unis annoncent avoir tue nouveau chef groupefrappe usa 	autre
continue annoncer islamistes par jour 	autre
chinois russes iraniens associes avec revoir copie afin 	negatif
les forces russes ont frappe positions via 	autre
invite qui compte guerre avec sans 	autre
tuer pourquoi pas faire avecautres 	autre
avec pointes sur tempe © via	mixte
tout avions pas syrien russe sera abattu via 	autre
les usa refusent offre russe secourir pilotes 	autre
situation change avions russes pris pour cible par missiles sol air ’ 	autre
base militaire russe sentiment via 	autre
qui peur ours 	autre
guerre risque via 	autre
non ’ pas porte avions chinois large 	negatif
pro pentagone affirme avoir tue chef groupe lorsfrappe 	autre
les russes changent 	autre
journal turc publieimages par	autre
russe avoir frappe cibles terroristes affaiblirebelles 	negatif
intervention russe vue via	autre
journaliste islamiste sur situation via	autre
ton contre position envers via	autre
selon fonctionnaire anonyme forces paramilitaires cubaines sont pour soutenir 	autre
chef groupe islamiste tue via 	autre
volontaire «seule arme » via	autre
une carte combats article surprincipales forces via 	autre
guerre contre ’ entre sort chine cuba	mixte
excellent sur guerre infographie papier avenir	negatif
immigration invasion espagnol missionnaire critiquentpolitiques 	autre
envoie tuerchezils sont pour nouslaisse totale normal 	negatif
ilsune cave pour sauverlivres guerre via	autre
pas poser question que passe guerre 	autre
chef groupe issu tue lorsfrappe ouest 	autre
force russe livre assaut sur 	autre
zones sous projet turc 	autre
bataille commence via	negatif
terroriste abattu par arabe usine briquemilitaire 	negatif
versera montant pour chaque qui aura secours pour 	autre
qui combat qui complet orient jour via	autre
lieu personnes enfants famille sont suite	mixte
pas aurait fallu via	autre
que passeguerre via internat	autre
russe bloque avions 	positif
journal guerre civile 	autre
assassine sixpropres citoyens 	negatif
les unis annoncent avoir tue nouveau chef groupefrappe 	mixte
’ tues parfrappe quarante groupe 	autre
vraiment bonjournalisme pages sur 	autre
chef groupe tue parinternational via	autre
juge pour crimes guerre contre humanistes mali centre	autre
autre point vue 	autre
chef groupe tue lorsfrappe via	autre
pays islamiques entrent par points avec amour oppression fin sans effusion sang	autre
terroristes tues parfrappe quarante terroristes groupe 	autre
pays parmais votefinsuisses pleureront 	positif
qui combat qui via	positif
mois peut peut vision simpliste ’ ignorant majeur mineur ’ aille 	negatif
les mententpays entier via 	negatif
les forces avancent province 	autre
russe vols total via 	autre
– nouvelle campagne — – nouvelle campagne — 	autre
envisage aller combattre 	autre
syrienne poursuiventprogression via 	autre
coalition survole fois par jour sans 	negatif
mois peut peut combien mois chef 	autre
sommes hommes que veut tuer alors que mortbut que	negatif
« sur » sous forme 	autre
pentagone affirme avoir tue chef 	negatif
maintenantautre front entre 	autre
choquant pour pouvoir voir via	autre
vise par serait toujours vie 	mixte
contre sonrusses testent via internat	negatif
que veux via	negatif
express vise par serait toujours vie 	negatif
photographe mort livre chronique	mixte
avions inconnus frappentpaisible agricole via 	positif
cela lutte contre bataille entre usa sunnites contre chiites 	autre
efforts russes ont force frappe terroristes 	autre
est quoi pourquoi sontpouvoir via	autre
avez rien comprisconflits parlepossibleexplique ici 	mixte
terroristes ont sans coup aviation russeaillent enfer 	autre
chef groupe lie tue parfrappe pentagone 	positif
que mensonges surarmements via 	autre
que plus tous habiter 	mixte
terroriste aurait trouve mort	autre
gens qui meurent moi parce que pas fini parle 	autre
les russes sont vitrifient toussans exception pactisent avec	autre
quatre civils tues frappes 	negatif
pentagone avoir livre armes	autre
paierecruteurs jusqu selon 	autre
vise par serait toujours vie express	autre
russe avoir frappe cibles terroristes affaiblirebelles via	autre
guerre pilotes russes 	autre
les forces russes ont frappe positions	positif
puissance faible forte 	autre
pentagone affirme avoir tue chef groupe lorsfrappe 	negatif
les rebelles passent offensive intervention russe	mixte
base militaire russe sentiment 	autre
quelsource guerre pourquoiguerre pourquoiles russes ont pas	autre
moreau quiblagues voix off meurs 	autre
encore passer les	autre
qui critique maquillage fait par maquilleur choisi par importe quoi	autre
suis seule trouver que fait vraiment pouf superficielle 	negatif
moi aussi rangefringues comme	negatif
semaines quemets pas tout 	autre
pourquoipriver rayon soleilviolence commepart 	autre
autreest suis morte pouilleuse	autre
les partent couille	negatif
bon viens inscrire	negatif
elles sur miroir avec mac 	autre
non maisbonnetpas possible gars fait partit sept nains	negatif
fois mieux quemoins cela fait bien 	mixte
mise place surheure 	negatif
vois que trop besoin fairereines shopping pour remplir robe	positif
pourquoi supprimer sympa surtout changeait	autre
pas mentirelles sont pas aussi mauvaises queaventuriers	autre
elle pas cul pourprof	autre
tout avec beaucoupchevilles 	mixte
elle aime rien fait est	autre
fille avait bonne tenue minutes shopping	autre
estjolie jeune fillerobepas plus flatteuses 	autre
conseiller pour habiller fonction silhouettebonne pour	autre
effet que autres glorifient torture animale comme pour fourrure	autre
trouve pas tout	negatif
les reines shoppingont 	mixte
monque faux culs 	autre
trop aussi vie	autre
alorsmarre que favorise celle qui ont physique mannequin	autre
pour conserverans face lancement avec sur semaine reines 	autre
pique par moustiques tronchefait peur	positif
soutient pour finale soir	autre
commence foutez moi paix jusqu pub 	mixte
homme parfaitest faire bien cuisine	autre
suis plus proche niveau que	autre
explique jour que veuttouche cuisine sexisme	mixte
allez toi qui gagner	autre
repousse plus loinlimites	autre
sympa belle grosse bague	autre
humoriste mais bluffe hamburger monsieur bravo 	mixte
suisvisionsuper bien fait 	negatif
les raviolis aime pas vraiment	autre
veillefait trop genres	autre
mais non voulais moi 	autre
encorebelle victoire bravo belle	autre
mais toute pasgagne mieux	autre
encore merci pour compagnie autour refaire pour autres 	autre
avez mis celui veux voir celui	autre
met pour sortirpoubelles	autre
captescommentaires sexiste commentateur reines shopping sexisme	autre
entrecommentaires ceux sexistes commentateur	autre
tombant sur suis amoureux jamais truc mais 	negatif
contre jean pas coiffe inculte	autre
son mauvais genre gonflent	mixte
quel carnage nouvelle coupeont fait aux	autre
pour tous sur accusant avoir enfreint loi via	autre
pour tous paris pour protester contre images 	autre
plus personnes viennent signer pour	negatif
contre recueille signatures	negatif
gars pour tous avait alors sorti truc style voilaeuxvrais comme plus acceptable	autre
illustre avec images pour tous – ’ 	negatif
fois ’ peut plus revenirmorte 	negatif
illustre avec images pour tous illustre images 	positif
sur pour tous contre 	autre
commentfinalement parvenue infuser chez 	autre
sens appel mois prison avec sursis euros 	autre
gourou secte alias quenelle encore mois avec sursis prison ferme pour haineux	autre
illustre avec images pour tous	autre
sens appel pour 	autre
mouvements clairement comme pour tous	autre
illustre avec images pour tous illustre images magouilles	autre
pour stopper combat continuer pour tous que	autre
suis pas amis homosexuels pour tous exprime 	negatif
moquait pour tous	autre
gros concernant pour tousversaillais 	mixte
pour tous maintenant jusqu bout	autre
pour tous entier merci 	autre
casseurs gauche lors mais que faisait pour tous 	autre
comparant avecactuellesvraimentpour tous 	autre
vois pour tous fait suis perplexe pas	negatif
pour tous pour personne tous	autre
payer € pour faire faire chignon faire mettrearnaque 	autre
pour tousressentiment qui excuse pour humilier soumis une	autre
affaire terrible choisir croirenoire mais tout parce que riche	autre
bien passage sur 	mixte
parlant plantations titrevoulu que agresseur homme non noir riche aie retenir	negatif
guillaume rencontre pour 	mixte
affaire travail universitaire 	negatif
avait pas auraitque barres 	autre
pour tous continue combat pour stopper 	autre
carrefouront pour tous 	autre
elle lieu escarpins suis 	negatif
est queavezparoles chanson parle pourquoi sais pas 	mixte
sexe politique trop triste homme aussi intelligent finisse comme 	autre
voit investi nouveau peut largement prochaine 	negatif
plus signatures pourmerci	autre
imaginez investis par avecaura oublie heures 	autre
investi autantinvestiture tant	mixte
rythme investir etcque veux mais politiqueassoient 	positif
semaine pour tous paris avril typemaintenant	autre
fort contre « pour tous » faible contrecasseurs 	negatif
pas mais copiemaintenant copie	autre
ironisez sur innocencejournalistes pour	autre
pour juiverie internationale tousclic templesur	negatif
comment financer islamique pour continuer	negatif
sur marine pen pour tous	negatif
veulent non pas pour sortir mais pour reformer fait ansprennentpour cons	autre
les changer alorsont eux construits monstre	mixte
groupe aurait finance islamique via	negatif
vainc plus que islamique	autre
soyons pas trop optimistes quantimminente islamique 	autre
lie groupe islamique 	negatif
pourquoi rester qui trahi vote assumez vos	autre
nerfs appelleretirer les	negatif
ligue arabe est	mixte
les ont floues parcombines suitenon instar capitaliste 	autre
existe plus vit toujours passe quipasnouvelle	mixte
faut officiel que parti nomparti nomme maintenant 	negatif
vivement queterminent que sache enfin qui veut vraimentbaiser	autre
les centristes alliesmontrentvrai visage haine nations peuples 	autre
pas comment faux vont pour rigolo	negatif
captive islamique « auraplus » 	autre
une chance pour primaire	negatif
sur pourquoi islam rien voir avec islamique 	negatif
nom avait chute pas cru bahchaise film ensemble 	negatif
que profitera que preuve fait marche 	negatif
islamique contreguerre communication qui opposeplus puissantes organisations 	autre
mais parti majoritaire estcrois pasveulent 	negatif
interview par bal quenelles juin via	mixte
voici jusqu liste non exhaustive mises examen 	autre
ellepolitique pour assurerface guerre queislamique	negatif
toutesmonnaies vont sauf celle islamique	autre
islamique retournerbien rigoler	negatif
aime pas qui changent rien saufrevenu hausse mais crotte faut pas tomber aussi bas 	autre
apparemment gens ontpas qui colle probablement mini clique pour tous 	autre
comme toujoursservice trouvent moyen mettre sur	positif
fin signifieaussi fin islamique	negatif
seule peut rien contre finance commissaire	autre
« califat » signerafin islamique 	mixte
chef viseur islamique 	negatif
quelle honte pour sera jamais 	autre
chanson fait affaireagression sexuelle surs quelui qui agresse 	autre
islamique via figaro	negatif
saisirpensezanglais pensent hui pas balances avoir bien gratte	autre
recule aucune aberration pour maintenir illusionopposition 	autre
profiter ellepour faire caca technique	negatif
islamique conseils pourutilisation appareils 	mixte
cimentier aurait passe avec via minutes	autre
notre reporter islamique via figaro	autre
A part officiel personne parletabou	autre
pour par islamique 	mixte
vus opportunismeconvictions fusiontemps	negatif
pouvais savoir qui occupe compte pour tous sur 	negatif
combat pourplus bataille guerre	autre
islamique appelant attaques pour 	autre
prison reportage veilleurs primaire	autre
les qui sont capable passer outre sont capable accepter une	autre
vrai coco pas besoin arbitre	mixte
qui toutesappartiennent insultentpeuples matinjaloux mais cacher 	autre
affaire sexuel notoire peut plus 	negatif
turque jointforces celles islamique contresecteur 	autre
passe aussi connu comme islamique 	negatif
que islamique pas pour cibleont avec	autre
pourquoi crains puisque prince croyants roi islamique	autre
est quasiment islamique selonforces irakiennes 	autre
jeunesse pour touslame balayant trahison morale intellectuelle 	autre
celle pour tous boboont passe shaker merci 	negatif
journaliste contre que islamique ait 	autre
inauguration temple cote via	negatif
ben alorspatrons ont surcotisations sociales relais 	autre
pense quoiautres suivez mon	autre
seine maritime cimentier travaillait avec islamique 	autre
ils vertueux glorieux maissont que corrompus 	negatif
soeur jumelle celle fait payerles erreurs autresrichesses 	autre
islamiquepasser pour attaquer	autre
jeu ’ ancien policier islamique 	autre
ancien policier turque infiltrations avec migrants 	autre
toutesanglais peu autant couple avec que avec 	mixte
islamique missiles viacellule via internat	negatif
islamique construit – stop mensonges 	autre
guerre fait que commencermilitairespolice sont faibles pourracombattre 	autre
vous excusez mais moitricheurs favorises trop ambitieux puissants qui chutent comme fait trop	autre
est compatible avec ans bien que parait moins 	autre
matin sur marche quelques jours saint 	autre
ancien policier islamique sur orange 	mixte
policier flux pour 	autre
cimentier avec islamique 	autre
offensive solairs guerre	autre
chine pour renforcer via	autre
’ ancien policier islamique faut pas que ait gagne 	mixte
quenellepays euro ont foi 	autre
pour avoir millions islamique ainsi terrorisme faire tuer sursol	mixte
rate faux ignore sur jupe sonque pour	autre
vote bouche bouche pote flirt religieuse 	autre
’ ancien policier islamique facilite pour type franchir les	autre
’ ancien policier islamique qui que avons pas	autre
paris matchprovince par islamique 	negatif
pas suisse mais islamique avec bravopolonais 	autre
province par islamique 	autre
est train pousse	negatif
– surprise russe met finmanœuvres vive 	autre
les observateurs ’ ancien policier islamique 	autre
appel politique internationale via	autre
est pas nouveau mais lui comme cibleflippe	autre
captive islamique auraplus 	autre
envisage pense queturcs majoritairement veulent pas	autre
estguerre contre pasqui sont turcs ont massivement participe 	autre
une superficielle gouvernement britannique via matins	autre
estencore pas plus que veut proportionnelle	autre
aucun obstacle iranienne via 	autre
quel rapport aveccomme 	autre
province par islamique	autre
paspartipas pro quijuste critique quipas point	autre
chinoishomologue russe sont engages 	autre
« berger fait manuel » selonhaut via 	autre
manuel remake par militants 	autre
parler sang contaminetue car palestiniens suis	autre
puis poulet restaurant chez patrice 	autre
pris flagrant avec pas lui inculpe pour corruption 	autre
chine affichentvues lorsvisite 	autre
visite « allie proche » via	autre
comment ont offert sur plateau agent parmi sur 	autre
rentrer pour guerre via	autre
suffit signez via change	positif
pourquoi pas sur liste aussi mise examen anciensprime pour nation	autre
syrienne milice reprennent villes islamique via	negatif
insiste pour promouvoir apprentissage longue 	autre
toujours tout avecsoutiennent aussi moi sais faire avec mots maisfont rien 	mixte
rencontre chef avant avec contenu 	autre
ils ont appris	autre
officiellementofficiellement tourner statique obtus confus	autre
raison marine fait passer pour billes 	autre
sur ligne front entreforces islamique via	autre
plus hypocrite que manuel meurt	autre
juin nouvelle action contre loi social	positif
exclu interview sur 	autre
sur pas entre eux 	autre
vie selon casse affaire suppression postes reforme bonnes vacances sale con	autre
exclu – message « toujourscotes lutte contre » exclu message toujourscotes lutte contre 	autre
politique envisage sur nouveau traite 	negatif
vous penser que manuel quitter gouvernement 	autre
avec avoir police briser gay avec avoir police briser gay via 	autre
quel vivre ensemblevoulez bannir voile femme musulmane que voulez blancs	autre
primaire petit parti courtise par 	autre
fait tout petit hier rasemurs lui foutre surallez voir 	negatif
« chevalier noir » nouveau enregistre par cote station spatiale via	autre
que fournisse soutiencombat contre 	autre
incapables corrompus bottes sinon aurait pas taux 	positif
’ ancien policier islamique via lobs	autre
important liremententtrompent guerre 	autre
nouveau traite incroyable 	negatif
notre pour « non projet sera »	autre
crois qui fut parottomans pas tout agent	autre
est que sur site 	autre
offertmissiles supersoniques marine 	autre
offrelance missiles via 	autre
enjeu tue jeusont	autre
massacre lieu que auteur soit coalition 	autre
plustout simplement pas assez 	autre
revirement sur organisation sur	mixte
finalement aussi tiens avait oublie courbe inverse pasballot faute sic	autre
les chefs partisimpression par 	negatif
majeur primaire via figaro	autre
investiture lui mis examen invoque	autre
coup soleil fait taille	autre
une captive islamique met « auraplus » ancienne captive islamique met auraplus 	autre
pourquoi soutientnom vrai 	autre
veut nouveau traite via figaro ❓ ❓ ❓ pas nouveau traite 	autre
faitclasse que tout explique bien	autre
veut nouveau traite via figaro sur lequelassis 	autre
emploi hausse nombre mois mai 	autre
pour qui roule via usa	negatif
notre niveau vigilance sans 	autre
chute manuel stabiliseplus bas juin 	autre
politique chute manuel stabilise 	autre
qui veutrefaire coup nouveau traite comme 	autre
fait partis politiques 	autre
notre met pression	autre
guerre contre guerre contre	autre
chine signent plus — chine informations 	autre
investiture lui mis examen invoque via 	autre
nouveau pour via	autre
profitez arrivera pas souvent 	autre
gros mou tellement 	mixte
faut pas avoir peur peuple non traite pour passer force 	negatif
avec encore fait conneries toi encore multipliermanœuvres militaires	autre
marine penentretien avec « ’ refuse » pas 	autre
ils veulent pour avec palier faire pareil avec 	negatif
chute manuel stabilise politique	autre
les premiers virer avant union seraitbon rien juste bon foutre 	autre
arbre qui cache foret entreprises qui avec 	autre
incarnez manuel jeu via	mixte
instar compris plus sur moyen pour passe par mensonge politicien	autre
coup fait comment gagne euro	autre
finalement rien change sauf que sont jeuxpeut 	mixte
ils ont temps pourrimines plus haut maintenant respect	mixte
les propositions sont bricolages pour jeanpro 	autre
faites suivre voila explication pourquoi pas car qui 	autre
veut nouveau traite via figaro 	autre
franco russe poursuit	autre
appel comment sait sans parle journaliste 	negatif
soumis fera toujours politique	autre
quel pantinvraie girouette clown quifait pas rire affligeant	autre
fait plaquer rien exigerincapable rien 	autre
pas existe fais oui oui hochement continue sur colonisation que mal	autre
voles verssinon sontarabesvoleurs 	autre
qui pensait sur pont seul cote surpris par souhait associer 	autre
consulte pour politique	autre
nous pisse essaiefaire croire pleut 	autre
pas faire passer loi travail mais veut	autre
cri alarme menacenouvelle guerrebien 	autre
match rappel argentine coupe	autre
les pays veulent que engage sortie plus vite via	autre
les millions euros via	positif
voici risibles que croissante silence sur 	negatif
les peuples rejettentquiopprime symbolesociale immigration 	negatif
primaireaffranchis qui osent politique via	negatif
planche billetscancres politiques officiel 	negatif
nomme pour sortie royaume uni via minutes	negatif
accroche tel moule vision politique look 	positif
assis comme gossevivement 	negatif
voles par amis vers bas vit vol	autre
femme ayant bronzer cul agacevoisins 	autre
inacceptable sauf pour aitterrasser gaza juste pour palestiniens agresses rien 	mixte
ressertliens avec chine proche points vue	negatif
appel faut guerre 	negatif
viens tomber sur photosenvie terrible avec bacon	autre
aussi sur nouveau traite paris juin 	negatif
repart hausse mai 	mixte
une loi « » « surveillance masse » 	negatif
rama sur classe 	negatif
primaire gauche via	autre
arabe syrienne camions citernes 	mixte
affirmer clairement reste ouverteaux 	positif
Aune loi « » « surveillance masse »	negatif
pour exclure quipropres raisonsoccuperjamais pour 	autre
pas pire injustice 	negatif
abroger loi sur pas enfants 	positif
ans tout apporter 	mixte
une interrogation pour toute	positif
primaireaffranchis qui osent comme qui propose revenir ans	mixte
aveuglement bleu grecs mayas linguistique chine mayas 	autre
les chefs parti 	mixte
loi « » « surveillance masse »	negatif
finit fait faute politique qui coupe base autre morale pour 	negatif
qui ’ cherche islam raie pas 	negatif
chine lance nouvelle longue marchequi son	negatif
avait solutions pour sauver pays lors primaires cela serasacre surprise pour tout pour lui	mixte
chineracheter via figaro	mixte
plus guerre sur continent terreur entre usa pas 	mixte
les maillot sont vente flash bon laissez nous	mixte
pourprimaires chezpeut envie	negatif
situation proposerais projet cinq points pour	negatif
chine lance avec porteuse nouvelle longue marche chine lance avec 	mixte
propose que ’ teste sang turque propose que teste sang turque via 	mixte
qui ans boulettes penser que pour pas 	negatif
plus que marre qui vraie gauche pas celle 	mixte
honte rien situation proposerais projet cinq points pour 	negatif
politiquepar pastrente ans 	positif
situation sur via	negatif
veut nouveau traite 	autre
une superficielle via 	mixte
travaillait avec islamiquesanctionsviennent 	positif
chine veut sous marine	positif
vote britanniques met gravement 	negatif
que islamique plus fortchoisir gagnant	positif
fait ans rit plustrop triste retour 	positif
les flops euro	positif
politique avant politique via	negatif
marine pen fin non recevoir via	negatif
pour sauver fait	negatif
olivier invite politique 	positif
centre avec juste	mixte
temps accueillirinvite politique	positif
est aurapolitique plan nationale 	autre
festival lin chine pire truc atrocegens rigolent 	positif
propos ont sollicite intervention merci	positif
pas avec lui moins rit sens que politique sera longue chiante	negatif
olivierinvite politique enfinpersonne	negatif
les affaires qui pourraient freiner – via	negatif
veut chef islamique’tue 	positif
local posteavons jamais soutien maire ministre 	negatif
politique justice italienne 	positif
allez province chinemangerez peut agit 	positif
livres moi bouquin chine japon livre	positif
toujoursfeux artifice voici chineseul que 	positif
que capitaliste henry avait compris augmentantsalairesouvrierspenser	positif
que contre avez pas parler avez 	mixte
union assume loi estvia figaro	positif
craquecontre enfin celui avant	positif
chine fairebase africaine 	autre
vraimentpire que pas compte	negatif
vraiment bon mais pourquoi pas plus loin politique qui vote pour	negatif
pas besoin journaliste politique pour constatertoujours plie tout	mixte
veut que prenneinitiative forte via	negatif
casse toi pauvre con toicomplices politiquemorte	negatif
lors congres nationale associations familiales politique	negatif
voulait faire partir mettre maintenant vientbon rien	positif
