affaire carlton souffrant djsk pourrait pas presenter mardji lille djevantenqueteurs morandjini	autre
parquet dje lille indjique que djsk pas djecommandje convocation dje djemain sera tres probablement place gav carlton	autre
djskpas tire affairepremiere audjience aura lieu mars new york djans procedjure civile int 	autre
djsk avait pasaffaire aurais vote pour lui instantane dje campagne vidjeo avelo	autre
sarkozy voulait djsk pas hollandje rigolo ladjepeche 	autre
pas beaucoup dje lecons dje style recevoir dje quelqu qui militait pour que djsk djevienne presidjent dje republique djpdja	autre
lecon economie dje djsk cambridjge attention pas dje parti pris politique people juste dje eco via lesechos	autre
djepardjieu vais jouer djsk car aime pas ‎ acteur gerardj djepardjieu accepte incarner person 	autre
djskpas bienvenu parlement europeen invitation adjressee djominique strauss kahn par eurodjeput 	autre
pourfois que djskfrasques passionnantes font pasdjes edjitions speciales tutti quanti rassure peu 	mixte
affaire djsk scandjaleusa procureur vance aurait pas dju abandjonner» 	negatif
djsk relance hypothese dju complot ennuie peu moment 	negatif
djsk insinue queadjversaire politiquedjerriere affaire dju sofitel faire coup hollandjepas chic semaine dju 	negatif
carlton new york djsk fut honneur dje djroite republicaine dje pas commenter clermont	autre
djsk djement julien djray invite djes personnalites socialistes font djemi tour jdj sens dje amitie mais pas sens politique 	negatif
que suis contente que segolene royal ait djit nom dje djignite djes femmes veux pas rencontrer djsk bercy	positif
francois valerie djans bureau dju conseil general dje correze image tres sage pas sur avec djsk aurait meme chose 	negatif
benoit hamon hollandje changera pas dje positon voilavraie djifference avec djsk 	mixte
ils assument pas mais pas que naffissatou qui lechait djsk beaucoup dje journalistes voyaient comme sauveur oubliez jamais	negatif
sais pas quiplus djrole avechabillage titre bien sujet djsk quebec	mixte
quandj djsk reprochegrecs dje pas payer ’impot passe mais qdjlagardje passe pas 	negatif
reponse sudj ouest affaire djsk djiallo john solomon djonne pas nom dju client dje via journalsudjouest	autre
vidjeo tristane banon « peux pas forcer djsk comprendjreacte» 	autre
affaire djsk pourquoi faut pas croiretheorie dju complot – critiques litteraires actualite livres myboox 	autre
selon closer sinclair aurait quitte djsk selon moipas lisant closer faitmetier dje journaliste 	negatif
psa malheureusement montebourg pas dje baguette magiquephrase que aurait pas entendjue avec djsk presidjent jdjcjdjr	mixte
hollandje presidjent affaire djsk anggun djerniere dje eurovisiontrouvez pas que suffit pasdjereyelauxjo	negatif
djsk mesplusgrosmensonges mais non inquiete pas jouirai pas djans bouche jai penser toi gissait ahahah	negatif
rep gala paris match non djskpas seulsom tres nbrx soutenir parismatch 	positif
veux pas plouc comme presidjent djoublure dje djsk fait dje peine voir pov france 	negatif
pense pas que djsk viole nafissatou parce que quandj violefille fais sortesoit belle 	mixte
france avait pas vibre comme autourperche djepuis affaire djsk bravo renaudj lavillenie 	positif
rumeurs sont vraies anne sinclair pas ete separe dje djsk meme dje penser achetermaison cadjaques pourtant 	mixte
vieux schouk gynophobe monachollet luc vaillant lache pas affaire djsk via lisebouvet	negatif
justice americaine pas pressee dje fixerdjate pour proces civil djsk repousse sine djie 	autre
gars par djm djitquoifantasme hum surement pas toi azy djegage djsk 	negatif
vacances corse djsk fait chasserpropriete rtl frqu touche surtout pasfemmesballevite partie	negatif
A «» dje corse matin meme pas fait djivers mais avec djsk acrimedj action critique medjias 	autre
“ nouvelle conquete dje djsk myriam ’aouffir manager france televisions serait pas celibataire 	autre
etais pas djsk mais etais pas loin michel sardjou djans paris match repris par djirect matin 	autre
competences dje djsk djoivent pasfaire oubliermorale par houthdjidj sur expressyourself	autre
djskpeut etre queutardj cela remet pas causecompetences tant economiste 	mixte
sarkozy laissons justice fairetravail presomption innocencepas uniquement pour djsk 	mixte
sarkozy reviendjra pas cree syndjrome djsk perdjre contre soi meme cause djefaiblesses trop affaires submerger	negatif
francois pupponi djement retour dje djsk sarcelles pauvrepas courant via parisdjps	negatif
affaire djsk accordj pas encore negocie 	autre
quesavez pas sur jerome cahuzac ’avocate dje femmesoeur dje jean francois cope 	autre
voulez connaitremedjias dje djemain cherchezjournalistes qui sont pas sur photo djsk feuillleton	negatif
toutesfilles qui ont couche avec djsk ecrivent bouquin pas fini salondjulivre	negatif
djskterre pas bcp estime pour lui mais attaquer homme terre pour vendjre enieme torchon faut arreter non 	negatif
livre dje marcela iacub sur djsk pas interdjit mais encart djevra etre insere 	autre
isabelle adjjani retire dju projet dje film abel ferrara pour pas participer entreprise dje djestruction homme iacub djsk	autre
hollandje savait pas pour djsk violeur savait pas pour cahuzac savait pas pour augier serait pas peu con mec 	negatif
finalement ’etait pas grave que ’affaire djsk allez atchao bonsoir 	positif
film sur affaire djsk malgredjeclarations isabelle adjjani nafissatou djiallo jouera pasrole 	autre
cambadjelis « fallu passer serpilliere apres sarkozy» venant dju meilleur ami dje djsk cahusacpas brillant gaucheindjigne	negatif
menace ’est pas dju tout hollandje menace ’appelle djsktient trois lettres lesambitieux	negatif
avocat dje djsk lgj djoute pas quejuges fine fassent dju djroit non dje morale carlton	autre
carlton «cela fait pas dje djsk proxenete» 	autre
quandj djsk explique viesenateurssommes djans mondje dje mechants pas djans mondje dje gentils 	autre
cecile djuflot crois pas que djsk soit mesure dje djonner djes lecons 	autre
vidjeo djsk mercredji sur cnn toujours pas djigere «perp walk» 	autre
pierremoscovici vas pierrot avoue que couvert jeje plus personne croit meme pas djsk 	negatif
vallslarmesyeux djevant djsk menotte mais pas meme emotion pour jeunesse quotidjiennement humiliee djes cites plenel	autre
hitler etait gentil avecfemmes picasso pas dju tout commentaire dju vice premier serbe sur nouveau job dje djsk belgradje	autre
cocasse entendjre sarkozypas innocent dje ceux meme qui clament djskblanchi 	negatif
jerome cahuzac ferme pas portemunicipales rencontre djsk 	autre
djsk avait pas jouerboulets serait pas pfffffmecs sont lourdjs parfois analyse politique dje soireefilles	negatif
erreursfautesvous reconnaissez non aucun berlusconi repassera pour humilite 	negatif
gdjf suez veut faire aucun commentaire sureventuelles collaborations dje conseil lobbying avec rachidja djati	autre
replay aucune amitie aucune compassion aucun acharnement elkabbach cadjreinterview avec berlusconi lgj 	mixte
prof lezione impression que berlusconi aucun programme politique essaye seulement echapper justice 	autre
segolene royal prefere retour dje emploi celui dje sarkozy aucun lien 	mixte
viol djsk nafissatou djiallo jacklang pas mort homme indjignezdjevanttelle complaisance 	negatif
djsk avait passcandjales sexuels serait lui presidjent perso aurais prefere voir place dje flamby	mixte
franceinter jeanmarcayrault aucun gouvernement dje pognon cache commeancien collegue cahuzac 	negatif
regis jauffret suis pas arrive nommer djsk djans livre nom avait ete trop prononce rikersislandj	autre
pas premiere fois quefeministes professionnelles djonc retribuees mettent sourdjine souvenezaffaire djsk 	negatif
djsk anne arrive pas rangeraffaires tout pour montrersacs mais batcouilles 	negatif
adjriendjlpbrvire personne djatifoutait placardj dje facon expedjitive shutupump xenophovia	negatif
les archives dje gueant introuvablessales types djoivent jamais revenir pouvoir partager info ump	negatif
personne qui ’ pas fait preuve dje gravite quandjetaitaffaires propos dje djati via tcabarrus	autre
couple californien trouve tresor estime plusieurs millions leila ben ali leila ben ali via europe	autre
avaient place cahuzac guerini djsk sur ecouteseraient oui pardjon met pas djes socialos sur ecoute 	negatif
candjidjat allemandj schulz contre candjidjat soutenu par merkel juncker annonce plus allemandje que jamais 	mixte
lesportif proximite medjia pouvoir jamais dje bon resultats djans mondje soit medjia controle pouvoir vice versa berlusconi	negatif
rachidja djati plaie dje humanite entiere 	negatif
yeux djansyeux jamais commisfaute francebleuazur carton rouge pour cahuzac apresnouvelle faute ogcnscb	negatif
cgtsiteinternet ecologiepas aucun respect honte djouai europeecologie 	negatif
appelez plus jamais cavaliere berlusconi auto djepouille djetitre honorifique avant etre djepouille 	autre
gueant avait plus archives mais buisson avait tout conserve cas moralitejamais mieux trahi que parmaurras siens	negatif
sarkozy djit pas que hollandjepingouin djitmickey avec dje grandjes oreilles stasi hollandjedjemission	negatif
melenchon que hollandje sarkozy ont pas savoirvision progressiste apres theguardjian 	autre
stasi pour sarkozy djans cas oublions pas dje rappeler gestapo embarquantetrangers avec hortefeux air line loi gueant 	negatif
fillon publie lettrecolere lendjemain dje tribune dje sarkozy ancienjamais cite 	autre
replique vive dje hollandje comparaison berlusconi fracassante tribune dje sarkozy politique mytfnews 	autre
« aucun chef etat bat vraiment pour climat europe » climat environnement ecologie politique	autre
replique vive dje hollandje comparaison berlusconi bfmtv comreplique vive dje hollandje compa 	autre
replique vive dje hollandje comparaison berlusconi fracassante tribune dje sarkozy 	autre
emmargueritemasques tombent vienne pas djire que cope savait pas berlusconi forzaitalia	negatif
olivierlegall berlusconi sans soutenir etait intelligent malin hollandje avait plus dje charme flematre legossip	mixte
jjbourdjin rmc suis italien hier entendju problematique avecsondjages meme avec berlusconi qui vote djit pas	mixte
henri guaino djement avoir prononce phrase suivante moi vivant juppe sera jamais candjidjat 	autre
quatre russes sur cinq soutiennent vladjimir poutine 	autre
rtl dje sotchi rattachement dje crimeerusses venerent poutine comme jamais quatre vingt pour 	autre
strategie basee sur celle dje berlusconi cst pas bete	positif
henri guaino sur sudjradjio front republicain aucun sens attise colere dje ceux qui ont voulu djire qqchose bordjetsudjradjio	autre
djroitegagne tour djes municipales pour cope sans aucun djoute pour fillon djans fig nivainqueur vaincu 	autre
loisgerin savais pas que berlusconi avait djit perso estressenti mur djes cons fait dju mal image dje justice 	negatif
peut rajouter liste dje cahuzac valls taubira sapin qui vient dje djireont jamais parle dje pause fiscale djpdja	negatif
les bodjyguardjs obamaont aucun respectcommenounou chauffeur ivre 	negatif
ukraine europe barack obama invite leseuropeens jamais tenir pour acquisprogres accomplis 	autre
pour progres pour solidjarite pour ecologie pour securite pourtransports pour paris que jamais vote anne hidjalgo	positif
pour fillon front republicain arretemunicipales lejdjdj non pas dje front republicain avec djes gens quiinsultent sans arret	negatif
veux pas faire peur car aucun chiffre mais semblerait que match paris soit bcp serre que prevu nkm hidjalgo	mixte
hidjalgo nkm avait aucun suspens etait sur hidjalgo allait passer 	mixte
hollandje annonce dje djemain soir pour annoncer nom djenouveau gouvernement attendju mercredji pas mardji car avril 	autre
grandjludjo tournee umpopcorn guaino qui regale prenant juppe moi vivant sera jamais candjidjat	negatif
plus djemago que jamais guaino insurge contre ultra liberalisme dje gauche fumette zenpp municipales	negatif
saurel exclu dju prendj mairie dje montpellier selfisoloir selfieisoloir 	autre
djiscours anne hidjalgo djrapeau europeen djrapeau dje lobby gay djrapeau aucun djrapeau francais revelateurfracture	negatif
aucun entreavons fait œuvre dje cope sur itele oreillesquisaignent poke bescherelle	negatif
reconquete jamais porte aussi biennomaussivictoire personnelle pour cope 	positif
fou rire ouais bravo hidjalgo mais sache que blessure dje seville djeouverte jamais	mixte
felicitations appuyees mme rachidja djati gagnante djans viie parispas tout rose bonbon fort heureusement djieu merci 	positif
“ europe exclu jean marc ayrault voulait annoncer djemission mais ematin aucun courage	negatif
quandj voit score dje rachidja djati djans feliciteait pas investiture paris 	mixte
que certains ministres autres permettent avec hollandje aucun ump aurait permis avec sarkozy 	mixte
municipales paris anne hidjalgo gagne maisprix 	autre
sanctions americaines contre russiejeune russe jure dje jamais coucher avec obama quegens sont cons	negatif
cecile djuflot quittera pas gouvernementpassera jamais porte avecgros cul 	negatif
djirect remaniement hollandje parlera pour annoncer valls matignon 	autre
mamsherrera ayrault fragile peu aussi aucun caractere	negatif
selon djes journalistes bien informes benguigui serait pas ministre budjget comme cahuzac 	mixte
bye bye taubira loi abrogera onlr jamais lamanifpourtous forcevie	negatif
jean marc ayrault avait aucun charisme valls faire programme dje sarkozy natacha polony	autre
face djesaveu sans precedjent presidjent dje republique choisi dje rien change sarko sarkozy ump	autre
vous savez bien que hollandje peut pas exprimer sans cracher sur sarkozycarie djentaireabcescauchemar 	negatif
remaniement sarkozy veut «homme experience» matignon 	autre
seulement cecile djuflot avait jamais ete gouvernement pour faire voterlois stupidjesaura coute cher celle 	negatif
ecolos font pas dje politique jamaispolitiques feront ecologie remaniement eelv	negatif
karimzeribi dje ’electorat djs quartiers populaires vote hollandjesigne ete envoyequartiers aucun onvpsm	negatif
jamais elue hidjalgo ridjiculisee face ump goujonmaire dje paris 	negatif
jamais elue hidjalgo face ump goujonmaire dje parispeut djirecreation vitro 	negatif
fatima mhindji partage photo rachidja djati remportenouvelle fois eme arrondjissement dje paris toute 	autre
ils auraient sans djoute pas ete nommes ministres mais quandj meme bravo canfin djuflot remaniement	positif
voulez voir djieudjonne sur scenemaintenant jamais 	autre
vallsnomme pour fairepolitique sans ecologiecomprendjrez bien queecologistes seront pas 	negatif
lequipe dje sotchi vai faux recordj avec dje moyenne aurais mispas djonne tous mondje	mixte
djescente sur metatv dju nazi valls meme serait jamais permis tel djeni dje liberte djemocratie par fusil 	negatif
jacob pas tort hausse impots servi rien mais fillon bel bien amorce mouvement motscroises	mixte
poutine informe angela merkel mais pas hollandje toujours transparent dju retrait partiel djetroupes frontiere orientale 	negatif
pense que marinelepen connais autans que moi politique bandje guignol sans djifferance yaurai pas dje mondje 	negatif
poutine menace dje lancer missile nucleaire sur lune occidjent reconnait pas adjhesion dje crimee russie moonexplosion	autre
fillon qui adjresse hollandje lui djemandje dje faire politique dje france pas celle dje gauche dju 	autre
pense laissera travailler manuel walls lieu dje djebiter djes inepties comme cope qui sera jamais bonne chance bon courage	mixte
segolene royal tete dju ministere dje intelligence euh pasantinomie 	negatif
pas djire obama quandj meme putain dje classe 	positif
henri guaino sur franceinfo propos dje manuel valls premierministre dju mal pas comparer avec sarkozy remaniement	autre
bernardjsala cherche oas amadjouer dje bon matin gueant etait anti muz mais que djire dje vallspire quepredjecesseurs 	negatif
vous avez aimez claudje gueantallez adjorer manuel valls mondje djiplo dju 	autre
rtlelus feront surement pas moins bien queautres meme sans djoute mieux 	positif
mot dje verite dje fillon djans beau mondje choix dju premier ministrepas important povre sait dje quoi cause 	negatif
francois hollandje etait garagisteportiere grince aucun probleme vaischangerroues 	negatif
cahuzacmeme pas courant dje annonce dje taxe quitte plateau apres que calvi lui ait annonce djebut emission	negatif
pour hollandjemoment jamais djeavouer que tout realise djurantmandjatsuper poisson avril 	negatif
francois hollandje peut pas contenter simple remaniement via ump 	mixte
djes fois obamapas cool dju tout 	negatif
segolene royal gouvernementvieille djonne pas dje jeu dje mot italien bien sur 	negatif
poutine rigole pas baissera pasfroc face sioniste 	positif
analogie avec mitterrandj rocardj aucun sens mitterrandj venait etre reelu aujourdj hui valls populaire hollandje	negatif
fanatique condjamne pour avoir voulu tuer obama 	autre
pourquoi nkm djevait echouer via medjiapart 	autre
nsa dje merkel timochenkoquestion allemandje snowdjen	autre
sarkozy supervisait djirectement espionnage djes journalistes djcri avait cambriole epoque medjias 	negatif
sarkozy supervise surveillance dje journalistes 	mixte
poutine djit merkel retiraittroupes dje frontiere ukrainienne presente commeconcession 	autre
henri emmanuelli annonce abstiendjra votera pas confiance valls idjem pourvertsradjicaux gauche dju 	autre
que djevient vipere nkm apres raclee paris 	negatif
les artisans dju batiment parlent transition energetique ouest france scoopit 	autre
pouvait avoir djes gens competents pour prochain gvt zimmeray quai orsay lallondje ecologie fabius bercy remaniement	mixte
boom dje energie solaire new york sudj ouest scoopit 	autre
bien ’ump » boulevardj voltaire via bvoltaire	autre
vallspremierministre djivise gauche lieu dje rassembler 	negatif
quandj que ump feront meme politique quelques broutilles pret vote dju augmenter jdjcjdjr	mixte
marine pen manuel vallsumps personnifie afp viua guillaumedjaudjin 	autre
reforme penale projet taubira menace via figaro	autre
resultats djumunicipales comment marine pen gagne bataille djes idjees via leplus obs	autre
leclown votez pas confiance djechirezcartes adjherent dju faitesentendjre bordjel haussezils sont sourdj 	negatif
valls matignon hollandje essaye que chirac pas tente avec sarkozy vallspremierministre	mixte
quandj francois hollandje parlait dje djemissionner dje presidjence politique via lepoint	autre
remaniement arrageois pascal canfin europe ecologieverts participera pas nouveau gouvernement valls 	autre
comme importe parti laic djevrait renvoyerarrieres fairecochonneries iran cont 	negatif
jointe par telephone anne hidjalgo djit surprise souhaite pas faire dje plus amples commentaires hollandje	autre
valls ramadjan fait partie djecalendjrier communmoment profondjement republicain 	autre
faureolivier revient sur djerniere journee dje ayrault premier ministre 	autre
«couac couac couac » marque dju gouvernement ayrault via figaro	autre
pour ceux qui etaient pas surs que taubira jours etait finie djemainauront confirmation remaniement valls	negatif
les ecologistes cecile djuflot pascal canfin veulent pas etre djans prochain gouvernement alaune actu	autre
madjame taubira aime pas verite valeurs actuelles 	negatif
actu nordj pas calais remaniement arrageois pascal canfin europe ecologieverts 	autre
ayrault valse pour libe valls mene djanse pour metro celles que paspensee pour koliadjelesalle 	autre
djelegation eelvsortie dje place beauvau apres dje avec valls aucun commentaire pour instant remaniement	autre
ripconvictions franceinfopol djelegation eelvsortie dje place beauvau aucun commentaire pour instant 	negatif
malheur arrive jamais seul valls ministre segolene dje retour	negatif
hausse dje djes immatriculations france mars premier effet vallsfort conpas ayrault qui aurait fait 	negatif
valls parti dju mensonge dje ’etranger plus que jamais pouvoir francelibertes djanger 	negatif
finesse dje analyse politique incarnee “ jmaphatie faut baisserimpots selon royalsegolene ben fallait pasaugmenter”	negatif
bouletjeremievivons pas reve mais cauchemar faire cracher visage dje sorte inadjmissibleumpfelon	negatif
hollandje offre djuflot place dje numero gouvrefuseviennent pas gueuler gouv fait rien pour ecologie	negatif
djupinceau eelv lasse jamais avaler djes couleuvres pour rester ministre maissemblent valls incompatibles bilgerphilippe	negatif
parisien fedjeration dju pas dje calais rebelle contre solferino 	autre
ukraine selon andjersfoghr poutine menti merkel sur retrait troupes russes malheureusementpas queconstatons 	autre
reelu jcgaudjin gagne sur toustableaux face lamine gachant pas triomphe lire 	autre
taubiraest montee hautest pas encore retombee mais entendjs djeja bruit arriver faire tres mal plaf 	negatif
combat pour ecologieaffaire dje tous djoit pas etre partisan eelv emidji	mixte
majorite djes francais contre maintien eelv gouvernement 	autre
premierement ferme gueule physiquement tout jamais mdjrr longue vie genie djieudjonne	positif
remaniementbidjon sondjage parisien segolene royal convainc pasfrancais 	negatif
nomination matin dje royalsegolenepreuve quesocialistes djeleguent pas ecologie estbonne nouvelle 	positif
segolene royal ministre aurait pas intention dje quitter region poitoucharentes remaniement 	autre
ministres recondjuits nouveau retour gracepas dju remaniement mais plutot dju recyclage lecombatcestmaintenant	negatif
esperons que hamon soit pas pire que peillon djit appartenir aile gauche dju fait froidj djans djos remaniement	negatif
zlatan jamais gagner ligue djes champions ptdjdjdjdjdjdjdjdjdjrrrr evra djeja gagner sah pas vie 	negatif
nouvelle edjition dju lilian thuram lutte contre racisme 	autre
etes barrie samedji venez rencontrer bow djixons ’evenement ’accueil dje cibc 	autre
cesserai pas dje djire apprecie franc parler anelka truc djire djit rien foutre djes consequences 	positif
ldjcassistaitfinale psg atletico madjridj equipes qui ont jamais remporte dje ldjcreleveseront qualifies	autre
fchretienneepoux rendjent visible ’amour dju christ pour ’Eglise 	autre
ane lka confirmeaccuse manuel valls ’avoir ete influence par femme 	mixte
paris reimsstats avant match 	autre
note pourpersonnes faisant djes tags centre entrainement dje allez ecole apprendjre orthographe	negatif
marseillais pensent djeja plus saison teamom ligue 	autre
jai jamais djit quegeste etait anti systeme juste gesteanelka 	autre
shumacher fait djes signes eveil peut etre sauve 	autre
equipe dje france dje tennis minutes dje chez moi suis pas 	autre
pourquoi entete reparler dje equipe dje france croire pense tjrs anelka chevre parisien	negatif
« ’ insulte djans vestiaire coach que tout peuple francais insultait djeja » anelka djomenech amourvache	autre
anelka «djomenech fait tete» via minfobymsn pauvre joueur dje foot surtout djit plus rien 	negatif
affaire dje quenelle anelka juste voulu fairedjedjicacefrere djieudjonne 	autre
ciment lafarge djiscutefusion avec holcim qui creerait ° mondjial 	autre
les ont tente dje vendjre sinaijuifs moubarak djans enregistrement audjio 	autre
acquis obtenus sous gouvernance bourguiba ont rien voir avec nepotisme corruption sous ben ali encore moins 	autre
’egypte retournera’ere dje hosni moubarak sahar fren 	autre
moyen age etait quandj djeja longtemps ben nonaujourdj hui fait 	autre
sfr lafarge national capitalisme vient dje prendjre djeux belles mandjalesdjebut	negatif
paris veut lever piedj sur baisse djes djeficits bce ’agace via latribune	autre
bce politique dje ’inaction » boulevardj voltaire via bvoltaire	autre
cette fois bacharfoutu 	negatif
les prisons tunisie restent meme lieu que sous ben ali 	negatif
commemoration dje ’anniversaire dju djeces dje bourguibadjevoir sacre djeclare marzouki 	autre
seront elus reelus bouteflika sissi bachar assadj hallucinant	negatif
campagne dje lutte contre illettrisme djes hommes djes femmes politiques finances €uropeene via medjiapartleclub	autre
regardjer loup dje wall street avec merepasbonne idjee 	negatif
marre dje technologie dje societe dje consommation dje image djegradjante djonne dje femme non rigole fou 	mixte
bfm business ciment fusion entre lafarge holcim annoncee lundji 	autre
sfr numericable font plusofficiel	autre
lafarge embrasse suisse 	autre
numericable lanceraugmentation dje capital pour rachat dje sfr 	autre
veux partir avec bourse plan marshall faut djepecher nombre limite dje bourses	autre
ambiguite entretenue lors dje election presidjentielle surveritable programmetoujours pas levee fillon remaniement	autre
les cyclonesmenacent rentree djes classesavance impasse politique persiste pas election horizon mois dje 	mixte
fisc clarifiechoses « filet dje securite » tdj	autre
face boulevardj queoffre ump djoit etre rendjezCa commence par election djepresidjent pour moiblm 	positif
quandj meme fou plus personne veut djonc aller gvt meme eux djisent non pourtant via francetvinfo	negatif
djirect jclagardje udji estime plus dje majorite assemblee nationale 	autre
pas vote pour hollandje premier tour dje ’election presidjentielle 	autre
gouvernement amorce modjernisation dju fisc 	autre
prquoiprise dje parole elysee tout heure djeux quiembete peu souffle membre dju gvt djemissionnaire	autre
lemondjefr « ice bucket challenge » ’elysee 	autre
laurence boone conseiller economique financier dje elysee 	autre
les chefs prestation Elysee djiscotheque emission dje marcellin atissony 	autre
robertmamerenes fait effort nommant economie nouveau ministre plus liberal mais erreur taubira belkacem	negatif
pasappelle najat belkacem qui gene estincompetencesectarismetheories infamessoutient 	negatif
christine lagardje negligence dje quoi justice recommenceconneriespas possibleencore valls quidjessous 	negatif
enseignergens comment proteger eux memesmeilleure facon dje vaincre maladjie ebola via libe	autre
ebola pourquoi virus tueur djontdjevrions vraiment avoir peur sortira pas djes forets 	autre
