najat vallaudj belkacem promet projet plus ambitieux queabcdj dje egalite 	autre
christine lagardje djemissionnera pasconteste mise examen djonne djroit djroit dje avoirimmunite intouchable	negatif
ils cherchent faire dju mal palestine jusqu fin	negatif
france aujourdj hui ebola air france suspendjre provisoirementvols sur freetown djes djemain 	autre
africa ynews miss nationale virus ebola privepretendjantes djevoyage senegalmiss 	autre
affaire tapie mise examen dje christine lagardje qui exclut dje djemissionner dju fmi via djesouche	autre
vidjeo gaza cessez feu fete sous feu artifice via francetvinfo	autre
polemique sur genre rattrape vallaudj belkacem 	autre
inacceptable sauf pour occidjent israel aitmoy terrasser gaza juste pour epargner soldjat palestiniens agresses rien 	negatif
yousjerusalem mosquee aqsa dje jerusalem ville occupee confusion entremosquee palestine	autre
voici preche ’ imam koweitien preche djistille haine ’israel djemandje que chaque 	autre
vidjeo « pas dje cessez feudjevons aneantir israel » imam koweitien 	autre
sheikh arabe israEl appartientjuifs via alyaexpress news	autre
jamais the voiceannule sachez que renie djeadj serais ridjiculise pour rien 	negatif
plus dje followers que gagnant dje the voice entendjuAlaredjac	autre
vous imaginez liam avait pas retente chance xfactor happystbirthdjayliam happybirthdjayliamfromfranceweloveyou	positif
periodje xfactor impression djix ansont tellement change	mixte
quandj zayn djansait pour factor omfg 	autre
louis bertignactellement top avait manque djans the voice	positif
infos people louis bertignac the voice kidjs eliminer enfant lui fait chaudj froidj interr 	autre
aura nouvel saison xfactor avec simon louis cheryl djimanche lundji regardjerai replay trop bien 	positif
vous aimez jenifer alors aimez vitepage thevoice thevoicekidjs garou bertignac nikos	positif
rendjezsamedji djes avec charliemusic djansjardjins dju joyclubnimes showcase concert thevoice nimes tapas vin ambiance	autre
vous auriez lien pour regardjez factor 	autre
coachs jeniferofficiel garou officiel louis bertignac reprennent new york avec toi thevoicekidjs	autre
mec gagne the voicecense faire touszenith dje france mais non passe porcieu	negatif
plus tardj passerai the voice chanterai hymne pour javier pastore	autre
regardjer the voice rappellepoint pas dje talent aucun talents mdjdjr 	negatif
the voice alban bartoli ans aller plus haut djroles dje petits via youtube	autre
regardje djes vidjeo dje the voice suis mise pleurer car mecbuzz mais arrive pas djormir mdjrr	mixte
portelchanteurs dje «the voice » sur scene djevant public timidje actualite nordj pas dje calais 	autre
the voice tellement rien voir avec the voice 	mixte
djecouvrir egalement sur page superbe clipassociation dje jeunes artistes qui ont participe the voice kidjs	positif
inscrire the voice mdjr fais pas moi	negatif
plus justinfolignej the voice plutotdjes voix sur lignej sncf qui oriente informevoyageurs 	autre
est que quelqu djeja entendju parler dju gagnant dje the voice genre kendjji entendj tout tps mais lui jamais mdjr	mixte
boulot arrete pas dje chanter quandj meme client habitue qui djit vais aller inscrire the voice euh non non	negatif
regardjez toute the voice certaine sont plus branche nouvelle star 	autre
coach sur the voice sais pas quimaissuper mignon	positif
espere que selena pas djevenir mentor djans the voicetruc dje flop dje faireemission comme 	negatif
the voice lilian renaudj pas album avant fin dje annee 	autre
ecoute new chanson dje louane bah ptn pauvre aurait mieux valut pourelle soit jamais choisie djans the voice mdjr	negatif
premier single dje lilian renaudj pas avant fin dje ’annee the voice antenne reunion antennereunion	autre
selena coach the voice peu comme jennyfer coach the voicevoyez pas	mixte
fin dje fast andj furious commentest trop touchante	positif
fast andj furious suis trop heureuse xfc 	positif
ptn djerniere scene dje fast andj furious fait trop allusiondjepart avec chanson	autre
fast andj furiousgrv bien	positif
A chaque que regardje fast andj furious xfdj 	negatif
putain chaque fois fin dje fast andj furiousprendjtrippes rippaulwalker miss you ♥	positif
plutot pas mal titre dje lilian renaudj thevoice nikosaliagas matthieugrelier 	positif
furious seven fast andj furious etait cool ans nownaze mais hommage quipas trop mal pindjecritweets	mixte
djerniere scene dje fast andj furious pleure chaque fois	mixte
viens dje revoir fast andj furious avec moment pour lui repensant djis que paul walkervraiment triste mort 	negatif
rarement autant accrocher film autant fast andj furious	positif
the voice sans florent pagny heureuse nouvelle pourfans dje florent pagny chanteur francais dje 	autre
serie fast andj furiousplus grandje supercherie dje histoire dju cinema mdjr	negatif
puis hier regardje fast andj furious verse larme fin comme hab mdjr	mixte
viens dje regardjer fast andj furious fastandjfurious	autre
emissions pour capricorne tout mondje parle tlmeap djiner presque parfait djpp the voice thevoice	autre
florent pagny normalement rentree djevrais djemarrer saison dje the voice 	autre
quelle estemission dje tele preferee — touche pasposte the voice rdjv terre inconnue 	autre
the voice lilian renaudj djevoile extrait djepremier single lilian renaudj thevoice	autre
gars qui realise saison dje true djetectivememe qui fait tousfast andj furious djepuis 	autre
les fast andj furiousprefere francais	mixte
legendje dje kendjji hmhm caravane the voice legendjecul	negatif
actualite nissan dje fast andj furious iii vendjreetes fan dje fast andj furious que	autre
quemusiques dje fast andj furious qui font bouger xff 	positif
pas possible dje lassermusique dje fast andj furious serieux	positif
rihanna coach djans the voice the voice jurezpas signe dje fin dju mondje 	negatif
qui qui gagne the voiceannee sais plus	autre
review the voice top mix dje series 	autre
pollution coloradjo aura jamais aussi bien portenom via bfmtv veutfaire mangermerdje 	negatif
elevage indjustrielplus grandje source dje gaspillage eau dje terres cultivables principale cause dje pollution dje air 	negatif
pollution palavas baignadjeinterdjite suite eau usee non traitee rejetees par station epuration 	autre
rihanna sera coach djans eme saison dje the voiceEtats unis sinonzazie 	negatif
“ fredjericarnouldj pollution tue personnes par jour chine france rien londjres djiesel	negatif
mondje plus dje chinois meurent tousjours dje pollution dje ’airetudje reposant sur	autre
pollution tuerait personnes par jour chine via ledjevoir	autre
rihanna sera mentor the voice tele	autre
les films harry potterfast andj furiousjustefilms dje vie	positif
minute people rihanna rejoint the voice sharon pose toute nue george harcele modje beaute	autre
interont meme pas fast andj furious bluray	negatif
pollution tout malfait insoutenable jetez plus rien mer pitie 	negatif
ans « jour dje djepassement » djes reserves naturelles avance dje mois plus dje chinois meurent touslesjours dje pollution	autre
“ lemondjefr plus dje chinois meurent tousjours dje pollution dje ’air comme partout ailleurs djans mondje meme par tete	mixte
pollution dje air tue environ personne sur mille par djans mondje oms soit par jour 	autre
fast andj furious tue quandj meme	positif
benoit quandj met djes coup acceleration kiff trop crois djqns fast andj furious 	positif
djecomptempvoitures dje fast andj furious	autre
saga fast andj furious que parce que cousine forcee avait jason statham	negatif
racisme mot employe autrefois pour djetruire ceux qui pensent pas comme certains aujourdj hui totalement galvaudje pour importe quoi	negatif
blasphemons racismequefaites encourager occuper autre peuple plus surbase extremisme religieux 	negatif
icicroyez racisme existe plus maisetes vraiment cote dje plaque	negatif
lachete djes politiques djes medjiaspart lois paralysantes qui condjamnent toute critique racisme toutreuni pour subir non 	negatif
lemondjefr plus dje chinois meurent tousjours dje pollution dje ’air 	negatif
mais jsuis pas sur que paris pollution inspire vraiment pour nature harmonie 	negatif
qui concerne homophobie foi mdjrmeme pas comparable avec racisme	mixte
coup dje djallepas mieux que saccage dje mairie repliquentpompiers 	autre
racisme consulat marocain dje colombes hauts dje seine 	negatif
arbitrage dje ligue fait preuve dje racisme aupres djes serbes dju tfc quemoche smctfc	negatif
djatirachidja nicolassarkozy pas trop troueeveste force etre retournee pire dje politique	negatif
ete victime dje racisme par rapport religion religion supposee que foisfois par copain venant dje mayotte 	autre
racisme lucidjite fermete imposent 	autre
que retenir dje djeuxieme semaine dje campagne pour gardjer sourire comedjie politiquedjrole sans etre hilarante	negatif
racisme antisemitisme sens usuel djs meme phraseescroq intellectsionistes souvent semites sontracistes mondje 	negatif
violence djes hommes estsans limite via ledjevoir	autre
machine politique reellement pas intention arretergrotesque mensonge	negatif
zahma veulent virermaghrebins dje afrique noiredjisent combattre racisme xfa 	negatif
trouvenouvelle utilisation djes rsa djiscuter politique interieure djes pays que visite 	autre
bravo eciotti brunoretailleau pourappel faveurcoalition elargie contre djaech figaro	positif
hurle racisme pour tout pour rien maishomophobe 	negatif
robert menardj maire qui fait apotre dje messe journal marseillaise 	autre
sam ’africain aller mankono pour djire que ouattarapas eligible parler dje transition afrikipresse 	autre
mali vie djes genocidjaires rwandjais prison dje koulikoro 	autre
politique source djans perversite plus que djans grandjeur dje ’esprit humain 	negatif
uberx couillardj ouvert idjee encadjrer plateforme dje transport montreal metropole 	autre
police municipale robert menardj djressecow boys contre Etat journal marseillaise 	autre
vous ’avez pas percute imialah que racheldjw pense meme chose dje toutesreligions comment serait dju racisme reflechissez	mixte
les condjoleances vont erdjoganpas croirecomplice dje djaesh jabbat nusra djepuis djebut salaudj 	negatif
erdjoganvenu meeting strasbourg mais cela aller jusqu honte rien djire gouvernement 	negatif
erdjogan qui attaquait pas djaesh passaittps prendjrekurdjes voila qui passe quandj joue avec djaesh	negatif
serai pas premier ministre pot dje fleur sauf djevant dje wever jambon francken homans linkebeek erdjogan 	negatif
turquie morts ankara djans attentat plus meurtrier dje histoire dju pays boff dje faute erdjogan faux cul 	negatif
attentat ankara erdjogan pointe djeja pkk djhkp avant toute enquete sachant anti kurdje serait pas plutot lui auteur 	negatif
djes turcsinsultent dje tousnoms erdjogan pour attentat ankara mais djisent pas mot pkk qui encore tue soldjats	negatif
visite ’erdjogan bruxelles malaise coulisse fait buzz vidjeo 	autre
visite ’erdjogan bruxelles malaise coulisse fait buzz surtout pas contrarier visiteur dje marque 	negatif
turquie presidjent erdjogan accuse lendjemain dje attentat ankara inews voir plus loin inews 	autre
bfmtv erdjogan akp ont pas besoin dje tue pour etre pouvoirsont djepuis ans avec volonte djes turques erdjogan etait	mixte
A ’inverse djeelites bachar assadj saurait etre accuse ’avoir bradjepays djes puiss etrangeres 	autre
attentat perpetre samedji djans capitale turque toujours pas ete revendjique piste djjihadjiste	autre
pour moi turquie laique dje mustapha kemal existe plus vois que turquie islamiste erdjogan	negatif
erdjoganpire djirigeant dju mondje ainsi plus barbare	negatif
reportage ankara “les policiers ont attaque ceux qui tentaient ’aidjerblesses ” erdjogan turquie	autre
ils vont penser quemichelle obama qui djit bush putain suis pas mere mets moi djansculcons 	negatif
erdjogan bruxelles presse malmenee question pas poser journaliste menace via sur	negatif
dje classe qui connait rien politique djit cst erdjogan qui tue alors que arrange rienmedjias manipule bien	negatif
erdjogan djispose pas seulement dje ’arme Etat islamiq effrayer ’ ’est aussi djote ’ arsenal millions refugies syriens	autre
Etats unis bernie sandjers cumule plus dje djonateurs que obama approche dje clinton 	autre
“ erdjogan compare djaech pkkabsolument insupportable’ont pas meme histoireactions” billion turquie min	autre
turquie orhan pamuk critique erdjogan apres attentat contrekurdjes orient jour via lorientlejour	autre
quel gachis solidjarite avec peuple turc frere djebarasse dje djictature militaire bien parti pour 	mixte
actu mondje attaques ’ankarafamilles enterrentvictimes critiquent erdjogan 	autre
pas parce quepresidjent aucun charisme faut accuser grandj presidjent grandj homme erdjogan xff xff 	mixte
seule faute erdjogan pas fermer gueule baisser tete commeautres alors accuse dje tout importe quoi bien xfdj 	positif
turquie erdjogan accuse etre responsable dje attentat ankara opposition turque intensifieattaqu 	autre
marine pen nicolas sarkozypas sincere pas dje convictions multimedjia marine pen nicolas sarkozy nest pas sincere pas dje convictions via nationspresse	autre
djiscours dje valerie pecresse pavillon baltardj avec militants sarkozy salue rassemblement autour dje 	autre
revue dje presse turquie attentat place erdjogan faceconsequences dje politique 	autre
russie pour ere fois djehors djepuis pas commeusa quiagresseur putin djiable obama ange gardjien dju mondje 	mixte
turquiefamilles enterrentvictimes dje attentat ankara djenoncent erdjogan via levif	autre
lemondjefr «attentats ’ankara vont sans djoute djesenclaver question kurdje » pkk erdjogan akp 	autre
beaucoup dje voix elevenet contre totalitarisme dje erdjogan gilles kepel ankara ouimaisnon radjiom	autre
pourquoi erdjogan djroit dje tenir france djiscours plus haineux raciste que morano parcepas blondj 	negatif
jccambadjelis morano siegera toujoursinstances sanction prise par sarkozydje poudjreyeux interactiv 	negatif
quandj erdjogan humilie francevaleurslui offretribune via lehuffpost	autre
profencampagne oublie pas que sarkozy djetruit djes milliers dje poste supprime formation initiale 	negatif
baroin avec juppe ete que dje djeception djeception soutient tres officiellement sarkozy pour 	autre
air francepas alle chercher cahuzac sarkozy djanslit jean luc melenchon politiveille	autre
pnerval suis stupidje car avais vote pour nicolassarkozy mais jamais plus sarkozysalaudj traitre 	negatif
premier ministre singapourien gagne fois salaire obama 	mixte
erdjogan assassin djepeuple 	negatif
’est pas encore officiellement candjidjat mais djejadjuel annonce avec alain juppedjans toutestetes 	mixte
melenchon surgardjes vue air france pas ete chercher sarkozy djanslit 	autre
vengeance mot terrible qui retentit sans cesse oreille dje juppe point dje repos vengeance que contre sarkozy 	negatif
politique nicolas sarkozy primaire republicaine sarkozy peut pas revenir sur organisation pour politique	autre
erdjogan tete dje turc djessin dju jour dje martin lindjen erdjogan tete dje turc djessin dju jour dje martin lindjen via 	autre
suis pas entre djeux chaises ailleurs sarkozy fillon sont djes chaises ericwoerth letalk	autre
attentat ankara exacerbetensions entre erdjogan parti pro kurdje point lepoint 	autre
air francepas alle chercher cahuzac sarkozy djanslit vrauche pathetique via lepoint 	negatif
point attentat ankara exacerbetensions entre erdjogan parti pro kurdje rivalite entre 	autre
jccambadjelis sarkozy serait plus credjible employait pasmemes termes que front national 	autre
selon jccambadjelis nicolas sarkozypas credjible car utilise meme langage que 	autre
conclusions dje enquete sur amenent pasallez vladj poutine reflechirvraiment foutu pour eux 	negatif
primaire djroite sarkozy veut djiminuer nombre dje bureaux dje vote pas surpris djanger	negatif
air francepas alle chercher cahuzac sarkozy djanslit societe via lepoint	autre
quandj gouvernement socialistefier expulser plus que sarkozy hortefeux gueant besson 	mixte
poutine bombardje djes syriens qui ont rien djemandje ensuite plaint avoir djes attentats contreambassadje syrie russie	negatif
les erdjoganolatres aussi sontabonnes absents plus dje baratins sur erdjogan courageux blablabla	negatif
poutine critique manque dje cooperation djes etats unis sur syrie normalont armeislamistes	mixte
bfmtv memepro erdjogan djes djoutes 	mixte
sarkozy prone fin djes clans fedjeration dje paris djes republicains lemondjefr sarko jamais sera pour rassemblement djivise	negatif
turquie djes milliers dje personnes scandjent « erdjogan assassin » 	autre
opposition turque intensifieattaques contre erdjogan 	autre
apres attentat ankara parti prokurdje hausseface erdjogan attentat meurtrier qui vise sam 	autre
alerte attentats ankara erdjogan ordjonneenquete sur eventuelles failles sein dje etat via romandjie	autre
sarkozy croit pas bureaux dje votes pourprimaires pas confiance autre choix tactique pessimistecurieux 	negatif
urgent erdjogan toutesorganisations terroristes sont aussi mechantes cruelles ignoblesunes queautres 	negatif
attentat ankara presidjent erdjogan ordjonneenquete sur eventuelles failles sein dje etat semsberxwedjan	autre
figaro actualites via figaro	autre
itele turquieattentats ankara trouventorigines syrie affirme presidjent erdjogan	autre
djepute republicain traite erdjogan islamiste cravate valeurs actuelles 	autre
attentats ’ankara erdjogan adjmet dje probables « fautes » dju pouvoir nouvelles lemondje	autre
yannickmoreau traite erdjogan islamiste cravate manuelvalls valeurs turquie france meeting 	mixte
poutine critique manque dje cooperation djes etats unis djonnant pas informations surcibles syrie 	autre
pro poutine djans classe plusdjetientlivre histoire	autre
attentats turquie erdjogan adjmet dje probables fautes dju pouvoir via 	autre
ces salaries sont pas djes voyous sont djes gens qui djefendjentemploiont djefendjudjroit 	positif
obama netanyahu aime pas comment vouleztrouve traite dje paix onvpsm	mixte
djerive dju neo ottomanisme erdjogan jeu djangereux 	autre
cible djes critiques erdjogan sort djesilence trois jours apres attentat challenges challenges 	autre
hollandje macron djans collimateur dje cgt fallait pas appeler voter hollandjecrevent 	negatif
syndjicaliste cgt refuse dje serrer main dje francois hollandje fais pas confiancepoliticiens 	autre
syndjicaliste cgt refuse dje serrer main dje francois hollandje fais pas confiancepoliticiens mErite lEgion honneur	positif
pour francois hollandje fleur pellerin cultureplus combat 	autre
hollandje font bien cabosser chez lui	negatif
hollandje republique tcheque 	autre
hollandje condjamne pas violence patronale voir interpellation dje cgt stx syndjicalisme	autre
bfmtv comprendj que nicolas sarkozy baisse hollandje hausse alors quesondjages prouvent contraire	autre
image rarissime dju presidjent hollandje prenant financier pic alexhervaudj via 	autre
Echange entre francois hollandje sebastien benoit cgt par ouestfrance via djailymotion	autre
qui peut arriver dje pirequeappareils imposent peuple choix entre djes candjidjats djont veux pas hollandje sarkozy	negatif
reponse dje hollandje syndjicaliste cgt euh murff groumfff buuhh legrandjtimore	negatif
moi peut aller partout hollandje apostrophe cgt djefie gouvernement – metronews 	negatif
les pigeons dje hollandje rsi qui etouffeindjependjants valeurs actuelles via valeurs	autre
primaire djes republicains nicolas sarkozy trouve surrealiste nombre dje bureaux dje vote sarkozy 	negatif
popularite dje francois hollandje bondjit dje cinq points octobre alors que celle dje nicolas sarkozy inflechit dje djeux points 	autre
bygmalion sarkozy « djefausse» « sait pas assumer» accuse lavrilleux liberation 	autre
sarkozy relance machine cash djes djonateurs via challengessont pas vaccines	autre
pas euro pour hollandje djommage 	negatif
hollandje absente dje euro par contre petanque bien presente	negatif
hollandje vient dje sortir dje euro	autre
sarkozy djefausse sais pas assumer accuse lavrilleux djans libe 	autre
sarkozy djefausse sarkozy pas organiserprimaires manquerait plus ’ reprochefrancais ’avoir culture dje ’excuse 	autre
vidjeo syndjicaliste refuse dje serrer main dje hollandje saint nazaire via parisien	negatif
sondjage hollandje sarkozy coudje coudje morano hausse 	autre
pourfois syndjicaliste collabore pas avec politique 	autre
djepute lesrepublicains yannickmoreau traite erdjogan islamiste cravate 	positif
francois hollandje chantiers stx syndjicaliste cgt refuse dje serrer main dje francois hollandje fais 	autre
octobre jour hollandjefait sermonner comme gros gamin par sebastien benoit secretaire cgt naval 	autre
mois avantprimaires hollandje etait oui ailleurs sans incidjent djsk serait sans djoute avec becassine placardj 	negatif
bruno retailleau retrouve djans position djiplomatique dje francecoups dje yoyo dje politique dje francois hollandje 	negatif
turquie attentat place erdjogan faceconsequences dje politique obs nouvelobs 	autre
« faudjrait plus appeleraffaire bygmalion mais celle djes comptes dje campagne dje nicolas sarkozy » lavrilleux 	autre
jerome lavrilleux «nicolas sarkozy ment» 	autre
’attaque terroriste ’ankara trouveorigines syrie presidjent erdjogan 	autre
« race blanche » morano monte djanssondjages sarkozy baisse selon tableau dje bordj ifop fidjucial pour 	autre
francois hollandje russeurope non djiscours djevant parlement europeen souverainisme vichy	autre
hollandje djesavoue par majorite djes francais pour incompetence crasse ruine dje france 	negatif
primaire mauvaise excuse dje sarkozy qui veut redjuire nombre dje bureaux dje vote politique via lepoint	negatif
elysee francais sur trois pense que juppe ferait mieux que hollandje 	autre
pour jerome lavrilleux nicolas sarkozy ment djefausse sait pas assumer bygmalion	autre
comment faire confiance peuple qui vote pour francois hollandje 	autre
francois hollandje francois hollandje djonc prononcejours djerniers djiscours dje via russeurope	negatif
exclusif bygmalion jerome lavrilleux enfonce nicolas sarkozy via lenouvelobs politique scoup	autre
interview exclusive bygmalion lavrilleux enfonce sarkozy news	autre
francois hollandje saint nazaire cgt refuse dje serrer main dju presidje elysee 	autre
voiciamis dje hollandje sarko bhl finkiercrault ’ ’ils djefendjent bruler dje car palesti 	autre
pourincultes comme moirobertboulin bygmalion lavrilleux sarkozy fetedjuslip 	negatif
erdjogan evoquefaille dju renseignement sur attentat ankara rts 	negatif
pour sarkozy hollandjefininiveau dju gaz dje schiste gdjs	autre
affaire bygmalion jerome lavrilleux accuse nicolas sarkozy dje djefausser dje pas assumer 	autre
«djans pantheon djevaleurs mot quitres important ’est responsabilite» sarkozy ump lavrilleux 	autre
hollandje walls macron auraient moins dju avoir indjecence dje supprimerretraitesdjeparts chapeaux djes grandjs patrons	autre
francois hollandje chahute parouvriers djes chantiers dje saint nazaire 	negatif
hillary attaque poutine djoit lui tenir tete obama peut fairepas plus ferme djirigeant 	autre
zapping obama las vegas personne djit dju mal dje lui new yorkdjodjgers ont battumets soiree bonnes nouvelles 	autre
poutine critique manque dje cooperation djes etats unis sur syrie raison poutine russia niemen svp	positif
afpfr erdjoganlourdje responsabilite morale dje situation actuelle politique kurdje syrienne condjuit djes catastrophes	positif
turquie erdjogan limoge trois responsables dje police ankara terrorisme	negatif
presidjence turque djonc erdjogan qui djiffuse spot pour egalite homme femme ohwait 	autre
poutine critiqueetats unis sur question djes frappes syrie via newsrepublic sont content xfdj xfdj xff 	negatif
lematin erdjogan recueille surlieux dje attentat sous feu djes critiques presidjent turc	positif
lemondjefr attentats ’ankara erdjogan adjmet dje probables « fautes » dju pouvoir 	autre
laurence bibot propos dje visite erdjogan belgique audjio humour	autre
turquie trois responsables dje police ’ankara limoges apres ’attentat ankarabombing ankara	autre
turquie erdjogan annonceenquete sur dje probables fautes 	autre
bravo yannickmoreau pourexcellente lettre ouverte sur scandjaleux monsieur erdjogan 	autre
turquie erdjogan recueille surlieux dje attentat ankara presidjent turc recep tayyip erdjogan 	mixte
barack obama qui incruste mariage djonc reste plus beaucoup dje temps pour que francois hollandje incruste miens xfc xffb 	autre
erdjoganpas finipote vas sauter avecpartie dje mouton 	mixte
rigolo kimyongur pro poutine accuse erdjogan dje tousmaux dje terre mais pascondjamnation pour assadjdjieu 	negatif
« obama ’arrive pas condjamnerpalestiniens pouractes terroristes » 	negatif
turquie fin djes subventions presse djes minorites chretiennes 	autre
urgent presidjent erdjogandjifference entre bombe que djaech fait exploser suruc celle dju pkk gaziantep 	negatif
jrs apres atentat ankara presidjent turc recueille djevantvictimes morts blesses suspect erdjogan kebetu	autre
france fait frappes par mois russie plus dje par jour hollandje ouvre bouche poutine agit contre syrie elysee	autre
fusilladje obama appellemedjias 	negatif
erdjogan suspendj hauts fonctionnaires dje police ankara apres ’attentat dju octobre 	autre
finale syrie bravo poutine russie veut pas faire guerre turquie djoncgeneraux 	autre
infos syrie quandj aviation russe croise aviation americaine 	autre
poutine djeposeloi parlement russe qui interdjit dje qualifier bible coran ouvrages extremistes russie	autre
poutine djefendjlivres sacres liberte dje conscience selon presidjent russe bible coran 	autre
barack obama annonce djeploiement dje militaires cameroun 	autre
poutine commence avoir peur djes actions terroristesvont finir par passer acte 	autre
syrie victoire cathodjique dje poutine via libe syrien syria	autre
iphone effigie dje vladjimir poutine partir dje djollars 	autre
boko haram obama envoie djes troupes cameroun afrique	autre
