juste voix envie vielle 	mixte
alors monsieur pont soutenez toujours 	mixte
pen pour carte blanche pas sujet jamais veut	negatif
souhaite instaurer proportionnelle —	autre
elle sent trop lui calmant	positif
fait surtout que grave avis objectif 	mixte
faut lui merci maintenant casse toi 	positif
homme juste rigoureux	mixte
arrogance creux parcourus permanence voient clair	positif
bon folle alors officiel	autre
ensemble votez plus	mixte
vois tout pauvres gens sucer auraient mieux fais pas voir avant	negatif
elle fesses par veux score	positif
bon coup peut avoir pour avoir suivi jusqu fin	negatif
bah par rapport qui lui parle minime 	mixte
lui carte blanche parle pour ces	negatif
merci reste avoir mis exergue tous 	positif
sang soir stature chef jamais rien sur	positif
ricaner ainsi impression lui manquait balai 	autre
parle encore sauveur genre superman bon passez autre chose insoumis	mixte
les savaient pas que impossible telle alors ont fait	negatif
tenu imposture intellectuelle politique important parvenir	positif
vrai vis projets surtout absence projet 	autre
moi provoque profs	mixte
marine pen juste convaincre stature	autre
faite avec sais toi partira retraite 	autre
« pen utilise conclusion pour mentir sur projet sans exposer sien » conclusion 	negatif
paroles paroles paroles moi compris 	autre
comment cracher figure bravo changez rien 	positif
est pas moi qui toi qui est	negatif
elle gouvernance juste pour faire blagues 	negatif
naufrage officiel soir lui apprit 	positif
les surpris par comportement pen soir avaient point oublie est	positif
coup sauver pas inverse 	negatif
rien sur environnement 😡	mixte
arroseur arrose voulait que qui	mixte
aurait minimum soir repassera expliquer programme encore trop	positif
sort bien bonne bon clair bien argumente	autre
occupe toi toi	autre
elle parle comme envie lui arracher par une	positif
mais encore gens qui veulent voter 	autre
neuf mois campagne pour aboutir sur spectacle affligeant mine par une	negatif
elle vraiment avocate fille borgne conclusion encore pour eux	negatif
aura montrer vrai visage absence projet pour peuple	negatif
silence bien preuve que pen couverte	autre
ans encore tour que quinquennat aura absolument	mixte
vers mais pas chantant	negatif
plus que marche 	mixte
maintenant que commence vraiment sur	mixte
pour que emporte attirer semble 	negatif
elle picole avant	positif
officiel ironie alors sait partie arguments tiennent sur 	mixte
elle vraiment pas niveau permis compte supercherie total 	negatif
pas choisi philosophie marine pen	negatif
plat ventre permanence les	positif
suis lui toutes personnes qui portent valeurs ensemble 😘 	autre
toute qui courage affronter cela sans calme sans 	positif
critiquer publiquement sortir vais aller boire coupe champagne	mixte
encore fois critique tout sans aucune mesure solution aberrant	autre
comment femme arriver ici seule question soir	positif
marine pen classe avec gravite fonction	autre
toi gros comme maison avec grosses bottes 	negatif
pen choisir rance 😀 	mixte
bon face pen pitoyable soir fait est	positif
serait mieux tout programme que 	autre
officiel sont toutes organisations associations mais focalise sur musulmans 	mixte
appris quelques choses soir parce que pour moi aucun avait posture	negatif
aura moins montrer point officiel est	mixte
par soumission saurons souvenir aux	autre
amis vous mis sales 	autre
elle vraiment lamentable	positif
juge plus convaincant premier 	autre
veux pas que tombe mains votes 	negatif
elle bourre marine	positif
que terroristes veulent mec petit morceau surtout instant 	autre
journaliste qui tasse	mixte
notre belle bien pour cela voterai avec enthousiasme pour 	negatif
marine pen combat couleur mais incapable	autre
veux plus parler mec merci bonne 	positif
fallait oser mythomane 	autre
confirme pen pas trouve autres mots 	negatif
comment fait pour calme 	negatif
bravo suis fier vote 	positif
juges politises qui ouvriront pas sur 	negatif
pen porte sur visage sait rate agression	autre
conclusion insultes sur afflige parasite franchement	mixte
officiel suis clairement port voile	negatif
sont compte bon comment toute seule public seule comme officiel	mixte
bon moins saura que vont nous	mixte
nous savons est	autre
politique plus triste tous temps pense aucune hauteur vue aucun projet	positif
elle tue marine pen veux que soit avec sera votez marine	positif
pris fesses pas niveau trouvez autre 	negatif
franchement que propose bien qui votent	autre
mais fou manque respect officiel pauvre femme aucune proposition folle bravo	positif
appel pour futur poste vas toi	negatif
marine pen vraie	autre
soir marine pen venir serein pas sortir fil rouge pas photo	negatif
pourquoi que votez blanc avantagerais plus que connerie que 	mixte
mais qui toujours gratter petite place 	mixte
gamin immature qui promet face internationaux aller pleurer chez maman	autre
tour pour moi ceux qui vote blanc soutiennent sont pas gens bien	negatif
lui moments regrette pauvre	mixte
reformes pour contre islam 	negatif
non mais engage 	mixte
pause jour ouest 	mixte
merci pour rester jusqu bout crois pas	negatif
aucun programme fait attaquer lui parle vision	positif
officiel A avoir solutions art 	autre
toi avec qui jean marie	mixte
sinon battent exactement comme coqs	autre
voici future image 😂 	positif
accepte vraiment tombe bas	mixte
hui plaint quinquennat avec 	positif
marche pour cohabitation juin tout pour 	negatif
une chose sure triste voir que personnes sont trucs pauvre 	autre
attention apprentissage pas solution mais solution 	negatif
mec qui accuse officiel salir avoir menteuse	negatif
elle fait vraiment peur commence sourire	negatif
imperturbable oui futur 	mixte
suis fier soutenir montre pays transformer	negatif
que ont veut avez force courage absolument remarquable 	positif
que chambre qui trouve convaincante roi pleine action	autre
jamais aussi pauvre officiel qui peuple	autre
ses menaces fausses insinuations sont vomir sortis pour arriver sur attaque	negatif
reste face violence par mais conforte par ’ calme olympien	mixte
officiel vous avez envahi pollue qui chaleureuse 	mixte
fou avec fiches sais pas comment avoir avocat	negatif
notre plan marche 	autre
pire histoire importe autre face aurait plus 	autre
esprit bien chez sortir sur poissons 	autre
arrogance technocratique officiel ans fausse politique	positif
clair que incarner soumise pen 😂 	positif
fait officiel parle marquant 	mixte
palme hors sujets brillamment par	mixte
carte blanche salissez — jeunes avec 	mixte
pour plus enfants chinois non merci	negatif
compter nombre pen tel qui arrogamment son	positif
croyez que avez invente eau autres termes 😩	positif
officiel pas besoin serrer main puisque rue que violence 	negatif
faut retenir pen 	autre
man officiel non mais rigolez hypocrisie total 	negatif
bon courage pareil bravo	positif
aime celle qui chance celle qui permet libres	positif
avais jamais aspect mais que retiens surtout gaminerie vrai gamine qui sait que attaquer	negatif
pauvre tristesse voir cela 	mixte
bravo agression permanente officiel vous montre 	positif
joue place pas salle 	negatif
merci pense que ceux qui voulaient abstenir voter blanc sont maintenant convaincu voter	positif
faire avait pas carte blanche encore moins projet	negatif
est joueur qui plus passes soir 🎯 	positif
aussi formation jeunes 	autre
que truite vois que veux 	mixte
est toujours aussi nulle avaient mis animation aurait passe bon moment	negatif
soir avons nuits longs couteaux	positif
elle conclue parle lui non 😭 force	negatif
peut nouvelle campagne par	mixte
bravo monsieur battre contre poissons avez 	positif
pen mieux que oui vrai	autre
officiel contre clique sur lien imagine 	mixte
les mots aura retenu soir sont « faux » allez bisous	positif
aime veux pas voir par amateurisme connerie	negatif
montre vrai niveau populiste sans programme 	mixte
oui propos nourrissent haine totalement irresponsable 	negatif
met aussi bien verrons mai	mixte
fatigue aucun argument naufrage papy baver	mixte
plus important noter absence soutien sur	mixte
quel courage part faire avec aussi sans projet pour	negatif
oui envahisseurs ennemis 	autre
officiel jamais change encore vrai visage parti 	positif
ont juge plus convainquant lors marine pen	mixte
conclusion importe quoi fin 	negatif
officiel officiel vite bavoir petit 	mixte
bien passage sur bien que 	autre
pourquoi marine pen imite petites blagues gloussements	autre
oui officiel mais aussi aigrie rance 	autre
approche caniveau honte pour 	negatif
officiel pour clowns	negatif
elle continue mentir joue victime	positif
bravo fait manipuler comme par presse tous 	positif
fermer chez restes tournes alors non 	autre
myrtille mais absolument suffit vient solution plus flatteuse	autre
carte blanche marine pen hauteur prestation soir ras	positif
pas gagner prochain mais juin autre histoire cohabitation	negatif
moi fait tout 	autre
affreusement soir possible pour plus ans	negatif
temps rien apporte est	autre
moi surprise intelligent mais assez cause finance tabou argent	autre
mais peut fermer trois	autre
reste comme pour moi car avec 	negatif
comment fait pour rester calme envie lui crever yeux avec 😡	negatif
vous parasite victoire par merci bonne nuit	positif
parle bien par 	mixte
elle sent elle rate conclusion plus	positif
marine pen trop force sur 	positif
mais avec attaques	positif
face esprit pen porte esprit 	mixte
mais claques cette	autre
aime telle marine alors moi pourquoi veut changer 	positif
pen agresse juges professeurs pas pays seul vote	negatif
officiel pouvez parler programme lieu insulter merci	positif
veux voir officiel grincer les	mixte
que joue facile barrage finalement pen qui joue barrage 	autre
chaotique marine pen qui propres sarcasmes agace vive 	autre
alors toujours fier avoir officiel	autre
ceux qui ont voter premier tour pour contre terrorisme	negatif
est comique pote	mixte
officiel qui est que compte manipulation avant	autre
officiel avant que laquelle auriez pas avis passera 	negatif
pas possible sortir pareils voter tout ans	negatif
moi pense que aurais table vive vive vive	mixte
sur continue vraiment craque 	autre
classe chez primaire 	mixte
officiel reste place pas besoin pour 	negatif
officiel comme officiel vient sauter piscine 	autre
elle enfonce plus plus	positif
mieux que aussi mieux que elle	positif
vote marine acceptes alors musulman vaut 	autre
tant que femme honte comme soit niveau	negatif
soir vrai programme non finance celui 	positif
plat ventre 😂 😂 tue femme 😂 😂	positif
pourquoi pas aucun programme tout 	negatif
sinon pas enjeu venir pas mot sur	negatif
pas sur car est	negatif
bravo qui calme face harpie qui propose rien	positif
veux vraiment transformer	mixte
professeur magistral face une affligeante 👌	autre
parle pas avec qui torture martyr oeil laisse bas	negatif
non constatent que officiel nulle bout bout fait que meilleur point 	negatif
📌 faites comme officiel sur mai 🎙 	autre
journalistes qui ont qui sur leur	mixte
ans spectacle lamentable avec 	autre
bon fournis pelle	positif
vaut mieux marine pen alors 	autre
soir contre premier classe	positif
serons avec marine patriotes toujours juifs	mixte
parisien qui spectacle mieux	autre
pas foutre mot que raconte mais absolument pas seul putain mot putain faux projet 	negatif
cher avez soir avez fier 	positif
faut faire battre peuvent pas porter 	negatif
les par gauche qui brisent vitrines restent impunis 	autre
aurait pas pen 😀	negatif
crois que nation avec culture euh bouillabaisse anges 	autre
mais grosse vache grain vraiment fumer joint avant quoi	negatif
officiel sont pauvres gens paumes ont marre 	autre
une cargo – ouest 	autre
mais quoi programme	mixte
avait tout tout gagner tout sur plateau insolence	mixte
voile mais aussi entreprises pas comme vous	negatif
question soir pari pour caser thrombose perlimpinpin 😂	negatif
ils ont voulu monsieur propre cinq ans aussi	mixte
fait part moitie pense que avez compris 	mixte
brave gens peuple insoumis 😏 	positif
moment marine pen croiser miroir	mixte
charivari manque hauteur lors pauvre pauvres 	positif
pen roue libre meilleure meeting sans confrontation face	mixte
officiel troll belle conclusion marine veut pas gouverner rester opposition seul pouvoir 	negatif
victoire plate couture rassembleur face pen 	positif
marine cru soir toujours meeting train exhorter supporters	positif
bon contents avez	mixte
A amis abstentionnistes verrez allez vouloir voter contre officiel	autre
ont voterait alliance soir	positif
pen vrai pire que nulle 	negatif
elle fume quoi marine 	positif
toi bave trop parle	positif
pauvre errance rance pugilat autorise penser abstention millions 	mixte
elle croire sur marche moins pourrez partir vacances 	positif
vivement que officiel	autre
quelle bien image	mixte
avez traite habitants pas calais alcooliques les	negatif
vos banquier voulez eau ministre	positif
bien avez tenu cap marche 	autre
objectivement bluffe sceptique mais haute programme bravo	positif
revoir journaliste placer mot	negatif
sociaux peux plus politiques vive vive faites amour fermer bonne nuit	positif
jamais mis peau ’ qui 	autre
peuvent exemple mutuellement	mixte
bravo marine tous soir sera bien prochain	positif
cela conforte irai	mixte
qui parle croit	autre
officiel personnes sont peut inconscientes	autre
enfin belle conclusion ´ projet salissez meilleur rempart meilleure arrive	positif
niveau suis train 😂	positif
soumission plat ventre 	positif
une affaire politique 	autre
bon vont allez terminer	autre
marine seul argument finance nulle jouer	negatif
bonne nuit tous sauf ceux qui vont voter pen	mixte
mieux que mieux que certain	autre
les entre marine — via 	mixte
avez pas bon avez pas convaincu pas mais belle potiche 	negatif
parle part avec mais 	mixte
suis favorable baisse nombre parlementaires ’ tiers chambres –	mixte
cerveau enfant bonne primaire meilleur pour langue	negatif
finalement moment clairvoyance lisse place ministre	mixte
honte pour honte image que bassesse non pas	negatif
pour sang face sourire que porte 	negatif
pour semble peu trop long gros craquage	negatif
parlais terroristes religions couleurs terroristes 	mixte
mal nommer choses ajouter malheurs camus	mixte
bravo qui clairement	positif
une heure parle que programme pas sien	negatif
respecte personne aucune envie repartir pour ans avec	negatif
voir arguments ceux qui votent	mixte
veux pays vision	negatif
vous imaginez femme comportement soir justement argument plus contre elle	positif
vous pouvez lever main pour parler	negatif
marine toujours rengaine 	mixte
pen tactique peut critiquer suis mais pas que convaincu	negatif
putain mais peuple vas vraiment lui A 	negatif
vivement boive ensemble bien marrer avec 😂	positif
inflation montre chose emploi juste argument	mixte
enfin parole lui parle citoyens rigolote	mixte
officiel avec calcul calcul change entre prenant 	positif
elle culotte fait crise	positif
traitement rien laisser passer 	mixte
saloperie heures bloque chiottes rate truc 	negatif
irrationnelle sinon pourri avoir	mixte
parti sur haine mensonge	negatif
choisir vivre ensemble avec 	negatif
comme pas propositions pen	negatif
illusion cote tout qui cherche consistance fiches bleue jaune rouge 	positif
officiel avec officiel comme jouer avec pigeon	autre
sauvera pas lieu temps argent salive brasser air	negatif
« agressif sans programme sur pas 🤔	negatif
oui jouissance envers avis	autre
est convainquant ouf sauvent	mixte
sur plus convaincant	mixte
plus menteur avec pour parti marche 	negatif
nous vrai programme non qui projet qui tien	mixte
officiel magistrats qui sont politises mais arrange car sont cote	mixte
live saint marine 	mixte
sera par femme marine pen 	mixte
officiel bien beau blabla mais qui garantit infection testiculaire 	positif
enfin qui parle bravo 	positif
projet pour voile	negatif
moins celui mettre jour absence programme 	mixte
elle hilarante plus	positif
embarrasse pour pays par merci avoir fait face cette	negatif
voila est venue opposante non future coup peu affligeant	negatif
campagne totalement folle qui sur atypique surtout rate cru restera annales 	autre
mai faites choix	mixte
crois bien que compris crasse soir recettes publicitaires baisse mai	positif
voyons monsieur racontez importe quoi invite lire programme 	autre
gagne nul pas faute bonne chose 	negatif
avantage avec que arrive convaincre sans sur plateau	autre
moi aussi choix par fait 	mixte
faire manifestation pour que 	negatif
pas marche rampons 	negatif
recommencez pas pauvre 	negatif
primaire base oui	autre
franchement non seulement rien mais plus rien A	autre
partie qui pas juge heures celle	negatif
pen sourire hypocrite pas argument part mentir fait pas chose groupie	negatif
soir selon pen 	positif
cherche niveau soir	positif
officiel totalement prise propre jeu limites	autre
faut vraiment revenir sur grammaire car comment parle officiel	autre
pense que marque beaucoup points soir marine	positif
plus haut point	mixte
soir sait qui sera futur ouf sauve 	positif
ouvrez yeux voyez violence que porte ouvrez yeux ouvrez yeux	autre
sur vais rire	mixte
merci imagine que ouais	positif
pen part attaquer fait quoi sur plateau fait	positif
elle tellement parler qui plus que que base	positif
officielle vernis craque montre que est	mixte
normal tous vous brosser sen 	autre
officiel officiel mais non beau nature 	positif
voter changera rien votre	autre
crois pas supprime mais pauvre 	negatif
finir par entier avec nuls craint 	negatif
sur sujet syrien veux que soit lutte contre terroriste qui 	mixte
ceux qui veulent abstenir voter blanc avez soir longue annonce pas mecs	negatif
elle crame carte blanche pour pas compris	negatif
plat ventre bien officiel	positif
soir part pen malheureusement encore que pas parti comme autres 	negatif
putain beau gosse	negatif
pas pour fait ans que fonctionne comme sont hui 	negatif
aurait plus empreint gravite qui fait preuve gravite hauteur pour	negatif
totale insolence soir personne sont pour 	negatif
peut expliquer fonction journalistes sur plateau mal aucune	positif
contre mais aurait jamais accepter 	mixte
les marine pen sont	autre
heure long alors ans 😥	autre
qui gagne soir 	positif
bravo comme argumentation connaissance prestance conviction soi	negatif
elle venue avec balai	positif
pays pays ouvert qui reformer pour avant tous 	negatif
heure choisir mai prochain change que vaut face 	positif
courage tenir fermement engagements refuse esprit haine qui anime	negatif
elle passe plus temps critiquer uns autres expliquer programme enfin peut appeler comme 	positif
carte blanche remettre couche sur cela confirme erreurs	autre
elle heure presse	positif
marine pen fermetures autre	mixte
clair net sur nuit 	mixte
parle coupe fatigue 	autre
elle fait rien programme sait faire attaquer personnellement nul nul	negatif
🔴 veux tout inverse que proposez 	mixte
une faisant victimes	autre
par contre hors sujet 	mixte
conclusion pen point part point sans fiches 	mixte
pitoyable face massacre	mixte
soir avez montre que partie pourra pas gouverner avait officiel	negatif
mauvais spectacle que mieux insulte encore peu plus soir	negatif
vois nombres qui mettent fait gens vont tous bouffe chez soir	positif
niveau mieux que 	mixte
que millions qui ont vote tour sont 	mixte
pourrait pire imagine arabe piquerait vrai 	autre
honte abstentionnistes peut laisser marine 	negatif
moment cru halluciner sur gestes bizarres officiel courage pour 	negatif
mensonge politiques qui ont ruine	negatif
serait minable mais telle 	positif
veut enrichir ans tout 	autre
vivement ait nouveau hauteur 	positif
chers voulez soit essayons nouveau parti nouveau socialiste	mixte
votez pas vraiment avec	negatif
comme tous sujets mais propose rien 🙄	autre
peux vraiment plus sourire	autre
houleux journalistes rejoignent rang abstentionnistes	autre
les mots environnement changement climatique nouvelles souffrance animale seront prononces soir	positif
crois que officiel peur pour intentionnellement son	negatif
officiel vient livrer express nouveau soir	negatif
fait allez marche 	autre
avec tous postes que occupe avec principal coupable 	autre
rire pen tout mal aise	autre
une chose clair veut avoir chance moins sont 	positif
mots qui vont bien ensemble 	autre
les journalistes souffle enfin	mixte
pour continuer pourvoir maintenant	negatif
mieux que cela merci 	positif
union peut que par seul merci vouloir 	positif
marine faites soir raconte beaucoup beaucoup conneries vote	positif
gamine jusqu bout vraiment nique toute seule	autre
bon soir pen sans programme cote plaque vote	positif
affaires qui accusent marine pen 	autre
crois moment entier rit quelle	autre
les marine pen sur sont avion	mixte
une peut calme bravo moi envie lui sauter gorge	positif
mais gagne entoure vraie baigne poubelle 	mixte
sur programmes permis nature humaine protagonistes	negatif
heures officiel veut savoir chose nom premier ministre 😂	positif
vous moins fois	autre
pratiques religion juive oui juive mais fils 	mixte
conclusion impression que plus politique que officiel	autre
franchement vois autre bien bas postures 	mixte
pen sont affrontes faut retenir muscle 	autre
place avocate bien justice	autre
elle sourit encore mais non	positif
pourrait mot sur sais pas mais urgence	negatif
officiel temps sur vous parlez autre choses programme	autre
elle termine exprimer jouant victimes manque confiance soi	positif
pourquoi parler alors que peu avoir tanks 	negatif
libre trolls sont 	mixte
appelez taxi est	autre
officiel incapable front plus que jamais	autre
aussi nulle avocate imagines vas tribunal pour insulte avec elle	negatif
mon mot fin pure gauloise couilles »	negatif
choisir entre peste	autre
mais pourquoi rentre jeu mesquines fou 	mixte
avait trop couleurs	positif
nombre mensonges marine pen emporte haut main avec sourire 	negatif
pen roue libre 😯	autre
« telle » vraiment conquise 	positif
officiel oui aussi mis sur notre	mixte
ceci sais que gagner banque que leur 	autre
parle mais parle programme avec claires	mixte
notre analyse soir seul sur plateau 	positif
contre argumentaire via 	autre
vote pour pays	negatif
abstentionnistes quoi maintenant 	mixte
partisans venez expliquer que pensez soir vitre avis	positif
clown envie voir bien sans moi jamais aura bulletin	negatif
non mais politiciens sont menteurs mais abuse 	autre
bravo pour sang envie baffer blanche	negatif
tirant qui traite tout officiel violent menteur	autre
creuse comme coquille part abyssal nulle	negatif
tellement calme relaxait voix	mixte
plus vois pen plus pense vraiment toute	autre
tout instructif sur avenir	mixte
professeurs retour coups sur les	autre
sera avec sur prochain morceau major	mixte
elle plomb non	positif
plus que hein borgne suis 	autre
faut juste retenir voter 	autre
avec journaliste inutile	mixte
ors arts moi qui 	autre
continuer combat pour convaincre 	negatif
rencontre militants pen pas loin havre pour paris verra ont pense	negatif
bonne analyse sur peut que voulu volontairement pour casser peu notamment	negatif
elle bien finale	positif
barbier moins vrai aurait lieu pauvre comment 	autre
marine fait aussi catastrophique que effets films action africains	mixte
qui plus convainquant soir	positif
journalistique auquel assiste soir milite pour 	negatif
beaucoup trop confusions panne 	positif
allez mais avez faiblesses 	autre
noir jour via	mixte
pen vivez parasite	autre
maman voter tellement que passe tour truque 	autre
nous allons image avec 👉 conseil 	mixte
que face pen hallucinante vote	autre
gros marine pas projet pour merci bonne nuit	negatif
veux plus personnes situation sans solution 	mixte
les militants trouvent meilleure que suis 	autre
pas points est juste incroyable 	negatif
ils sont sur 😂	positif
qui largement loin 	autre
officiel avons toujours pays ouvert 	negatif
quelle arrogance part	positif
toujours terre accueil restera encore nombreux fachos 😊	mixte
marche vers avec 	mixte
propose troc comme plus simple	mixte
tous complices crimes contre participation tous 	mixte
nul niveau maternelle marine grosse maintenant pas photo vote par	negatif
comment marine fait rabaisser par	mixte
tous journalistes cherchent synonymes polis connasse	negatif
vous pensez votez pour vote blanc 	negatif
les cultes alpes maritimes appellent voter via matin	mixte
oublie fermeture non boutons	autre
fort rester spectacle	autre
tout cas avec tous agressifs sur compris choix ambition	autre
jamais esquiver autant questions toujours pas expose programme sur institutions	negatif
soir montrer sous vrai jour aucun projet nourrit remettront pas bravo 	negatif
politique que critiquent projet vote	autre
incontestable vote blanc	mixte
punaise panama attaque	positif
imposer partout espace public contre voile les	negatif
avez culture recherche enferme avec 	mixte
vlan gueule aucune classe mais fille borgne porter nom	autre
elle compris out alors elle	positif
politiques amputes morale ont manque train pouvoir utile passes ont 	autre
hormis sortir expulse fiches sait rien projet pen	autre
arrogance vrai visage efforts mis mal 	positif
connais justice sais comment baiser	negatif
turc ainsi que moi souhaitons large victoire tour 	autre
mieux mais pourquoi moutons ont vote pour eux bien mignon 	negatif
une chaise table gagnerait face	mixte
pen accuser avoir pris lors tour	mixte
officiel montre convaincant	mixte
toi peut pas	negatif
entre moi que sous coup enfin merci	positif
veux par travail avec politique volontariste veux esprit 	mixte
comment fait pour obtenir plus voix que jean 	negatif
voisine qui plats turcs mais qui vote prochaine crache nourriture 😒	positif
qui mis juste fin annonce avec plan 	negatif
officiel beaucoup parlotte pour aucune solution	negatif
vocabulaire qui parlez pauvre ont fait toi 	mixte
plus convaincant pour 	negatif
bravo consacrer carte blanche lui raison bafouille	positif
officiel suis vraiment insoumis soutiens pas bat pour que 	negatif
immense avoir brillamment obscurantisme par raison espoir	positif
