rencontre avec saumure « connais pas mais aurais aime rencontrer »	autre
camionneurs craignentnouvelle mesure compliquetravail 	negatif
surprise russe met finmanœuvres	negatif
marche sur jamais pouravec politiquepatrons	positif
sais autant plus folle que avaishaine chose 	negatif
fait penser ravioli 	negatif
olivierhomme politique que aime plusmilitant	positif
loi qui plus pas programme 	autre
parleparle politique est	autre
vous avez nouvelles lois raison parcours politique construire pour couvrir par gouvernement	autre
remet bush place 	positif
rentrer pour guerre 	negatif
certains ont rage contre mais pas contre gouvernement pour trouver excusessont 	autre
queouvrier quipas professionnel politique	autre
nouveau traite possible fin pour presse 	autre
faut pas faire confiancequi vivent politique 	autre
pas image politique parle avec tripes lui avais que allait 	autre
pourfaut pas voter pour pro politique mais vaut mieux soi	autre
prochaine coupe estqui gagneavec nain oui argentine	autre
que pas professionnel politique	negatif
analyses fait pas rejeter bloc sans concession sur sujet 	autre
maispas fin parnationaux oui 	autre
chine tisse route soie 	autre
olivier train casser baraque politique sens	negatif
preuve que capitalisme importepolitique compristotalitaire etc	autre
rentrant sur savais pasfaisaient politique fossile non 	negatif
comme sontsur qui mont fait tourner vers pas qui fait 	autre
quechance pourpays que soit religion fait rire mois fascisme	positif
selon assez preuves pour justice 	mixte
surprise met finmanœuvres usa	negatif
obligersuivre cours politique via	negatif
suis officieusement vacance officiellementsujet qui vexe pas peu honte 	autre
matin ouverture bureaux vote pays verspolitique mois 	positif
pourfois invite politiquequestions pas cote plus tient propos	mixte
ils sont moins marrant quetrollsclique promoteurs	negatif
seul qui gagne quelque chose quinquennat 	mixte
serait avec islamique 	autre
selon assez preuves pour justice	negatif
bravo corrompu plus pouvoir via	negatif
maispas finjeunes ont vote contre pouravenir 	negatif
pas sur que soit capable planter but marque contrecamp ans euro	positif
qui sourit jamais reproche jamais sourire non mais	autre
ressemble plus plus barrecaricatures	mixte
bonne rien avoir avec avis politique sur 	autre
veille politique parcaste politique manque projet lieu	autre
suis surprise que estseul politique avoir juste sur	autre
est qui fait bouffe empoisonnement avec	positif
comment cimentier travaille avec islamique via	negatif
les articles sont lamentables qui manuel 	autre
parlons pas seulement hommesparlons hommes 	mixte
veulent nations maispen veulent nationalisme pire	negatif
bien compris proposant plus lutte contre immigration 	positif
contre attaque folie 	autre
pen sont utile avenir 	negatif
politique fait yeux certains militants 	negatif
inconscient face via	negatif
footballcruel maisjoueurs toujours 	negatif
sionisme sabotage via	negatif
veille bacmais songe engager politique	negatif
critique euro mais voit football joli buts	autre
agir ensemble contre	autre
appeler patriotes pas ose compatriotesrepu nationalistesmieux	negatif
football anglais fairefrais joueurs vont partir 	negatif
les chroniqueurs comprennent pas vision mais voient clairement message politique camping	autre
A moi japon chine alors	negatif
annonce officiellementsortir euro que payer	autre
assure ’ votera pour 	autre
football cas mois football	negatif
logique tout que football euro 	negatif
situation proposerais projet cinq points pour 	autre
opposition remet question maire 	autre
pas assez couilles pour faire guerre pas assez pour refaire terre	mixte
euro but suisse fait 	autre
politique placestricte reproche notammentusurpation pouvoir manque 	negatif
“victoire contre bah 	autre
projetbien ouvertpays via national	autre
vous pouvez tout quevoulez finaliste cotes sera pauvre niveau football	negatif
ouvre session forum saint via	negatif
aimezfaire jouer football sortir avecamis 	mixte
votre vision footballpoussejoueur mais fracasserrivalplus analyse mais passion	negatif
eurosont pas attaque 	negatif
croates font monter pression via	negatif
quoi sert politiques 	autre
footballpas crueljuste loi plus fort	autre
exprimons tousrefus voir emparer grignon 	autre
marre arguments contre front national 	mixte
euro fille lui vole fin match via	mixte
propos envie subventionner 	autre
tellement beauchantsentrailles tempseuro	mixte
que peuple britannique autres peuples auraientassis	autre
toutqui allaient rentrer cheznous avons fait euro 	autre
euro trois stars quarts sport	autre
gagner pascommefootball nousmatchs comme 	mixte
eurogallois sont bien amuses avecgosses sur pelouse parc via minutes	mixte
’ copulation consanguine future bien silence 	autre
eurogallois arrachent quart historique 	autre
moche mais passe foot euro	negatif
A rythme finale serapurge avec vainqueur injuste euro	negatif
fin match euro	mixte
pourquart finale euro	negatif
euro gallois marque pas 	autre
tableau phase euro qualification bout prolongation 	autre
vivement reprise voir vrai football euronul chier	autre
pas tout passe par euro	autre
suite semaine prochaine mais malheureusementchiffres sont toujours pas bons 	autre
est bon euro	autre
pour instant eurobuts moins matches plus que 	autre
euro cinq choses savoir sur 	negatif
euro suisse heures 	negatif
revers qui appelleremise cause selon presse 	autre
« ’ jamais honte mais ’ honte gouvernement »	autre
bravo pour partagersouffrances peuple massacrer sous silence complice 	autre
« interrogation pour toute estime 	autre
loi junglefilm plus politique moment 	mixte
les tribunaux via	autre
sur vas gagner euro 	mixte
euro sans convaincre rejoint quart 	negatif
incroyable politique qui nomme petit fonctionnaire belge pour	autre
quel pourri peut plus joienation sans ait critiques insultes limite racistes euro	autre
blanccontrat avec pourra 	autre
bref vert envers euro	autre
euro facefait peur mais rejointquarts 	autre
finale matchsplus pourris touttemps euro	negatif
pense que aurait laisser politique faire pour reste	autre
foot sensation savoure recrute par avant euro 	negatif
jour pute soumise vont pencher sur risque assisterguerre plus violente que	negatif
aux origines secte via jeune 	negatif
euro quarts contre 	autre
fait achats fantastiques vieux port plus 	autre
peut plusmensonges rattrapera 	autre
euro pays but images euro pays	positif
eurogallois battent rejoignentquarts finale 	autre
cet eurotellement pauvre terme jeu que seulement jeu hui sur matchs 	autre
aimes bien europourri	autre
cet euro estgrosse blague veut voir footballvrai	mixte
euro suis tellement navre que croate soit aux	negatif
jour match marque finambiances euro 	autre
virer fiasco ici quelques mois moins 	autre
prime signatures auto football	negatif
annonce officiellementsortir euro que payervia	negatif
euro pays qualifies pourquarts via 	autre
une sans filet euro	negatif
seloncorrompu trahi constitution 	negatif
football peut tellement injusteabuse 	autre
tristesse sommets football sommets ennui 	negatif
flash euro payspremiers qualifiesquarts finale 	negatif
heure changer peau euro	autre
avant coup envoi inspire euro apparemment 	autre
revue presse euro 	autre
bleu blanc rouge euro	autre
provoque politique financier via	negatif
une nette contrevia	autre
les compositions probables euro	autre
gagne face face poseeuro	autre
contente pour euro	negatif
pense gens quiallezfaire enculer tout heuest euro 	autre
cas fait pen veut organise sur euro quecontre seront plus	mixte
tentation inversion euro	negatif
vision finale euro	autre
impression euro sert plus faire percer sur autre chose euro	autre
comment politique arrive 	autre
« questionavant tout politique » 	autre
supporters euro venez soutenirpays gagnez prix fabuleux 	autre
veut carest finance actionnaires pas paix 	autre
trouver millions euros urgence 	autre
euro quarts bout 	negatif
euro pays quart finale victoire contre 	autre
tousbuts match euro juin 	autre
cette pourson coeur euro	autre
euro enterre sport	autre
raconte sans langue bois avec 	negatif
pen sur japonaise rien que pour vaut coup 	negatif
pays normal aie matchs euro	negatif
euro revivez qualification face — via 	autre
plus fort faut livrer paye toujours justecroates ont pas fait euro	mixte
politique familiale pleine crise via figaro	negatif
faire barrage pas que fontexperts qui faire 	autre
commencez parvoter tout quipourcitoyens stop lobbies	autre
ces types exactement portugais lors but 	positif
suis pas emballe parmatch euro 	autre
pas pourquoi versesomme surtout pourquoi montant	autre
parle avecfille ellehistoire avant rien crois que vais	negatif
qui vote pour responsable pascitoyens 	autre
mauvais pressentiment surzones sais pas pourquoi euro bel	positif
nous lamentons pas trop vite actes politique	autre
gagner argent avecsite sur euro 	autre
euro contre qualifieportugais bout 	autre
euroavoir cause avec 	negatif
habitue sommets euro	autre
euro qualification gallois avec fille via 	mixte
euro rejoint quarts finale via 	negatif
veste non mais	autre
parle trop les	negatif
paires par semaine 	mixte
vivement prochaine saison 	autre
mamieest trop marrantetrop surcroit trop assez narcissique	autre
vraique estgrosse blague 	autre
rigole bienfait bien rire 	mixte
qui fou rire commeautres participantes sur 	autre
saison bah voila faim maintenant 	positif
aurahalloweenpar cake mortel 	autre
allez petit bonus accueillera aussi cake charmeur 	autre
pasgens qui aiment pas encore peux 	autre
les participants seront	autre
inauguration avec avecacteurs ouverture imminente 	autre
petit avec faire bien	negatif
amusant manger nouveau jours avant ouverture 	autre
pense mais aura 	negatif
chanson toute petit souci 	autre
enfin petit cote maison 	autre
faite que quoi non seulementpas bon mais pluspresqueque	autre
soir vais nouveau avecses potes	negatif
min maison transformer mois vais kil	autre
qui ouvertputainrings appel 	autre
vais sur car sais que aucun risque retrouver surpas peur 	mixte
putain uneenvies alors que viens manger tristesse 	autre
moi qui faitmaintenant mariage soir rien mettre encore 	autre
moment aura juste cote chez toi ️	negatif
moi que jamais cours toujours les	autre
elle oublie peu son	negatif
programme nouvelle saison soir sur programme 	negatif
tout carretour soir 	autre
soir reprise oui 	autre
celle qui compte quelques minutesplus que batterie 	negatif
qui autrenourriture pour tenir 	negatif
retour sur qui fait bien 	autre
est pas enceintesaison	autre
vrai qui pas pour joaillier niveau prix 	autre
pour moi malheureusement pas pour moi	negatif
techniqueoublis sens que vais bien marrer 	mixte
vois vraiment que suis nul	negatif
bah monsieur grenieravais pas que participais	negatif
voisrecettes trop envie faire rappelle que pas four	negatif
ils pourraient moins faire effort mettre pub pour bouffe 	autre
ratefin lugubre musique gros plan sur	autre
moi sais mieux couper oranges	autre
cote chez moi	autre
serai sur paris que fasse tour chez pour	negatif
serai premier client oblige premier qui aime lui paiemenu 	autre
mec vient faire mais faut pas goutte fait parce que faut pas prenne abuse pas mec	negatif
car reste que 	autre
aime tellement cette	autre
pub surpourremercier censure clip	negatif
comment vais faire pour	autre
pas tartepommes maisest bonne	negatif
avec lancement personnes soit	negatif
pays peux avecvoisine qui pas participer	mixte
qui passe bien soir	autre
invite maire zone commerciale sucrerie mission office etc 	autre
suis trop contentequi sont 	mixte
interview choisi pour lancer saison 	autre
rien peut plus que vais manger gratuitement chez 	autre
vous pour nouveau 	autre
causevoiles euh peu avec	negatif
mise sur australienne 	autre
sais que vieavec mangeant	autre
soir encore avoir tout 	negatif
suis tellement que soir tient plus coup loupe tout 	autre
sais pasmoi maisest faut faire quelque chose	autre
trop soir faim 	negatif
lorraine alors tant que lorraine connais mais pas	autre
genre bon gros tout puis moi aveccoquillettes voila vie 	autre
avais oublie meilleur	negatif
quoi joueson est	autre
avant pensais quebeau mais avant	autre
envie vomir sur 	autre
elle pas faire long feu 	negatif
moisont moins forts	negatif
tout vais manger 	autre
avec meilleur trop envie faire bons 	mixte
lui jamais appris manger bouche 	negatif
est trop mignonne 	negatif
vraiment trop charmeest sublime tombe vraiment trop amoureuse	autre
tellement faim tout 	autre
personne cuisine bons comme	autre
ils font comment pour rappeler chaque moment notation	autre
touffe cheveux mais sourire reste toujours bon courage mec	autre
faut quehalloween avait gueule lorsque pub 	mixte
maintenant matte histoire faim 	autre
quifais qui tue moi queavez pense aussi	autre
les sont vraiment magnifique 	autre
fou fait flipper 	autre
taper marathon chaque pour ligne	autre
est qui meilleur	autre
pas mal originauxhalloween 	mixte
chanson pays merveilles 	negatif
putain voisin qui coupe box min fin choses qui font pas 	negatif
les font envies 	negatif
les sont super forts rigole pas	negatif
tout gras revient surfacepas bon bouche auras histoire vie	negatif
test confirme que vais vite	autre
pas tout suite 	negatif
franchement comment passer tant 	negatif
plus queue jour paye	autre
nutritionniste qui parle	negatif
restechef toujours bienveillant proche autres	autre
avez ans sortez plus chezveille peau	mixte
morte croyais trop aussi	mixte
faut que apparemment	autre
vrai pas suivi hier suis faitceluichef oeuvre	negatif
viens tout juste voir suis pour mais content pour 	autre
tellement contente que soit bon gars comme qui trouve amplement	autre
elle part faire elle	mixte
vie sentimentale estbattent tous pour toi pour final faire	autre
bien voit toutfait chier 	negatif
contente pour mauvaisepartira	negatif
gamine mange commeparticipants mangentpleineyeux fermes	negatif
quejeunes allez allier ensemblesuper ️	negatif
pas bah conseille avant hier car trop bien	negatif
consont sorti suis	autre
pire que est	negatif
est seul mec que capable faire marche puis faire stop pour chez fait normal	autre
amplement place orientation	autre
avait pas trouve anneau aurait surpoteauxsur	negatif
pour toijus fruits innocentssont pas tant que 	negatif
suis seule qui peux avoir petit truc grignoter quemangent quasi pas 	autre
veut fairealliance avecrouges juste pour 	autre
parti pour semaine avec lui comme pense restera plus 	autre
celui celle qui soutient quepas lui fracasse crane 	autre
copine inscrit sur 	negatif
ligne sous eau 	negatif
par contre estblague	negatif
continuer suravezbonne analyse	autre
rien fait sur comme	negatif
filmer avec grosse barbe pas taillerils vont peurvont croire reviens	autre
jaunes sorti anneau	negatif
tous casrouges ont bien jouer 	negatif
suis tellement pour 	negatif
maxime temps pas aime	autre
blatteont mange avais maison 	negatif
flammes avec sur impressioncomme	autre
une cru passai fait migrant 	autre
sens bienrentre saute sur elle	negatif
film minutesont feu alors quemettent semaines avoir	positif
fait ans fairelieu mettre boule noirevie	autre
les jaunes sont vraiment fait lors conseil 	autre
ils font tous buter restera fin comme	autre
genre restera plus sur	autre
vais tenter rattraper rentrerai pour verra	autre
marina « toi patron » 	autre
plusieurs lignes travaux tours pour allerpire queparcours 	autre
fait quesont pas connecte hier pour entre surserveur est	autre
les rougesauraient faire partircollier aurait encore plus beau	autre
feuont change les	autre
tout sait quefin restera 	autre
aimerai tellement faire suis pas sportive pour clou mais aimerai juste faire tant que personnel	negatif
aurais gagner confort pour aller village local manger fruits gros steak frites ouais	mixte
route versbelle finale avec poteau 	autre
quebleus bosses courbatures 	negatif
signe nazi totem choisissez 	negatif
totemgensavaient pas peine ici	autre
vous avez beau quegnangnan gamine tout maisplus	autre
pas mais aimerai bien que gagne	autre
elle veut paye impression	autre
cette part steaksont train lespoteaux retrouver avecnuls 	autre
trucs fin restera 	autre
encoreinjustice sur avecune vraie 	autre
bravopoulet pour anneau 	negatif
cettecomme fin restera	negatif
avais plus maintenant plus eau truc	negatif
quevraie championne mais pleine gentillesse 	autre
stars carre final avec serait parfait 	autre
touche pascatch show sur partenariat avec 	negatif
seulement quepuissant gagnera 	autre
bourreau ressemble pas mieux	autre
grave base pasles jumeaux 	negatif
trop avais pleure	mixte
reconnais pas qui fait	mixte
aimais tropest magnifique plus	autre
elle ressemble fort	autre
mange tout riz sur	autre
ayant foistoujours pas compris faut jamais sous estimer son	autre
haine contre moi croirecomme totem ligue champions autre coupe	negatif
avait mectout lui 	negatif
finalementferont pas mais	negatif
faut mettre contre officielsur les	negatif
moins comme entre tragique 	autre
classe qui premier 	autre
par sources sures repris pas son	autre
impression avoir fait	autre
halloween programme plaireenfants	negatif
aimerai trop rencontrer vrai plus veut faire cap ouvrircomme moi	negatif
les programmes sont sympa moment 	autre
mon seul momentfabuleux 	negatif
pour meilleur que autres 	negatif
pas olivier mine qui partir	autre
est juste pire vie	autre
julien question pour champion sur quepas champion	autre
injusteimporte quoi plus que importe qui rester	mixte
ouivrai mais moi sentait que julien moins bon 	positif
suis tellement pour olivier 	negatif
pas tous sur cote azur	autre
pourfois que suis avec gilles progresser encore	mixte
vraiment pas partir bientouchant simple commentpossible	autre
mais oui bien sur que sens trucage	negatif
hommagefait partie mes	negatif
franchement saoule mais pour olivier mine que aime beaucoup	autre
bien comme quepartiinjuste soutiens toujours 	negatif
ennuyant mourir failli alors que suis	positif
paspasvotes sont rien	autre
coup coeur pour	autre
sur mets pas tout	autre
aime pas mais voit biencorps pour faire toute sorte	autre
est trop sensuel oblige ils	autre
sur cul moment voir revoir	autre
pourquoi pas fait parce que comme cul 	autre
trop olivier soit parti	negatif
aurait canon notre	negatif
beaucoup critique mais franchementseule que tout temps avec	autre
les gens critiquent sur parce quepour faire plaisir faites ils	autre
mette pas moyenne 	negatif
revient sur avezpense 	autre
vraiment injuste pour tout cas touchant toujours top content avoirautre facette lui 	negatif
trafiquevotes avec ces	mixte
suis surpris pas avoirqui fait toutespossibles imaginables 	autre
que parte mais bravo pourparcours 	positif
aime pas maisenfin reconnujuste valeur	negatif
moi veux revoir seras hein ️	autre
bonne olivier suismais reste meilleur aime 	negatif
moi pour que avais envie voir 	negatif
croisefesses crois que qui avait 	autre
par contre chanson peux paschante bien perturbe	negatif
quipour voir chouchoutesuper bien ️	autre
ses petits motsamour trop chou	autre
off pour gentillesse soir vraiment vite 	negatif
bien truc claques cale sur musique	negatif
rumba magique magnifique 	negatif
meilleures off prime 	autre
culbutes sur veux pour commenterportes	positif
remercie belle avoir fait soirmagnifique chanson 	negatif
bonne merci pour	mixte
parce quegens votent pourpasprestations coup	autre
elle fait maisembellit fois	negatif
trop mignon julien	autre
belle tout joli moment belle chanson	autre
jolie rumba belleenfants peuvent avoir maman comme toi	negatif
les sont tout simplement sans exception mourir rire termine toujours plie 	mixte
mieux que projet peut 	autre
soutiens maisavait pas 	autre
moi petit cote	mixte
jour arriverai mais pas soir parce quecarton	negatif
vrai soleil sur programme que iras loin	mixte
homme fort cache sensible lors olivier 	autre
belle rumba beaux portes joli moment fonctionne bien	negatif
qui soir enfingagner	negatif
belle valse beaucoup aime	mixte
tellement suis sure quelui qui gagner	negatif
que pour sur soir aura poterie hein 	autre
tellement triste soient partis 	positif
beau moment joie avecjolie belle progression bravo sourire	negatif
moi aussi avait encore lui vraiment 	negatif
que receveur fou place avait tellement meilleurcomme faitplans	mixte
rien que penserrevoirsur plateau 	negatif
truc chansons mourir rirerefaire 	autre
off rennes serait trop bien puisse venirbaba 	autre
non maisobjectif pas haine envers juste pense 	autre
serait bien que revienne sur	negatif
voir toutvois que tout veut que capucine 	negatif
puis rage gravebaba mais avoue que parfois fort	positif
bravo pourjolie valsebelle amour sonlui bien	negatif
maispas vrai continues comme	positif
sur valse suis trop content	autre
voir baba parler fait plaiseouf 	autre
euh suis train suis mais faut A toutessauces 	positif
manques mais aussi nouvelle coup suis entre joie nostalgie 	mixte
margotte toi rien aussipour 	autre
voir touselle bien que chroniqueusepas pour elle	positif
tropest pas juste tout 	negatif
mat petite pas chose veuxavis	autre
avez rajoute tellement public que pauvre garsestface service	mixte
trop bienmusiquestout que avais vote 	mixte
mat petite non pas besoin merci	negatif
bouche capucinepire que culvache sortinqualifiable virez putain 	positif
mat petite suis naturellement violente	negatif
baba viens chercher cote merci infiniment 	autre
commence avait chaises tabourets huivous	negatif
plaisir avoir retrouve	autre
soir invite programmer film titre 	autre
qui tout fait pour assister permis rentrer super 	negatif
ceci cela veut rien car pourchangeaient tout temps	negatif
vous pouvez envoyermessages soutien conseils pour primecouple favoris ici 	positif
trop bonne nouvellebonheur 	autre
fille aime trop 	negatif
pas car suis avis que toi capucine pas place nulle part 	autre
fait bien plaisir revoir 	negatif
hui min voir rigolait bien	autre
sur estpas toucher 	mixte
julien commetruelle hurle 	autre
voulucoup gueule sur mais stoppe 	negatif
mais esthaineuseelle pas prise pour coupragecritique tout mais	positif
avait air bien	autre
est canon mec	negatif
analyse clairement influencechoix paramis	autre
les rougeont fait couptrop	negatif
potes toujours bon conseil pour faire choisir mauvaise 	autre
peut pourquoi personne alerte sur beau hein	autre
non pas pub	autre
trop touchant olivier	autre
agriculteurs rencontrer femmes sans vraie vie fait	autre
meilleure amie qui moche carsentmise cotepote jolie 	autre
rien contre mais impression que mois	negatif
pas aiseest peu principe pourtant	autre
cette nouvelle musiquevraiment pas possible remettez	autre
pas que jolie trouvera vite	negatif
avait voix oeil velours bilan voix macho oeil bovin	autre
sublime rumba belle magnifique peux	negatif
ayez peu respect pour 	negatif
julien qui sucre maisfourchette	mixte
votre capucinepas marre	autre
replat fais que chialer	autre
pub envie chocolat pas	negatif
amourserait pas amoursansque aimefemme 	autre
tout quebilan pourfois arrive quelque chosevillage	autre
entre sais pas qui met plus mal aise 	negatif
toujours aussi magnifique ️	autre
ailleurs prie pour tue pas	autre
saison bof mais marrait 	autre
bonbien gentil mais faut aller voir qui succombera batte	negatif
pas contente baba pas parler spectacle qui fait carton soir	negatif
ben prenez filles avecvous ferez moins chier	autre
comme pourtant personne fait moyenne vrai 	autre
non fin semaine prochaine 	autre
avais pas fait gaffe maispris gros vent avec baiser voiture non	autre
brutalement que maintenantsont sur coupmoinsvoient 	positif
chercher baba chercher	negatif
rencontre tout suitemusique 	autre
elle tellement bien	positif
enfin couple surprise	autre
fait trop peine 	mixte
raconte quoi faux cul avait heure	autre
bah tropfillesnouvelle est	negatif
potes bah forcementsont pour bien	autre
poisson patin roulettesexpression qui pas explication	mixte
faitsaison pour finir avec pote tout pour 	negatif
ben venu pas pas	positif
aimerais trop avoiraime bien	positif
bien fait bien revoir	positif
parfoisvrai tout sait pasamoureux 	autre
parle trop vite moi rien	autre
est plus couple avec mais retrouve amour	negatif
pas enthousiasmecouplespas passionnant 	negatif
que trouve trouveras celui faut 	negatif
bon fait aime pas tant que aime peu trop non 	negatif
moins lit lit pas	positif
sait mec remonte pluscols	autre
pas soupe sachet bilan	autre
bonne ratatouille polo plein moustache	autre
belle prestation belle bravo beau potentiel aime leur	negatif
qui trouve amour avec pote 	autre
croyais que parlait rouler par terre	autre
encore bilan semaine prochainetrop	autre
merci baba pour vivement 	autre
non mais estblague voulais voir	positif
fait toute seule avec	autre
merci avoir avec nousretrouve prochain pour bilan saison	positif
voila fin bilan semaine prochaine temps avecfallait	autre
heu peut aux	autre
les garssaisonpire que	autre
exclue pour toi retour express sur plus que non 	positif
saison histoires amour conte 	autre
toujours aime mais avec aime plus 	negatif
bilan parties cote positifqueretrouve tous prochain 	negatif
avoir parlepolitiques parlechange pas trop	autre
sur prochain pour tout 	autre
bon bahrevoit semaine prochaine 	negatif
naturel pense que serait plus sans	autre
bonne semaine tous	negatif
non chacun voix maintenant sens quelques choses casser entre	mixte
aimerais bien aller assister 	autre
encorebonne euh prochain pour suite fin bonne nuit	mixte
ils pourraient fairenouveau look vie avec	autre
euh rire capucine peux plus nana qui rigole pour rien pour faire remarquer	autre
maintenant retrouve nouveau look pour nouvelle vie	autre
semaine pro amourenfincette	positif
bon bah foispas coutume suis bien 	negatif
plus parcours qui aurait fuite que fin	autre
vivement semaine prochaine pour suite bilans 	autre
merci courgette chacun fait fait qui lui pour tout	negatif
bon ben chaque semaineplus plus mou vivement finsaison 	negatif
bon vivement semaine pro entre avoir comportement bonne nuitamis	negatif
mais confessionnal poste	autre
pour fois euh	negatif
trouve moyen heureusement que existe 	autre
mec parle que lopettes	negatif
off pour moipasjuste	autre
