pen ruine chinois vont pouvoir lui face	mixte
trois heures pour camus vie trop courte pour tel spectacle	negatif
suis avec ceci occasion encore fois mieux que britanniques les	autre
tout pour rien programme part attaquer propose rien pour 	negatif
vainqueur par pire histoire	mixte
mieux que aussi niveau 	mixte
marine pen fait simplisme face	autre
schlague belle expression front national officiel vive 	negatif
parle salir insulte parasite aucun respect	negatif
juste bravo humaniste mai soutien	positif
contraintes constitutionnelles comme savez quelque chose chez	autre
royaume uni marche vers via	mixte
que finalement aurais mieux fait fermer gueule 	mixte
ministre aussi responsable 	mixte
qui pleure qui parle	negatif
officiel euro franc que rouble honte	negatif
est psychopathe ’ psychiatre italien 	autre
marine pen fausses accusations ironie plus arguments elle	positif
fais encore travail fais rire	mixte
connaissez recoins que officiel	negatif
fin tour entre que bien faire pour ces	negatif
ouverture celui fermeture usines etc 	autre
qui peuple fille enfant	mixte
marine vient craquer 😂	positif
ensemble aller loin 	autre
pas monologues pas mais soir	negatif
les programmes connaissions fallait faire ressortir esprit marine bien fait 	negatif
quoi programme pen	autre
bonjour monsieur comment allez 	mixte
vient tomber verre non eau erreur conseiller 	positif
tais toi couper lui micro	negatif
nulle pas gens bon sens lui tournent gagne haut main 	negatif
est contenu contre populisme lui 	mixte
marie pain veut maintenant gouverner avec baguette magique 	negatif
moi cherche φ met bulletin urne ministre force	autre
saigne oreilles reforme officiel ferme jamais	autre
personne parle tout plus	mixte
veux pouvoir pas pareil 	negatif
pourquoi crient croirait clip	autre
laisse stop parle traiter personne parasite pauvre con 	negatif
autant posture autant sans posture riait jaune 	mixte
merci bon compta 	positif
programme marine rumeurs	mixte
vive faites plaisir mettre ligne jolie photo quelle	positif
ouf finit pour face militante	negatif
parle quoi part attaquer insupportable 😤 	negatif
plus chance que marine passez	positif
clair sur reformes institutionnelles cumul nombre parlementaires 	autre
touche creuse encore	autre
A fin question pose encore possible vouloir voter	negatif
officiel trop propos parle sujets fois	positif
non mais plus plus	mixte
jubilation chacune attaques self	positif
robin tombera plus bas que terre cause mauvais sera choisie avec est	negatif
pen contre mais avec tout vent soir serait sans soir 	positif
affirme que patrimoine marine pen avait 	autre
plein soir sur inaccessible paniquent	positif
preuve que marine parle retraite mois 	mixte
comme beaucoup voir premier ministre 	mixte
serait parfait effet 😂	positif
votre parti ressemble pas mais respect leurs	negatif
moment marine totalement face bonus 	autre
non vote pas veut aucun ceux qui 	negatif
pas mot sur pas	negatif
moi veux que	autre
que proposez pas place marche marine pen	negatif
officiel sur bonne nuit 	autre
aurai place aurai saute sur table mettre taquet officiel avec petit mais ferme 😂	positif
A voir sera suivi choses 	mixte
votez venez plus parler	autre
impressionnant que journalistes aient pas pose questions sur climat environnement	negatif
sur item qui mieux gens comme favorable 	autre
marine parle jamais aux	autre
par comportement permanence caricatural rictus permanent	positif
bien classe vue officiel	autre
avait que marine aura officiellement son	autre
vais enfants bout pour ils	negatif
expliquer comment peut voter marine voit prestation	positif
fait marine plus aucune chance mais vais essayer rate	positif
peine croire que sommes pour impression que 	negatif
elle vrille non	positif
flemme tout marine	autre
pas parler agriculture 	negatif
aime ont refuse prof passer comme 	positif
peux pas changer mais peux convaincre serait personne pas abstenir serais heureuse	negatif
est plein sur fin officiel	negatif
que que marine programme creux allez lire mesures verrez subi attaques moi	positif
terrifiant que mots vont occuper ans 	autre
encore insultes vous votez injures 	autre
moi vieille peau trop 	positif
comment arrive ici fois plus	mixte
savons soir jours annoncent	positif
menteuse pareil moins pareil 	autre
officiel merci pour crasse sur tous sujets savent qui 	negatif
financier avait pas pouvoir aurions	negatif
humour vraiment chier 	autre
mieux que toi aussi 😂	positif
mieux que merci cela bien tour	positif
objectivement sans partis pris pen fait exploser soir 	positif
ont voir soir avait projets opposes	positif
ami ballon premiers journaux prisonniers vaut 	mixte
tel socialiste banquier aura parle argent omettant parler 	autre
aime telle aime nuance 	positif
contre voiles sont pas pour route rhum 	negatif
quoi avons soir avec officiel 	positif
avais talent con serais princesse	negatif
qui pour enfariner marine pen	negatif
une boite avoir pen	mixte
sais servent premier que pouvoir	mixte
pen mieux que phrase avoir une	autre
rien autre combat coq celui qui piquera autre plus fort	mixte
les besoins entreprises marketing 	autre
qui convaincu soir	positif
marine pen crois fumer avant 😂	positif
courage tenir engagements tenir travail veux esprit ensemble	positif
sang bravo reste calme tant 	positif
fois moment histoire peuple votera par 	autre
alors insoumise votez quoi maintenant 	mixte
soumise comme que comptes les	mixte
elle fait quoi mentale sur	positif
fait crois que 	autre
niveau que lui avez fiches 😀	mixte
bien contents gens avoir aussi tour veaux 	mixte
tous peintres profit peintres 	mixte
preuve plus fout base minimum 	mixte
soir aussi incapables par politique spectacle	positif
abaisse pas bas niveau 	negatif
officiel certains font sont 	mixte
folle affronte soir 😂 soyons	positif
fait penser qui ont seul programme must 😒	mixte
enfin vite voir ouvrir car 	mixte
elle veut influence politique avec influence politique morte	negatif
qui intervient porte parole pleurer coupe	autre
pen annonce cas victoire que ministre sera olivier 	mixte
moins peut avoir avis sur propositions pas avec mais projet 	negatif
est politique que verges rupture arme ceux qui savent ont	autre
suis mieux que merci utiliser mots crus	positif
cette bonne femme folle	mixte
max alors aucunement marche vois juste avec yeux 	autre
sans oublier appelles marie passe boites	autre
ouais mais bon pas mais	negatif
oui postes vie scolaire merci	positif
voterai met ministre sinon vote blanc	mixte
marine pen expulsez ruinez 	autre
faut juste explique quoi servent journalistes	positif
sujets important ignores environnement corruption politique sociales homme femme	mixte
marine pen mal avait avec lui avoir patience	mixte
marine est incroyable mais jusqu point	positif
avait raison refuser entre tours face importance gens inutiles	mixte
ratissez large coco	mixte
vais ajouter que avez minutes marine 	autre
nulle marine vraiment nulle avec veux gouverner	negatif
mieux que tous cas	autre
sera par femme soit moi soit marine vient marquer points 	autre
marine pen bien justice avocate par juges 😂	positif
officiel encore qui voix 😂	positif
gamine triste monstre	mixte
aurais aime pays mieux que	negatif
veux plus que jeunes autistes aient aller une	mixte
agressif fait attaques personnelles officiel spectacle comique	positif
pas bien utiliser expression pas pas hauteur navrant	negatif
mis feu feu sacre bravo	positif
culture qui fait tant bien heureusement niveau moyen	positif
marine pen boire champagne qui quartier plus chic paris fille peuple 	mixte
voir moi programme officiel trop mon	positif
conclusion rarement niveau pareil	mixte
officiel trop ignares soutiennent entre autruche ➡ 	positif
bravo montre tous 	positif
craint moi qui pensais pouvait pas faire pire	negatif
elle met mal aise	positif
crois que mieux avec tout nazisme partie 	autre
soir souvent globalement franchement	positif
vient tuer officiel sur absence carte blanche son	autre
projet officiel mais rien	mixte
soir fait flipper entier	positif
craquage fin par 	negatif
mot fin restez moi veux	negatif
planquer plus fric que banquier affaire rapporte bien plus que 	autre
staff sur ravi journalistes objectifs	mixte
voit pen tour 	autre
pas hauteur qui veut sortir 	negatif
vivement que retrouve bistrot pour	negatif
parce que marine 😭 qui faut pas voir	negatif
qui vient conscience boulette 	mixte
elle jusqu bout	positif
merci qui prouver que officiel respectera jamais justice	positif
plombs mentalement limites soir 	positif
loin exemplaire lui aussi compte sont soir 	positif
officiel sont agressifs avec aucun sont transparents	mixte
envers naissance travail suis mutile travail mais pourquoi journal	mixte
affaire sera officiel pitoyable pou 	autre
faut accepter comme cela lutte contre obscurantisme pas faisant toutou 	negatif
les bras croises notes cela veut tout langage corporel	autre
heure compte plus 	mixte
bonne nuit marine 	autre
mon temps valait coups 	autre
elle programme fait que tailler ancien gouvernant pas	negatif
tape nez trop fort	positif
franchement marine pas hauteur niveau trop faible pour commune particulier pays	negatif
elle lui marine 	positif
coupe entier tout hein tout eux	mixte
sur parle marie utilise	mixte
culture alors sommes tout pas seul mot est	negatif
qui allez voter tour marine pen	autre
oui acteurs culturels choisissent engager pour contre 	negatif
bravo ligne gagne	positif
bref moi vote 🙄	mixte
plus suffisait que aient tort erreur monumentale	autre
suis pas pas pire montre vrai visage chaque	negatif
sait plus quoi est	autre
elle fait sur plateaux que sera 😂	positif
marine pen trop moi justifier	positif
cause gamin croie que marine facho portez image	mixte
passer mentionner gros sur	negatif
serait vraiment triste que marine soit femme	autre
compte que bout que enfin programmes 	mixte
suis encore choque par que comment gens peuvent 	autre
officiel parasite oui	mixte
troll pro sur suis 	autre
abaisse sommes nombreux regretter que vrai ait pas lieu	negatif
souvent tant fait spectacle affligeant 	mixte
pourquoi marre tout temps	mixte
mais gueule excusez moi tenais plus	mixte
citation jour anonyme via 	autre
avis aussi faite faite que finale coupe	autre
blague aucune voix pour	negatif
mais sans rire voulez vraiment qui serait par femme qui 	mixte
connaissait rire sergent soir ricanements forces folle	positif
enfin pense que respect politesse avant faire morale tout	negatif
plus plus que	mixte
louis pompe rabbi 	mixte
essaye noyer invectivant plus 	negatif
bon face qui apporte aucune solution contre mensonges	negatif
soir statut sans programme passe	positif
officiel pourriez commencer sur programmes	mixte
les patrons inquiets sujet programme 	autre
vieux naufrage imagine comme 	mixte
avec programme base sur programme caricature	positif
train mettre officiel estime toute seule vive	mixte
calme tout impressionnant 	autre
aucune politique chez officiel aucune chez bref les	mixte
qui traite potentielle parasite salir 	negatif
nous aurions passer journalistes	mixte
aime telle pen une	positif
une question public 	mixte
qui exprime peser lui tout qui sur soir	positif
sinon peut opinion sans vulgaire non	autre
voir incroyable talent 	positif
analyser comportements soir jamais yeux gestes	positif
organisation cas bien mieux que	autre
non sinon toucher plus	mixte
non mais mon	autre
exactement que soir enfin que	positif
pense que pen compris avait rate prestation alors comme gamine	mixte
officiel pas pas projet mais que attaques envers	negatif
ajoute une break final break	autre
mais qui qui campagne toi	mixte
pen pas bonne solution pour ailleurs mais pen raison sur certaines choses	negatif
retirez lui piles elle	positif
banques avant tout 	autre
maxime avez pas voir 	negatif
ricanements peuvent convaincre que 	autre
peuple peuple peuple qui aime faire enculer leur	negatif
franchement abuse contente groupe pop qui viennent puis sont connue	mixte
gamins qui autre zozote belle jure	positif
soir situes sur qui aucun projet marine tout expose 	positif
pas comment voulez soyons reprenons esprits 	negatif
pas bonne mais qui sera face	negatif
exactement que mais avec rouge	autre
profusion conneries par	autre
🔴 propos marine pen « vaut mieux que » 	autre
pourtant vrai voir jeunes ont	mixte
bravo choix fais mais suis 	positif
une belge hauts avec 	positif
peut mais qui peur 	negatif
toi tout que vas payer faire pour	negatif
mais tripe fait une	autre
vous comptez vraiment passer 	mixte
bravo avoir mis imposture tant que 	positif
est participer face aussi agressive	autre
sur aussi bref soit objectif chiffres	autre
officiel que grotesque termine vite car 	mixte
magistral main votons massivement prochain 	mixte
sou parce que meilleur	mixte
que plus millions gens qui voulait voter blanc sache maintenant qui choix	mixte
elle rate verbal non verbal soir	positif
pen bien pouvait	mixte
bon grosse blague 	negatif
comment est quitte	mixte
les sont chier sur clown plaint	negatif
mais folle parole 	autre
courage bonne nuit	positif
bien bouffonnerie mais quelques points peu clairs 	negatif
vas voter laisser comme veut 	mixte
lamentable ont parle non mais ont touche 	autre
officiel niveau faible ferait mieux voter	autre
calme qui peut pas qualifie femme	negatif
imagine moral conseillers face crash 	negatif
supporte pas mec abuser	negatif
femme bijoux ensemble collier ras cou gothique 	negatif
bravo suis mon	positif
aucun charisme langage racaille fait honte pas arguments toujours cote plaque	negatif
vous imaginez rencontre entre aux	mixte
seul peut mai 	autre
tellement tellement fait 	mixte
fille millionnaire avocate paris parle par argent	autre
mais que avec 😂 	positif
sinon fait beau parce que bon autant mais autant que puisses profiter soleil	positif
rebaptise junior officiel bel bien 	autre
tout suite encore qui trouvent que chose	autre
affligeant vraie gamine	autre
fait lui bonne	autre
place tel self fais crise bravo 👍	positif
presse pas premier pouvoir officiel soutien officiel 	negatif
avez logique simple conflits programmes annonce ferai 	autre
typiquement genre qui pleine boucher oreilles crier	mixte
officiel bobos personnes qui travaillent mains situe 	mixte
pense que vient flinguer toute seule mai 	autre
ouais riait jaune lui mettant nez autant 	mixte
pour conclusion mensonges attaques pour lui avenir pas photo	negatif
quelle vision morose avenir	autre
gros mentaux mais que veux 	negatif
aucun programme merci avoir fait voir vrai visage 	positif
fais chine japon venez 	negatif
cette nouvelle formule sans journaliste fonctionne assez bien finalement	mixte
celui qui qui maintenant	mixte
moi aussi regrette pen mieux que vous	mixte
saint maintenant joue roi silence	mixte
comportement rappelle mais sais plus qui gens qui ont insultent	mixte
comme portez plainte 	mixte
moi aussi pas photo	negatif
soir soutiens officiel sont absents crois que enfin escroquerie est	positif
question argent pour monsieur	negatif
programme aimer langue histoire choisissez office tourisme expliquez tous touristes	positif
terminer avec rien	mixte
veux ouvrir temps jusqu bout	autre
faute morale — via	mixte
quoi soit approbation non soir rappelle importance vote confirmant vrai visage 	positif
est parle pas programme que fausses informations mais permet autres	negatif
valeur point nombre belle faite soir par 	positif
aime pour cela que veux pas laisser pays entre mains celui qui coulera 	negatif
vrai visage parti taux mis examen honte parti parasite qui salit 	negatif
non non trop loin	positif
tout avait besoin merci bonne	positif
gilles mal via	autre
sous couvert sous patrimoine 	autre
trouve tous show faut juste que trouve porte	mixte
toujours peur tenir seule non	negatif
mettre belle pagaille famille tant mieux 	positif
bien manipule facilement	autre
mais arrogance fille mais gueule	positif
» blague jour veut avoir 	mixte
non mais obligatoire avant	mixte
officiel type hypnotisant marine latin	mixte
culture journalistes plus que ces	mixte
heureusement que soir	positif
bilan hautain officiel sans aucune proposition aucun club finale coupe vive	mixte
restez moi veux 	mixte
images queue leu leu soir tour queue leu leu 	positif
calme toi gosse riche vas pas voter pour toi contre 	negatif
allez avouez que vise convaincre voter blanc	mixte
mais pourquoi kleenex main interviens 😱	negatif
elle clip culture peuple	positif
bon courage prestation officiel 	positif
traite gens parasite pas	negatif
compte final par 	mixte
enfants situation utilise terme merci	positif
parce que remplie haine non	negatif
cerveau vas marine heure gloire faut rentrer 	mixte
pas mal coup parasite	negatif
sinon aime bien nouveau concept sans journaliste 	positif
tout cas aucun programme quoi arrive	autre
principe mensonge seul argument pour lui sans	negatif
personnes sont convaincu par pauvre	autre
pense que chacun public chacun public gagne 	mixte
veux tout inverse que portez veux 	autre
assume choix surtout avenir vive	negatif
marche marine pen potiche	mixte
qui petite insolente	mixte
suisse gagne sur technologie innovation avis qui meilleurs	mixte
mais qui sont qui pensent que marine plus soir 	positif
officiel merci vive 	positif
mais toi bien que corruption vient toujours plus riche 	mixte
elle mieux programme que lui	positif
vient tuer beau 🙂	positif
carnaval laisse langue bois avec telle facilite	positif
bilan sera sur tous plans laisse soir est	positif
liste envie massacrer qui ont vote 	mixte
officiel petits arrangements membres entre pro 	autre
que oui monsieur premier ministre moi 	autre
croyais pas mais avez gagne monsieur juste petit unis 	negatif
viens faut mettre plus bas possible	mixte
officiel rien parti seulement que trouve 	mixte
pays importe peu avez pas projet pour lui propos campagne mensonges par	negatif
revoir journaliste tellement saoule voit que elle retenue baffer pen	positif
officiel embruma tartufferie abominable bravo	positif
pitoyable folle reste sur choix abstention	autre
veut pouvoir veut parasiter politique 	mixte
rien compris grave ramasse part attaquer 	positif
comme lors tour cite outremer conclusion 	mixte
elle quoi bien fume avant venir	positif
sont pauvre sales faut aller	mixte
mais oui change frappant 	positif
initiative participative suivre 	negatif
pourra retrouver visage que sont citoyens qui emparent questions politiques 	mixte
naufrage pen totalement moyens	mixte
petite question que proposez pour cause animale 	negatif
oui oui avec fortune familiale bien peuple	autre
pas oublie arrogance genre visiblement 	negatif
cinq quelques marrant petits tour chiant	positif
renouvelle question peut confirmer que compte saint plus	mixte
avec irais fera anime fera sport inscrira sur ensemble	positif
vous comme par magie pro oui bon bon ben moi vais alors reconnais plus	autre
veut ferons que sommes 🤗	mixte
merci avoir consacre sujet carte blanche enfants scolarisation	positif
elle craque parce sent que sont plus plus fragiles	positif
parle aussi bien que programme total	mixte
totalement rate champagne 😇	autre
gens sont vouloir garante institutions 	autre
marine sourire clochette mais masque 	mixte
officiel ben que vieille sous mec plus moins tenter 	mixte
marine soit soit rien	mixte
comment tant peuvent soutenir avoir telle 	positif
mieux pareil cuite bien sur 😂 	positif
elle sourit ivrogne 😑	positif
avait raison existe pas avec officiel aucun programme pour que attaques avait stature 	negatif
comment arrive son	mixte
quelle arrogance est	positif
alors allant pisser rater partie sur enjeux climatiques	mixte
non pas recommencer hein 	negatif
qui fait avec qui fait sont trop	positif
ouais petite aurait communisme 	mixte
temps libre pas hein bien compris niveau bon son	negatif
moi suis sur faim mais vote marine car occupera finance avant	autre
oui monsieur aussi cause que final euro ministre 	autre
sans tabou avec marine pour 	negatif
pen oui quoi 	autre
impression sont tout tout seul 😕	autre
marine off lamentable officiel	autre
vote pas pour contre hui	negatif
voit qui sort avec cranes rases comment	mixte
marine parlait parlait tout 	autre
renvoyer officiel soir serait tout 	positif
incroyable brise mille morceaux	positif
plat ventre crois que bon touche	positif
parle comme gamin	mixte
exactement viennent centres lieu balancer phrases sur	mixte
officiel foutu pen 	mixte
suis seule trouver que marine que normale 	autre
officiel officiel fallait travailler minimum revient ans	autre
monsieur que voulez vraiment ressaisissez encore temps	mixte
peut constater soir que plus fort barrage officiel elle	positif
comment peut lui confier 🙄 	autre
elle mal femme choquant	positif
bravo tout seul avec pen qui montre son	positif
crue toute tribune meetings pitoyable meilleur rempart contre	mixte
pensait pas que officiel comme enfant face vrai enfantillage soir	negatif
fait effet tout perlimpinpin 	mixte
olivier honte pour choisis non pas par mais par conviction pour son	negatif
rassurez moi brouillon essai vrai sur lieu 	mixte
manquait chef soir 	positif
trop bonne sexuel parce que parlez menti 	positif
suis mais heureuse vote sans	positif
officiel monsieur autoroute migratoire entre	mixte
soir pour saint 😜	negatif
elle peut marrer parler part live	positif
certainement mais franchement souffrance 	mixte
oui oui parasite reste gentil encore	mixte
non bonne calme bien 	autre
pourquoi raison sur chiffres 	autre
elle lui reprocher origine star	positif
les premiers concernes premiers oublies officiel	mixte
ouest vitre pilotes sont ouest mai club 	mixte
entre teigne poux extra est	autre
officiel sauf que tout sauf que qui gagne	mixte
pour ceux qui avaient encore face clown vulgaire seul 	negatif
son sourire narquois	autre
trop non mais journaliste peut plus sont 	positif
nation peuple rien non merci marine 	positif
plus belle 😁 voir pen mais plaisir	positif
mine rien nerfs	mixte
ouf enfin fini pas	negatif
passe sera tous bien avant voter sera plu	mixte
marine occupe comme est 💩	autre
argent parle hein	autre
rassure retrouve bien centre ailleurs mais	mixte
mais traitement effet quoi fait avion plein	mixte
elle vit alternative grave projette 	positif
rien sur recherche rien sur jeunes culture sont passes vrais politiques 	mixte
que trop jeune face gamine 😂	positif
suis sur comptes pro seigneur vais commencer pleurer	autre
pouvait sourire pen assez	mixte
alors oui sais suis optimiste mais franchement vaut plus que plus que 	autre
avant passer sur ben beaucoup plus joli 	autre
chance concourir pour 	negatif
moment offre gratis troubles officiel 	mixte
😂 analyse assez juste 	positif
soutien suivi marine tout cas sera par femme moi 	mixte
mioche jures passeport vais enterres 	mixte
ben pas terrible 	negatif
ont choix entre imposture	autre
marine pen soir une	positif
bien pour moi non pour rien veux voir gouverner pays	negatif
avais oublie pas seule sont mois 	negatif
moi rien tour bravo	positif
mais putain laisser parler	negatif
ont mais moins ont humour merci 😜	positif
non mais toi vois mais voir plus ombre juste renouveau 	mixte
quoi graphique pas sors que veux pour faire connerie 	negatif
plus qui bonne partie mais semblez 	autre
certes mais pas voter risque bras	negatif
noir jour extrait paroles 	autre
une chance pour parler allez	negatif
officiel tout essaye mais que 	mixte
qui jugez avoir plus convaincant	mixte
tient parle projet A temps	autre
analyses vraiment sur	autre
suis par lamentable 	mixte
respect pour self face serpent venimeux moi secret pour 	negatif
tellement que enregistrais partie protectionnisme 	mixte
agonie pour piquer	negatif
elle toute seule	positif
montre sera pragmatique efficace rassembleur	autre
parti affaires lance 	mixte
ose parasites ose	autre
C qui explications aussi flou que sien vive 	autre
plus souverain gouvernement plus pouvoir pouvoir est	mixte
bon alors quoi	mixte
bon allez choisir	autre
soyez pas recycle famille avec marche lui non 	negatif
reconnais meilleur mais reste sceptique comme vous	mixte
vrai pas assez souffert aura toutes personne 	negatif
officiel peut russes lui 	autre
sait plus quoi	mixte
ans veux qui aura gagne bataille face terrorisme face face illettrisme	mixte
officiel officiel montre son amateurisme	autre
constate malheureusement avec officiel 	positif
pen place retourne travers loin	autre
que font journalistes faites travail	autre
les membres parti sont mis examen € plus € ferme	autre
marine pen nationalisme » 	autre
vient sortir fiches 😂	positif
masques tombent voir vrai visage	mixte
heure nom victime pen	autre
elle fait victime non mais hallucine	positif
mieux que merci 	positif
faites honneur qui jeu	mixte
suis mais pour ’ pas besoin salir 	negatif
bravo plus propos pour allons 	negatif
ahurissant juste poser question par miracle elle	positif
balles marche vers nom mec soutient politique 	mixte
elle aucune que bassesses	positif
minima sort pas alors fallait victoire pour renverser vapeur 	negatif
bravo haineuse plus	positif
barbier avez part banalisation parler tout temps propagation 	mixte
val bref vivement vibre parcage troyen 	mixte
savais pas avais suite habille 	negatif
part que pourrai qualifie merci	positif
officiel oublie programme carte blanche avait que vannes contre	autre
officiel parle institution faire veut pas juges argument	negatif
papa rate examen 	autre
content rate nouveau nature aussi 	mixte
met place cellule psychologique accessible tout membre public ayant	autre
soir coucherai tranquille emporte cauchemar pour 	negatif
toujours mauvaise pour job aurait mettre voulaient faire quelque chose 	negatif
sentiment sur vient subir voit plus rien 	mixte
bilan chiffre attaques questions	positif
apparemment soir apparemment	positif
pays pauvres avec trop riche sont bureaucraties par gouvernementale	negatif
elle parle mange oublie programme notamment	positif
qui veut sucer queue boite	positif
elle veut chaos	positif
pas type escroc pour entuber 	negatif
bonne femme est horrible	mixte
monsieur bien tour suite celui faut bien choisir pour 	negatif
elle toujours accusations	positif
