aime qui respecte avec usa seraient encore colonie britannique	positif
tout comme qui tellement hypocrite pauvre 	mixte
mon pen plombs	mixte
juge plus convaincant 👏 via 	positif
officiel avec votant 	autre
loi parfait chez juge lieu faire morale	negatif
carte blanche sur entreprise bien joue sujet sur lequel manipule mieux	mixte
certain nombre bobos ont estime que avoir bac plus marine pen finesse sur	mixte
soutien choisir entre choisie abstention	autre
bien riche non ceux avec petits moyens pour cons 😂	negatif
normal qui pas toi peu pas garant pas pour blabla	negatif
trois hommes blouses blanches pen sortie	mixte
mention journalistes parfaitement inutiles	autre
souhaite que emporte voix amis origine	mixte
officiel changez camp avant juges 	autre
bonne nuit monsieur pas plaisir visiblement	negatif
marine vieille avec une	autre
aurait fracasse fille pas talent sera seront cocus	negatif
heures enseignement classes travaux	mixte
art humilier soi	negatif
bien plus mais loin avec souvenir amer hautaine	positif
mais heureusement que exprime clair milieu tout cela 	positif
pour rien comme toujours	negatif
parole sous A quoi 	autre
pas vole haut affligeant	negatif
“ entre blagues sur 	mixte
elle fermer gueule oui	positif
marine pen incapable parler programme pour affligeant	negatif
confirme propose rien bon pour pays suis avec 	negatif
pense allait bouffer mais rigolait comme avenir faisait rire 	autre
comment plus millions peuvent trouver que marine pen sait	mixte
face programme plus plus sortie euro catastrophe 	autre
suis heureux que combats 	mixte
coup chapeau nerfs acier respect impossible imaginer ans	positif
marine pen vient vraiment	autre
merci confirmer que votera	positif
avoir telles statistiques autant buts 	autre
veux trop rattache politique comme 	positif
bonne nuit tous sauf marine	autre
que aurait assassine gamine qui marre propres pics tout moisies	autre
bilan agressif marine pen qui attaque tout sais maintenant plus sur programme	positif
bon pas tout mais sonne heures	negatif
fera ensemble compte sur vous	autre
justice par marine pen 	autre
aime aussi mais bienveillante fraternelle	positif
pour peine expliquer programme expliquer officiel politique 	negatif
avec micron aspirant botte 	autre
genre voyant sont marine vive	autre
juste magique carte blanche fait plouf	positif
elle marine avec gestes	positif
petit qui pris lors	mixte
elle folle voterai pas blanc voterai contre officiel profit 	negatif
massacre peur finisse par trouver force toucher	negatif
fait hop sort pareil pour crois pas trop 	negatif
vrai faut voter sans 	mixte
montre vraiment que mal	autre
avec niveau risque faire monter abstention sait cela profite	negatif
mis sanglante choix fait suis marche 	mixte
bon sors fumer clope peux plus	mixte
vote ouverture bureaux vote	autre
« suis favorable baisse nombre parlementaires baisser 	mixte
soir avez majestueux bravo	positif
posture bien plus que marine	mixte
tel pour affronter part formule sujet officiel nulle	negatif
regrette pen mais mieux que vous	autre
parti affaires mieux que vote 	mixte
vraiment femme insupportable pas possible	negatif
officiel oui cote projet autre celui 	mixte
niveau argumentation pen 	autre
sur terrorisme mauvaise	negatif
euh part vrille pen	autre
essais femme avec marine 	mixte
galimatias perlimpinpin merci mettre honneur jolis mots langue	positif
rassurez moi plus personne faut mettre 	mixte
carte blanche pen que pour 😯	negatif
affrontement haineux once respect pauvre ans par maternelle 	negatif
cherche pousser bout est	autre
elle met tellement mal aise	positif
officiel faites quelque chose	autre
toute seule tout long revoir	autre
officiel euro oblige sort 	mixte
mieux que toi aussi mieux que ✌ vote blanc 	mixte
emplois pourront remplaces par machines 	autre
pour blaireau arrogant insulte alors pour qui 	negatif
marine avec caricatures	positif
minute marine pen serait partie sniffer	mixte
beau sur soir 	positif
sort bon arrive tout faire par moi aussi sais marine 	negatif
officiel ont avec pourri	autre
trop baver part 	positif
soyez courtois avait tout heure	autre
instant sur exclame sur insultes encontre fromage raclette remonte nez	mixte
belle preuve que existe que contre invente aucune proposition 	positif
carte blanche pen moche vilain merci pen	positif
chaque fois que officiel question 	autre
sens que baby mettre baba rhum 😂	positif
oui bien compris tant que banquier affaire politique longues 	autre
officiel jeux sont fait moment hein	autre
mieux que top	positif
marine consommer crack 😂 grave	positif
officiel ferait bel attelage avec personne 	autre
retenir prochain sera par femme par 	mixte
mais mais suffit mais fait claquer fouet touchant les	mixte
sans coup comme 	mixte
mac voulez revenir franc ligne 	mixte
avez bon mais moi restez porte par 	autre
avec sont incapables hauteur gouvernance sans 	positif
faut revenir franc oui proposez sortie euro non	mixte
pourra lire arrogante suffisant	positif
finalement marine pen pas	negatif
officiel effectivement premier ministre fait	mixte
absents hormis culture 	mixte
aime beaucoup coup parasite	positif
croire gros mythomane	negatif
mais non qui plante bras fesses 	positif
officiel aurait voir avant sur 	autre
pense pas puisse faire avec taux abstention 	negatif
heureux miserai pas centime 	negatif
affirme connaissait personne revanche eux ont air bien 	positif
ans que vie	mixte
avoir rester calme soir aurais mal 	positif
plein plombs juste	autre
mais oui aucun 	autre
institutions mieux que vous	autre
toujours oublie minutes top chrono bah beau	positif
regrette marine mieux que 😄	mixte
bien tout cas gens qui gueulaient contre loi travail mais qui sucent maintenant	autre
bravo 😍 self folle mourrait envie lui gueule	positif
pen jamais voulait pour pays	negatif
minute sur culture	autre
pauvre hui pourquoi autres ont niveau avec pen 	mixte
compagnie charge publie concert paris sur → 	mixte
mais folle putain	negatif
pourquoi fait penser	mixte
bulle ensemble spectateurs que aucun possible	positif
merci mais blagues chargent par contre pouviez parler serait mieux 	positif
mais vais voir vient gagne	autre
avec feuilles avec trois fois rien fournit meilleur 	autre
crache bave sur officiel fric banque pouvoir marionnette	autre
avais tente jeu boire chaque propos pen serais coma	negatif
officiel mieux que vous	autre
pas reproche que fait hein que	negatif
loi alors licencie facilement 😂	positif
pour parler questions sommes totalement 	negatif
parasite faut respecter femmes	autre
veux pas profiteurs refuse esprit haine	negatif
bon bah victoire par	mixte
jean marine pen soir	positif
pas marine pen marine pen pas 🤜	negatif
pen croit fais que attaquer sans rien explique	positif
marine rate coche fait hauteur 	positif
journaliste avez sec min	mixte
marine pen aussi nulle que tour qui reste	negatif
mais sur plateau fermez lui claque horrible	autre
elle vraiment ouf	positif
souci faire avec sures	negatif
bien chaque bobos	mixte
officiel suivis mais moment	mixte
elle sort rien jours venir sortir truc russes	positif
mais enfin parle peu lieu sur vie 	negatif
vite pen qui fait marabout	autre
plus complet heu comment heu refaire alors programme	autre
avait raison plus 	autre
est vient vraiment mot	negatif
chronique mira mai inter 	mixte
eux sont pire 	mixte
marine pen sera par femme 	mixte
parasite alors bien trouve	mixte
lance accusations trop facile 	positif
plus meilleure concentration intellectuelle 	positif
elle parle justice mais bien partie qui mis examen	positif
vous fait attaquer mais fallait bien combler que laissait programme inexistant	positif
faut abolir carte scolaire 	autre
comme pas programme mais juste bah tour	negatif
oublie carte blanche	autre
insoumis ont bon sens 	mixte
mina jure mais largement mieux foutent programme etc 	autre
escape mois juillet 	autre
bon sujets beaucoup sang face personne provocatrice 	mixte
politique reviens aime qui fait cela qui pays sorte vive 	negatif
avez raison aime aime 	positif
officiel aucun projet parti contrairement qui pioche gauche centre 	autre
attaque marine sort baguette crie 	positif
origine mais fait quoi rien 	autre
personne pourra plus cacher faux arguments pour autre pas voter est	negatif
entre pense par avec talent passe vite rayon 	mixte
pas termine que internet crachent venin sur via 	negatif
prisons sont surcharger prisons	autre
cas marine pen air heureuse	positif
euh sketch vient faire parle avis	negatif
elle entrain manger tous cru petit vrai hors mis torche	positif
aimerais partager optimisme 	mixte
effets hausse actions suite sur autres antalgiques	autre
euh marine elle spectacle sans consistance variations tons gesticulations	positif
voir avec sourire abusif est	autre
oui merveilleux tous assez malins 	mixte
qui quelque chose soir 	positif
belle avec autre	positif
gagnant celui face	mixte
jure que issue encore vais aller lamas 	mixte
officiel veux savoir combien questions quoi 	autre
bonne prestation face pen 	autre
fouilleuse pourtant jamais participe quelconque sur cheval 	autre
perlimpinpin meilleure expression	autre
internez vieille folle	mixte
officiel encore train calomnier lieu proposer projet	autre
officiel autres val 	mixte
mais grave gars jamais choses veux que celle qui soit jamais	positif
veut tout bouffonne bonne rien 	mixte
bravo avez fort avez prouve que serez hauteur partir soir 	positif
sert que sache pro 	autre
couper aura plus rien vont accuser comme	negatif
moi aussi veux tellement voir heureux pleurer joie quant vont 	positif
gauche classiques frottent mains soir montre toutes limites	positif
avec toi soir message fort petit jeu 	positif
bon ont compris	mixte
moi jamais menti courage tenir engagements 	positif
parasite qualificatif lui ravir	autre
sera par femme sera moi 	autre
les ose tout est	autre
aurai tellement aime 	positif
seuls niveau pour face soir regret	negatif
promet sera soumis finance	mixte
bien joue mon	autre
quelle sera prochaine 😂	positif
sinon vraiment bien beau visuellement	positif
pen presse moqueurs via 	mixte
bonne chance choix spectacle burlesque pitoyable vulgaire	positif
allez bonne nuit troll 	autre
une vraie gamine	autre
propos plus que ceux pen bistrot gars tournent vin blanc petit matin	autre
officiel monsieur raison aucun programme part attaquer 	positif
tour parlant comme futur 	autre
que sur situation jeunes autistes tout fait exact 	autre
aucun gagnant show pauvre zone confort voulait	autre
pen rentrez chez famille tuyau image pur	negatif
marine pen tellement	mixte
sur question institutions	mixte
pas officiel que passe sous bureau	negatif
officiel mieux que facho toi	autre
officiel avait pas compris avait seulement tuer	negatif
avec sang pareil certain pratique yoga	mixte
est sont personne 	mixte
marine pen gros 😂 	negatif
pas malheureuse avoir car abstentionnistes changeront avis 	negatif
encore plus respect pour sortie envie voir notre	negatif
les moutons ont suivi entre loups favoris allez voter 	mixte
voulez fabrication pour large que « vote » projet	negatif
nourrit politiques gauche	mixte
meilleur tristesse mal pour 	negatif
sais pas qui lamine marine pen soir toute seule risible	negatif
avec musique mieux 	autre
lamentable prestation qui arbore biens meilleures performances lorsqu pure	negatif
bien responsable perte ans	mixte
soir comme toujours ✌	positif
parlent jamais animaux 🙄	mixte
rigolo petit pays mais agit confier petit pays presque insignifiant 	negatif
celui faut non	autre
peut que suis oui 	mixte
mais homme invitez laissez quatre avant 	mixte
quatre personnes trop personne qui manque 	positif
parasite honte vous	negatif
uni contre via	mixte
besoin bavoir officiel	mixte
vraiment avant voter pour	negatif
soir meilleur rempart contre marine pen merci elle	positif
subir ans serait tragique qui peut changer vie	mixte
peut plus serein face attaques encore mieux que soir	positif
officiel euh besoin ambulance marine clinique histoire reposer peu hein	negatif
sommes pas malversations 	negatif
que aime pas fait job face proche votez 	negatif
elle conclu par fiches est	positif
marine pire gamine	autre
incroyable pas pouvoir point vue sans faire insulter	negatif
pen reste avocate sans aucune pour gouverner heureusement pour	negatif
pour nerfs acier face injures	negatif
pen affligeante aime programme qui pense feront mal mais emporte soir 	positif
oui cause que raciste	negatif
officiel politique soir 	positif
comment lui parle avec autant calme faisant conclusion	mixte
lamentable mieux que 	autre
favorable baisser nombre parlementaires proportionnelle	autre
officiel sur plateau avance contre 	autre
attaquant balance tout sauf cuisine passe soir	positif
fais attention toi officiel les	autre
tellement long que impression que commence entre	mixte
qui plus convaincant	mixte
comment fait peine pen trop	positif
officiel bien soir qui	positif
elle essaie lui faire croire sur lui 😂 mais ans quoi	negatif
quel manque professionnalisme	autre
que marches aurait apporter plus fiches 😂	positif
bon alors peux avoir euros louis sesterces 	mixte
soir plus que jamais fier voter	positif
non peut pas changer autant pense que pouvais que bouger 	negatif
regrettez que soit pas tour hauteur vue prestance manquent 	negatif
femme arrive mettre stress ose pas imaginer ans	negatif
surtout faites beaux 	positif
honteux pour veux aucun aucune confiance avenir avec eux 	negatif
jusqu non marine non	mixte
changera rien sur scrutin mais confirme officiel 	mixte
appelle peuple combattre genre plagia 	mixte
pour mais match mauvaise 	negatif
plus enseignement mal plus misons tout sur culture	mixte
termine bataille rue	autre
comment peut encore proposer vote blanc abstention face avoir cela 	autre
que soit comme voir que rien change	positif
blague ouais programmes sauf que tien vierge sourire chaque	mixte
avez choisi impensable face choix sont sur 	autre
pas mis niveau bien bas toujours avec apaisement votre	negatif
aurai moins invectives part camps pour part officiel cran	negatif
comment pen peut parler moralisation vie politique refuse juges	autre
officiel plus compter nombre accusations sans 	autre
minute bonne nuit 	autre
« marche » vers sociale 	autre
gouverne par ans vouloir temps	autre
avez bellement tenu louve lacunes situent sur islamisme 	mixte
putain mais fermez lui gueule aucun respect quoi servent ont trouille quoi 	negatif
non non annule tout 	autre
hockey bonne pour passer temps 	negatif
oui attaques sous ceinture 	positif
traverse crise aurai courage engagements	positif
oui cause que film justice navet ministre 	mixte
qui tout impose tempo	autre
alors vais pour simple avec noirs arabes	negatif
fraise fruit saison vitamine 	autre
renouveau marche avec royal	mixte
votre qui jacte mais part esquiver questions rejeter faute sur pas chose pertinent	negatif
visiblement aurait face 	mixte
gueule sur que pense 	mixte
avec suffrage universel comme aurait	mixte
faut que venue avec projet ambitieuse	autre
postes bien mieux travail	autre
meilleure attaque surtout programme question inexistant 🥊	positif
basculement marine pen manque sang aura raison 	autre
elle ahurissant suis comment quelconque parti vraie folle	positif
oui connu prouve	autre
officiel fut ministre affaires fou 😜	autre
honore mali travers 	autre
avis gagnant sans aucun	mixte
oublie pas justement moyens soutenir projets 	negatif
sans qui fout atterre 	mixte
fume quoi marine alors narine 	mixte
avoir jamais insulte 	mixte
objectivement rien part rire comme surexcite relance avez pris 	autre
marche suis professionnelle que jamais voterai pour haine contre autre 	negatif
marine pen bac	mixte
victoire bravo fait job avec classe 	positif
vous croyez vraiment que que foutre que plus 	autre
avais petit pas aller sert rien avec eux 	negatif
bravo avez loin meilleur face folle 	positif
face face face plus prier	autre
ouvertement chasser hors part respecte 	mixte
lui qui lui ressort tout bout champs alors qui parle passe	mixte
alors choisissez peste	mixte
ambulance vient arriver pour asile	negatif
quartier rouge paris ville gauche 	negatif
pense que pouvait clef fermer porte laisser pouvoir	mixte
comme jamais propre monnaie	autre
minutes trente suffisent traiter tablier	mixte
moi fait compliment 	autre
elle essaye trop haut	positif
tellement pas chance peux vote mais sont nuls sont 	negatif
officiel rencontre intelligence seule 	mixte
aussi nul que autre	negatif
envie faire programme	negatif
tiers nombre parlementaires avec proportionnelle 	autre
clairement que innocente sur coup 	autre
que veux vaut beaucoup mieux que	autre
meilleure attaque hein officiel parle car programme flou	positif
transition trappe reparle 	autre
peux pas abstenir voter blanc	negatif
pour transformer compte sur toi tel point plus savoir habite 	negatif
bienvenue qui rejoint tant bonne chance toi 	positif
mais amour plus important excusez moi	positif
toute vie parle comme merci	positif
officiel contre match retour	mixte
maison connu une	autre
plat ventre permanence banques 	positif
peut bonne partie ceux ayant vote tour sont train regretter	autre
pen parasite que brillante officiel	mixte
non mais plus gros perturbateur 	negatif
mieux que plus belle	positif
les histoires honteux pas mais plus acharnement 	negatif
barres pro allez calmez votre	mixte
officiel euro franc sesterce 	autre
plat ventre placement	positif
fausses factures sont bien	autre
marine pen multiplie avec via	mixte
pen sur presse via	mixte
autre mal mal 	autre
mais faites pour parler sans ajouter argument faites juste ferais pas 	negatif
pas pour psychiatrie vient franchi heures fait avancer science ans 	negatif
pense pires tour	mixte
messieurs sera quelques jours 	autre
est marine pen convaincu pour procurer bulletin vote 👇 	negatif
fait journalistes font plantes vertes 😳	negatif
humilie comme folle honte pour pas 	negatif
soit soit euro soit nazisme soit ultra soit pas soit marche euh non merci insoumis	negatif
officiel par sujet pas pas toujours 	negatif
vous imaginez gars mettent fin fait gouvernement ensemble 	negatif
est qui veut parle jamais programme attaques bas	positif
voici que appelait mai pas vote blanc pas abstention 	negatif
bravo avoir car ici 	positif
temps compte officiel questions 	autre
finir gare toussa	negatif
qui avez invente eau peut	positif
triste spectacle officiel beuglant inepties convaincra ceux qui veulent appeler voter 	autre
compare comprenez rien	mixte
bilan avait raison	mixte
bravo prouve que arguments sont plus fort que stigmatisation pour lutter contre	negatif
alors avez trouve comment	mixte
pour cela sera avec vision	negatif
elle fout gueule mais minable	positif
officiel pen fait illusion sur sur partie couilles	negatif
aux gens qui que voter voter soir reverra pas prochaines	negatif
marine compte riant coupant parole autres	mixte
pen soumise petit clin aux	autre
officiel panier monnaies qui revient toujours tue euro 	mixte
connais bien fonctionnement justice avocate vais aurez pas	negatif
enjeu par faute qui savez	autre
peut prix paix pour avoir calme jusqu bout bravo lui 	negatif
remettez vieux moins rigolait 	autre
immense soutenir autant plus remettons marche 	autre
peux plus mot bouche qui sait pas 	negatif
super avec qui refuse voir tumeur cerveau	positif
non chignons que propose pour sont 	negatif
aucun ont carrure seul possible pauvre abstention	autre
franchement marine pen est	mixte
elle revanche avec fiches	positif
elle pote bourre mat	positif
bravo clair juste face bluffeuse agressive menteuse	positif
comme arguments chez retraites 	autre
bas clair faut battre imposer cohabitation 	autre
officiel passe temps parler que programme 	mixte
soir avez largement gagne bravo 	positif
pour compare est	negatif
chaque attaque croit oblige justifier	positif
sinon personne encore fait entre pipeau tout essaye	mixte
elle compte point elle	positif
les sont heureux 	mixte
comme beaucoup crois	autre
votre place clope allez boire coup	autre
elle quoi pen 😅	positif
peuple continuera souffrir payer pour classe politique lamentable caricaturale	negatif
bonne nuit tous ceux qui supportent plus club parle bien sur olympique 	autre
avez pas projet pour sanction finale face marine pen qui loupe son	negatif
non elle veut	positif
marine pen enfant	autre
objectivement marine vient barre gencives	negatif
inscrite barreau quitte pour 	negatif
sens pas racistes mais parents sont arrive sans papiers 	negatif
pas futur taper sur autres mais rassembler proposer projet pour tous	negatif
pour pas besoin salir comment fait pour calme face 	negatif
pas politique mais abat politique 😂 vraie 	negatif
raison pont alignant est	mixte
elle mise examen	positif
sort mettant pen comme	autre
bon courage souhaite vraiment que trouverez solution 	positif
arrive avant tour serait pas serait place	negatif
pouvait responsable fermeture bouche marine	mixte
puissance fric voterons marine masse avec faisons barrage	mixte
est presque comme essaie toucher gens mais par contre sans	autre
soir pas niveau pour sont 	negatif
bravo belle conclusion	positif
carte blanche pour parler projet pour parle que 	negatif
conclusion que verre lui 	autre
visiblement officiel avait tous sauf celui programme	mixte
changement plus jamais mets les	positif
suis seul trouver que marine pen refuse car rien gaminerie 	mixte
autre cruche parle coupe toute seule filtre connerie marche bien ψ	mixte
calme face rires nerveux marine clairement fin avec rires 😂	negatif
exploit avoir calme	autre
seule critiquer sur programme	autre
entre seul choix officiel 	mixte
mais aussi important que parler parle avenir 	autre
pourquoi certains retraites travail ans touchent souvent moins que ceux qui ont jamais cotise journal	autre
ouais pour visa sera tiers 	negatif
putain mais fermer gueule ferme gueule	negatif
avait cela plusieurs mois connaissons tous malheureusement 	positif
figaro vaut beaucoup mieux que 	autre
bizarrement beaucoup moins partisans	negatif
bon bah officiel psychologiquement plus par total sens monter 	autre
face tant part caillou gagnerait 	mixte
mieux que parce que tout 👏	positif
sont contents contribuables 	autre
qui fait coup pub pour bouquin alors plein con	negatif
touche vraiment bien avance	autre
suite logique programme sur 😂 pipeau 	positif
trop scolaire marine cherchez cherchez 	positif
mai plus angoissants vie	autre
aucune mention nouvelle	autre
ceux veulent voter ont compris part faire sur plateau rien sait rien faire	negatif
ils soulages journalistes	mixte
sera merci officiel	positif
surtout mieux que sur lui 	autre
fait soir marine pen fait sous marine	positif
vous aura imiter quoi	mixte
psychopathe imbu personne pouvoir	autre
les port chantent encore 	positif
🔴 meilleurs sur par ici 	autre
comme bon pro esquivez sujet attaquez autre 	positif
petit avec marche	mixte
qui plus convaincant sans opinion	autre
officiel temps libre pour parler programme taper sur pas programme	negatif
tue aller avoue que paris plus secrets entre 	autre
que soit qui sortent cas bon 	autre
sais pas ultra pour cela alors mal compris 	negatif
tour semble confirmer consommation excessive alcool	mixte
air bien manque plus respecte voeux pour	negatif
bien guignols qui papotent actuellement	autre
sur effet pen qui fait	mixte
les falsifications sur actes passes sont par bravo tous	positif
pourquoi forcer choisir moins pire comptable quinquennat qui annonce	mixte
“ carte blanche salissez 	mixte
par classes fois plus bravo parles 	positif
officiel outrances meilleur elle	positif
voici quoi programme insoumis semblable non seulement arrogante 	positif
ouais non mais suis trop espoir suis plus que 	positif
trouve gars qui pense que pas bouffe 	negatif
elle grave saint	positif
bah sur offensive trouve fin plombs	negatif
ouvre bouche chut 	mixte
bah suis sur national 🤗 man show 	autre
euro sous gouvernement	autre
faisant genre compte aller avec pays impossible avec 	negatif
penser que femme voix	autre
savait mais atteint sommets 	mixte
plat ventre non suis twister	positif
aucun bon pour mais pen pire ruine faut tout prix	negatif
tout suite sur 	mixte
sens comme venais voir film louis officiel vraie actrice mal	autre
qui commence faire avoir propre jeu	negatif
officiel vient offrir victoire soir avait face lui aurait trouve bons mots	positif
bien sur pas salaire pour moment	negatif
juste pour finir journalistes ont pas tenir soir bien pour inutile fait	negatif
mauvais sort marocain	negatif
merci vous avez fait 	positif
carte blanche crame parle bilan socialistes	autre
mais non aimons tous allons lui antan restant amoureux pays	negatif
moi que avec avec mais bizarre voit jamais nulle part	negatif
journaliste marine comment comptez femme ans	autre
moi suis loup loup garou	autre
minutes sur blague	autre
peut mieux que aussi	mixte
maintenant sait viennent rumeurs fantasmes banquier ouvrier ami	mixte
nouvelle annonce fort prix contact sur 	mixte
marine avant non	autre
allumer pas avait sur fallait	negatif
gagnant sur canal	mixte
comptait comme ceci	autre
bah que avez fait amis	autre
soutien marine pen supervise collaboration 	autre
toute sera par femme sera moi marine pen 	mixte
sport mec qui rencontre peut plus rien faire marque contre camp	negatif
foi mieux que toi aussi 	autre
sinon question cumul parlementaires brasse air pour pas	negatif
micron toujours que marine pen pas projet pas vrai pour autant	negatif
renseignez peu gens mentis tout long sur sur ministre sur propos etc	negatif
sujet libre rajoute que faute immigres 	autre
usa chambre vote pour paralysie foot 	negatif
couper couille que voir ans pays	negatif
coupes commence mal 	autre
montrez moi qui change chez alors merci 	positif
vous faites rire merci car sinon pleurerai crois	positif
moment sur apologie prestation ami	mixte
que planification absente soir aucune vision alors 	positif
minutes conclusion minutes parler lui mais bouffonne	autre
vieille tante trop 	positif
parasite aurai pas trouve mieux excellent	negatif
nombre abonnes avez convaincu maintenant jouer compte sur 😎	mixte
avait comprit mec	mixte
inspire plans coupe	autre
