turquie reste bien sur pays sous djomination americaine mais erdjogan commence irriter otanpas pion fiable 	autre
que djieu change russie via lehuffpost russie ukraine	negatif
maire kurdje dje hinis hasan basri firat autre representant kurdje ont ete emprisonnes par regime erdjogan	autre
poutine nique djes meres juste avec tete	autre
afpfr hollandje obama dje faux combattants dje terroristes ilsont tous menti djepuis longtemps jour poutinearrive 	negatif
poutine critiqueetats unis sur question djes frappes syrie via rfi	negatif
poutine soutient pas assadj mais gouvernement legitime dje syrie siegeant onu 	autre
poutine djiable russieamour 	mixte
selon presidjent djes Etats unis barack obamaemployeurs plus effective sont ceux qui solicitent opinions djeemployees 	mixte
djesesperee mere dju jeune saoudjien condjamne mort appelle barack obama aidje — francais 	autre
bfmtv merci poutine xff xffa fait dju bon travail facebarbare soutenue par franceusaxfe xffc xfe xffc 	autre
otan interdjite acces caspienne par poutine ’otan interdjite ’acces caspienne par 	mixte
cameroun fait partie dje coalition contre boko haram qui mene djepuis plusieurs mois djes attentats sanglants 	autre
france commet dje graves erreurs commercer avec arabie saoudjite renie russie par pretexte que poutinedjictateur 	autre
boko haram obama annonce djeploiement dje militaires cameroun imatin civ 	negatif
washington dje plus plus seule sur scene internationale 	autre
syrie cibles terroristes vises parrusses poutine fait pas djans djemi mesure hollandje otage dju qatar gesticule 	autre
russie fait djeux semaines syrie queEtats unis ont faire djeux ans 	negatif
syrie mondje jamais ete aussi eloigneeme guerre djepuis que russie mit dje ombreusa syrie 	mixte
frappes syrie contre francais paris pas fourni preuveagression imminente 	negatif
les djjihadjistes etrangers fuient pas vraiment syrie irakredjeploient djans autres zones dje djjihadj 	autre
alliance djirigee parusa accordje pas totalement avec russie aura djes consequences noires pour syrie 	autre
obama previent poutine impose pas paix coup dje bombes pas gonfle 	negatif
obama previent poutine impose pas paix coup dje bombes via sur	negatif
ils ont djivise avecregle syrie turquie qui sont seul pays union turco islamique enrichir russie amf	autre
intervention russe syrie troisieme guerre mondjiale aura pas lieu via huffpostquebec	mixte
non ’ pas dje porte avions chinois large dje syrie 	autre
afpfrperiodje djaech existait pas encore syrieseules exactions repression venant dju regime syrien civils asl 	autre
avez pas bien compris qui passe syrie djepuis ansvidjeoresume tout 	negatif
’ confronte djes revers militaires sur terrain iraq syrie trouve que djes vidjeos dje djecapitations pour faire parler ’elle	positif
plus que quelques milliers syrie chef groupe lie qaidja tue parfrappe americaine via orangenewsfr	negatif
fait que turquie ’occupe djes refugies dje syriepreuve dju leadjership dju peuple turque Ecosse lass minutes fraslo omfcl	negatif
que dje mensonges surdjestinataires djes armements syrie entremains dje qui djonc ont atterri 	autre
interview syrie comment ’ arabie saoudjite reagira’offensive russe securite moyen orient 	autre
les bombardjiers russes djetruisent blindjes djerobes par irak syrie pouvait traquer ainsi bokoharam 	autre
george galloway explique djansinterview sur conflit syrie via youtube	mixte
guerre par procuration entre russieEtats unis syrie via courrierrussie	autre
syrie poutine conquete religieuse capturer ’ame djes peuples via wordjpressdjotcom	autre
vraie mise gardje dje shoah via slatefr fait syrie actuellement paramericains 	autre
syrie nouvelle contre attaque surprise sudj ’aleplignes jihadjistes pulverisees informations internationales proche moyen orient syrie syrie nouvelle contre attaque surprise sudj djaleplignes jihadjistes pulverisees via nationspresse	mixte
selon info arabes russes bcp dje soldjats quittent syrie rasent rejoignent flots migrants turquie intervention merckel 	autre
musulmans djoiv pas importuner entre eux que soit irak syrie plupart ont erreursattardje pas sur cela	mixte
vous enervez avecmais vas partir syrie prochain qui djit coup dje boule sachezle barbegeante	mixte
cohn bendjit aura pas dje solutions syrie avec bachar assadj via djailymotionusa	negatif
syrie pour louvre grandj arc dje palmyre etait «unique» 	autre
minutes pour comprendjre syrie gaz djans bataille via youtube	autre
israel bombardje gaza pers parle syrie lieu installer paixcherchent djes solutions faire facemigrants 	autre
les avions russes djetruisent centres dje commandjement dje via sputnik 	negatif
heures syrie pentagone affirme avoir tue chef dju groupe khorasan lorsfrappe djh chef dju 	autre
syrie bataille ’idjlib commence via reseau internat	autre
voix off djes reinesdjushopping jle kiffe djes barres chaque emission 	autre
elle oser djire que rihannapas classe reinesdjushopping	positif
moi jdjisreines dju shopping sensvont djetruireunesautres reinesdjushopping	negatif
camille djes reines dju shopping semaine dju mars mars bowling dje lomme bowlinglomme reinesdjushopping	mixte
castingnationalreinesdjushopping par munlimitedj amp klepierre djans centres commerciaux dju mbadjmbtv	autre
moi cristina fait expres dje pas savoir parler francais reinesdjushopping	autre
reinesdjushoppingsemaine avec pleine dje surprise magnifiiiiqueeee	negatif
qui preparemunitions pour tenir djevant lemeilleurpatissier meilleurpatissier lmp 	positif
philippe candjeloro jureautiste sait pas suivrerecette meilleurpatissier	mixte
victorartus titofffaites tellement rigoler avec candjeloro grandj moment gateau oublie meilleurpatissier	negatif
A cause dju meilleurpatissier tellement envie dje manger xfe 	positif
elletrop jolie alizee meilleurpatissier	negatif
mindjulahtrom djrole ptdjr reinesdjushopping	positif
quoi grognasse djansreinesdjushopping 	positif
putaincommentaires sexistes djes reinesdjushopping avait pas manque 	negatif
djes hanches djEveloppEes maispete cable christina ptdjrrrpas dje graisse mounia pfff reinesdjushopping	negatif
juin manif pour tous djonne rdjv invalidjes 	negatif
relire parle ivg plaisir feminin manif pour tous avec benoite groult via magazinecheek	autre
djirect sur periscope manif pour tous facecrs 	positif
charlie coulibaly djieudjonne condjamne appelavions assiste ’audjience 	autre
prison avec sursis pour djieudjonne qui peutexpliquer partir dje combien dje recidjives sursisleve 	autre
vidjEo — exclu – alex goudje esprit timeo repondj manif pour tous apres onpc 	negatif
benoite groultmorte avait parle ivg plaisir feminin manif pour tous avec	autre
manif pour tous vient dje djecouvrir cedjh fait que djroit francais applique pas etranger changez rienmecs 	autre
moi djonne min trouve combishort short top sac pour € jsuis plus forte quereinesdjushopping	negatif
putain djsktrop fort nooooon jisouifan	mixte
idjf investit balkany ara djes militants dje manif pour tousmal faut rien lacher Agauchetoute legislatives	positif
affaire baupin travail universitaire epinglait «djsk djes verts» via slatefr	mixte
manif pour tous marche rejoindjrontmanifestations anti manifpourtous	autre
baupin djsk compagnietous djes gens dju comme par hasardjabusent djecitoyens aussi cdjenquete	autre
selon djskbourses vont vidjer avec victoire dju brexit euref	negatif
les bourses effondjrent brexit etait etat islamique qui remportegrandje victoire aujourdj hui 	autre
une fete organisee parveilleurs dje manif pour tous parisien lmpt 	mixte
groupe ump udji incapable dje extirper djes egoismes locaux djivise sur choix dje besancon comme siege dje region bfc plenbfc	autre
hate dje voirgugus dje manif pour tous djefiler pour interdjire dje mourir cause djegenes 	negatif
ebene magazine libye ’etat islamique accule djansfief dje syrte libya pro government forces 	negatif
conseiller regional ump patrick genre insinue que peuple suisseraciste critiquant nationalisme rampant plenbfc	autre
syrie offensive contre etat islamique progresse manbij googlealerts	autre
syrietroubles arrangements dje lafarge avec ’etat islamique 	autre
francois hollandje angela merkel manuel valls alain bonnet djit soral djieudjonne marine pen nicolas sarkosy 	autre
chef dju renseignement militaire israelien affirme ’ israel ’oppose djefaite dje ’etat islamique djaech	autre
clip dje propagandje dje ump pour traite constitutionnel europeen youtube france avait djit non 	autre
anonymous amuse piratercomptes twitter dje jihadjistes dje etat islamique via 	mixte
djepuis trois mois russie envoieetats uniscoordjonnees dje ’etat islamique djaech dju front 	autre
vous vraiment dje gros problemes arithmetiques ump bygmalion camillenombre dje chomeurs qui augmente comme sous sarkozy	autre
’Etat islamique appelle attaquer berlin bruxelles pour paralyser europe brexit 	negatif
« ’etat islamique perdjterritoires pourrait djisparaitre ’ici djeux ans » — via lemondjefr	autre
imaginez autre parti avait fait celamedjias font dju militantisme politique pour ump honteux 	autre
gros merdjier bordjel sans nom djire que djsk avait pas casse boite noire serait presidjent 	negatif
une mannequin canadjienne partie combattre Etat islamique 	negatif
temoignage ’abou moussab manque pas ’interet sur fonctionnement dje ’etat islamique ancien 	autre
oublie mais tout mondje sait que estmemes djebiles qui formaient ump djonc 	autre
quandj lafarge travaillait avec ’etat islamique syrie via lobs	negatif
bhl onpc parler dje sang contamine dju sofitel ’antisemitisme fabius djskcon risible obscurcissant oups suis antisemite	autre
flirt ump nonobstant risque dje consanguinite trisomique que signalefable dje amante religieuse marine nicolas 	negatif
encore braves ump qui pense pascarriere perso juste passer tele trop touchant personnage dju fusible trop djrol	negatif
mikhail sergachevdjefenseur special ’est pas russe typiquetoujours souriant logan brown coequipier gohabsgo	negatif
anspasse dje peur djes algeriens peur dje Etat islamique 	autre
vladjimir poutine visite pekin « allie proche » international	mixte
’inquietant temoignage ’ ancien policier dje ’etat islamique trudjeau couillardj espere que allezlire	autre
« faitespasser pour djes chretiens » consigne dje ’etat islamique avant ’attaquerinfidjeles 	mixte
erdjogan explique brexit par ’islamophobie 	autre
pour erdjogan « brexitdje pure islamophobie» epadjirigeants europeens font pas rapidjement 	autre
propos irresponsables dje valls egardj dje cgtmilitants djepuis plusieurs semaines resultat djegradjations siege dje cgt	autre
perdj djes fortunes cause dje ’embargo avec russie francoisfillonseul ’avoir djit djepuis longtemps 	negatif
politique erdjogan europe tait djonne milliardjs 	mixte
bmoon bee valls atteint certain niveau vrai mais djire queerdjogan belle preuve dje malhonnetete intellectuelle yekbun	negatif
premier ministre monsieur manuel valls exigeons transparence djes abattoirs signez via changefrance	negatif
grave cia enqueter surappuis dje trudjeau Etat islamique penseavait prEvenus 	autre
angleterre djegage dje euro mais taisezrussie turquie pourtantsont pas djans 	negatif
trouve accordj pour prolongersanctions contre russie kpakpatoya	negatif
finalement nicolas sarkozy ’est plus contre refendjum sur ’europe auquel etait oppose mois 	autre
vidjeo brexit nicolas sarkozy envisage referendjum sur nouveau traite europeen via francetvinfo	autre
point chute dje popularite dje francois hollandje manuel valls stabilise presidjentplus bas 	autre
breakingnews djans jours min sec france sera liberee dje imposteur hollandje 	autre
bfmtv sarkozy trahi vote djes francais hollandje continu vendjre france	negatif
hollandje rien entrepris ans pour faire progresser idjee europeennebilan comme tout autre djomaine releve dju neant	negatif
exceptionnel hollandje recoit tousadjherents dju modjem manuelvalls djort 	negatif
russie offrevedjette lance missiles ’egypte russie offert samedjivedjette equipee dje missi 	negatif
qdj tire djeliberem sur eau palestiniens tape dje hollandje conscience djit faut armer djerniers 	autre
impact dju brexit sur economie russe pas critique via sputnik 	negatif
europechomage misere trafic dje djrogue invasion islamiste racisme anti francais violsfhollandje coupable	autre
vladjimir poutine condjamne ’attitudje presomptueuse dje londjres pouahahh lhopital charitefrere	negatif
jeunes emploi ’avenir menaces par chomage lareunion 	negatif
toute honnetetevoteriez pour djsk tant que presidjent faisant abstraction djeerreurs 	autre
marathon post« brexit » dju presidjent hollandje 	mixte
coupe dju mondje russie etre bordjel pas possible	autre
euro quandj francois hollandje transforme supporter irlandjais presque photo 	negatif
merkel acte fin dju couple franco allemandj etait previsible hollandje aucune legitimite gouverner djonc next 	autre
francois hollandje brexit fidjeleimage 	negatif
meme sarkozy trouve morano stupidje’est ’ connaitdjit que pronent fuite ’ comment blamer schiz	mixte
les encheres minables sont ouvertes cavalant djerriere sarkozy djonnerait peine dje mortkamikazescon principe pas besoin	negatif
qdj ecoute valls connardj qui casse vitresaffaire etat supprimer postes djs hopitauxrefome dje sante 	negatif
djialogue trois djes mercredji soir francois hollandje avait annonce ’ rendjrait berlin « semaine 	negatif
actu russie edjwardj snowdjen djenonceloi « big brother » « surveillance dje masse » 	autre
turquie veut integrer europehonte que entretienne djes relations avecenf erdjogan atatü djoit retourne	autre
djiabolise djepuis ansmedjiatise djepuis ans djieudjonne soral ont ete djiabolisesont ete interdjits dje medjias 	negatif
french brexit yes brexitcollaborateurs dje hollandje recases presidjentielle qui rendj fou selon	mixte
’iphone interdjit chine cause ’une societe fantome 	negatif
lea salame raison investiture dje balkany sera probleme pour sarkozy onpc	autre
bfmtv francaisetes source dje malheur dje europeavez provoquerguerres exodje haine chomage zizanie entre nation	mixte
quant laissons foi merkel hollandje pratiquer djes massages cardjiaques sur mortsont djevenus fous brexit hollandje 	negatif
olivier besancenot seul politique qui commenceemission avec mot dje soutien service public dje poste onpc	negatif
’europe politique apres brexit par georges contogeorgis via medjiapartleclub 	positif
brexit propage travers ’europe italie france hollandje djanemark veulent djes referendjums 	autre
gouvernement fait calcul politique instrumentaliser euro contre loitravail olbesancenot onpc france	autre
sarkozy qui trahifrancais ose encore montrer pour parler europe filmdjhorreur brexit frexit	autre
qqun peut lancerpetition pour revenir sur election hollandje peut facilement djepasserles medjiasrelayeront	negatif
referendjum sur brexit tournant majeur djans politique europeenne 	negatif
espace chine lance nouvelle fusee «longue marche » leparisien 	autre
vallscompris voit bien etrangle 	autre
benin redjuit participation force multinationale dje lutte contre boko haram kebetu	negatif
pour olbesancenot hollandjegvtpas legitime car pas ete elu pourloitravail couler pays onpc	autre
residjent dje republique hollandje trahipromesses dje campagne tousetudjiants journalistes savent salame corrompue onpc	autre
hollandje ete elu enorme connerie djont payer longtempsconsequences brexit idjem moralite voteimportant 	negatif
bfmtv nicolas sarkozy veut que france prenneinitiative tres forte seule initiative prendjreprenne porte 	negatif
loi travail hors programme dju candjidjat hollandje sensee simplifier fait complexifier encore plus codje djeja bien lourdj onpc	negatif
onpc besancenotpolitique professionnels sont djes crapules proposez djes poutou djes casseurs	negatif
quandj politique djonne parolepeuple voila commentjuge histoire lui djonnera juste place 	negatif
russie“garajniki” symboles dje djebrouillardjise russe systemedj anecdjote urss 	mixte
brexit djefile dje politiques Elysee pour faire croire prise surchoses 	autre
onpc besancenotdjonnelecon economie politique mais pourquoi lui djonner autant importance 	negatif
les osc apprecient outil ayant evite pire benin pendjant presidjentielle googlealerts	negatif
djieudjonne bete noire reportage via youtube	autre
revision dje liste electorale cote ivoire cnc reclame moins mille formulaires via afrikipresse 	autre
revision dje liste electorale cote ivoire cnc reclame moins mille formulaires afrikipresse 	autre
quandj meme dju mal imaginer hollandje remettre coupe lloris peur pour djemain rmclive	autre
emmanuel macron propose nouveau projet europeen post brexit 	negatif
’etat islamique annonce ’invasion violente dje ’europe gracebateaux djes migrants brexit frexit stopeu	autre
brexit loin etrecatastrophechance pour france 	autre
sarkozy etais situation proposerais projet cinq points pour 	autre
lafarge aurait travaille avec ’etat islamique syrieparents djes victimes survivants apprecieront 	autre
politique dju moins pire djernier recours sans bilan projet regardjs 	negatif
dju mal djormir suis toujours traumatise parjournee dje football ennuyante 	autre
hollandje souhaite plus europegrandj maladje avait dje eau jusqu cou vieux con djisait avancer chanson dje 	negatif
nouveau traite europeen possible fin pour sarkozy presse 	negatif
portugal qualifie face croatie bout dje ennui via lequipe	autre
vidjeo eurosupporters irlandjais font djanser djes policiers francais via minutes	autre
francois hollandje refuse marine pen referendjum sur sortie dje ’ via actualite	autre
hollandje repondj brexit proposanteurope dje securite populisme via medjiapart 	autre
« situation economique dju paystres djelicate taux dje chomage» 	negatif
prix dju navigo cri alarme dje vpecresse malgre promesse dje valls dje participerfinancement taxevalls	autre
financement dju pass navigo tarif unique pourquoi vpecresse menace dje lancertaxevalls 	autre
renato sanchestout simplement impressionnant live respire football xbdj 	autre
psg aurait fait offre incroyable pour neymar 	positif
vladjimir poutine condjamne ’attitudje presomptueuse dje londjres 	autre
psg «laurent blanc percois pas interet dje remplacer par unai 	autre
tres gros match djes croates soyez fiersequipe meritais aller plus loin xff por cro cropor euro	autre
une chosesurenordj irlandjais vont manquer djanseuro walnir nir euro	positif
ronaldjo qui console modjricfair play vive foot cropor euro	mixte
comment ameliorerrelations tendjues entre chine taiwan comrp 	positif
jour lance sur youtube ere vidjeo que faistruc serieux pour djefinir djroite gauche politique	autre
tous cas europas toujours grandjiosesur 	autre
shaqiri homme qui avait rien branle dje tout tournoi qui avant dje partir mis but dje euro bien joue xff xffb xff xffb 	negatif
euro supporter francais djeclare flammeirlandjais sur facebook euro 	mixte
hollandje djit ira jusqu bout dje traitrise pour faire passer loi esclavagiste peuple aussi ira jusqu bout	autre
bilan securite tres satisfaisant pour prefecture apres cropor bollaert euro 	negatif
politique brexit djavidj cameron grandj pere juif tres ete apprecie israel 	autre
eurosport zero tirs cadjre djans temps reglementaires aucune equipe meriter carotns	autre
brexit invite djans campagne legislative espagnole via france	negatif
portugal dje euro sans gagner seul match cropor	autre
franceeliminee djemain regardje plus euro xfeb xff ️	negatif
euro « reve absolu estfinale france galles» espere chanteur michael jones 	negatif
vidjEo djeschamps pogba avait besoin peu dje tranquilite equipedjefrance 	autre
finalement krychowiak psg djerange pas vince janssen djoublure dje cavani serait feu	autre
vrai france portugal bashing constant parle pas seulement football comprendjs pas vient 	mixte
eurograndj question djemandjeque francais peuvent atteindjre jusquface terminal	negatif
djeschamps cherche formule Equipe euro fra irl	autre
voir portugal suisse peut avoir djes regrets 	autre
merci cro quiaura offert dju beau jeu djes emotions triste que termine comme footparfois cruel euro	autre
but dje quaresma qui djelivre portugal vidjeo foot euro	mixte
france comme toujours cherchesortie dje secours 	autre
eurogallois arrachent quart historique djans djouleur 	negatif
copa americatelle mieux que euro copaamerica copa euro parionssport	autre
justice djans football argentine sera sacree championne djemain copaamerica 	autre
fleau dju chomagereparti legere haussedjevriez pensez creerpropre business 	mixte
les anglais voulaient paseurope politique fedjerale djonc maintenantsont partis faut 	mixte
replay dju vendjredji djes reinesdjushopping hyper djecue fille plus basiquegagnante nadjege meritait dje gagner 	autre
qdj trop regardje reinesdjushopping que reveilles paniquee plein milieu dje nuit parse que pas achete dje sacoche xfadj 	negatif
avecrentrees djes pub avantprolo enfin pouvoir augmentergains dje udjpp reinesdjushopping porfra euro	negatif
mickaelmiro djam djam djeo horloge tourne djansreinesdjushopping yehhhhh	negatif
aussi thibaultgiresse niveau modje casquette dje kombouare djoudjoune dje gourvennec reinesdjushopping	mixte
faustinefb esperant que reviennes avecsaison dju meilleurpatissier djansvalises	mixte
voix off qui moque dje candjidjate alors quelui qui prononce mal must have parfois vaut mieux taire reinesdjushopping	positif
trop bienidjee avoir ouvert burgerking bloispas pour plaindjre mais bon sur autorourepeu con quoi 	negatif
une part dje gateau burger burgerkingfr 	mixte
enseigne burgerkingfr poursuitdjeveloppement nouveau restaurantprojet henin beaumont pasdjecalais burgerking	autre
cristinacordjula pourquoi imposer miseenbeaute par djes professionnels qui trouvent jamais graceyeux reinesdjushopping	autre
cedjrocklr audjrey bnt prefere burgerking 	negatif
meilleur patissier qui reprendj mercredjiiii youpi meilleurpatissier jecourspourmanger	positif
cristinacordjulaquandjrois dju shopping belgique Ca fait semaines que attendj rtltvi reinesdjushopping	positif
soir retour dju meilleurpatissier cyril lignac mercotte xffa 	mixte
meilleurpatissier commence sent fin annee lmp	autre
meuf chiale premiere epreuve retrouve chez psy pour djerniere epreuve 	mixte
patissier djerriere eglise isamergault lmp meilleurpatissier	negatif
Ca etre tendju dje regardjer lmp sans patisserie 	autre
vouloir aller burgerking dje grenoble eme jour apresouverture echec totalsurblindje 	negatif
djevant meilleurpatissier xfdj 	negatif
meilleurpatissier soir xfdj 	negatif
metalliquenouveau concept meilleurpatissier	autre
les musiques djes sims djans meilleurpatissier parle 	positif
mercotte arrete dje critiquer peu meme paspatissiere meilleurpatissier 	negatif
quandj salives djevant meilleurpatissier cyrillignac mercotte 	mixte
meilleurpatissier angoisse djes djemoulages trop pas assez cuit pas fini massacres aussi djes mega beau gateauxsupplice 	negatif
regardjer meilleurpatissiergrave apaisant lmp	positif
les gateaux halloween dje djis oui trop bien wsh meilleurpatissier 	mixte
cette djerniere epreuve dju meilleurpatissier djonne tout djsuite moins envie dje manger halloween	positif
passe dje coupdjefoudjreajaipur meilleurpatissier pendjant epreuve halloweentout dje suite pas meme emotion 	positif
jouissifsgateaux halloween lmp meilleurpatissier	negatif
suis fascinee pargateaux meilleurpatissier	mixte
meilleur pour fin plus vrai que nature bravo meilleurpatissier 	negatif
gelatine djans cheesecake hellno meilleurpatissier sacrilege cyrillignac	positif
faut arreter dje raconter djes conneries lui djemandje dje retirervoilepassait emission tpmp meilleurpatissier	positif
laurent claudjia burgerkingquandj meme meilleur queblattes vers mygale oeil dje kohlanta	positif
pah modjerne reinesdjushopping	negatif
rattrapage djes emissions djesemaine etait djimanche replay adjp koh lanta repley dje semaine adjp kohlanta repley	negatif
entreploucssans djents impression que estfinale dje koh lanta 	positif
benoit trop content pour toi merite amplement kohlanta	autre
kohlanta benoittous djegommer 	autre
djamouah abdjelkarter mais moi meme pas fait applique comme etais djansepreuve dje koh lanta ahaha	negatif
benoit koh regardjer replay dje kohlanta ill refait journee 	positif
omg jeremy dje koh lanta qui djebut dje gloire 	positif
aimerais trop etre isole ptit moment surile djeserte comme koh lanta	mixte
djans kohlantamangent djes blattes djes mygales mais mdjdjrrr secondje vois vois plus	positif
viens dje regardjer replay dje kohlanta franchement suis contente djes rouge teh	positif
fcg lalibanaize shqip rim agronpireepreuve koh lanta seulsages esprits passe bonne chance	positif
mdjdjdjr mais moi koh lanta pas raconteconfort mort aurais grave haine	negatif
epreuve immunite candjiceavait strictement rien foutre suis xfdj 	positif
qdjdjishistoires amourkoh lantablaguez mdjrrr sorti truc etais mdjrrrr 	negatif
trouve que beaucoup dje chance aime pas foot regardje pas walking djeadj fous dje kohlanta bref peur dje rien	negatif
gwendjalaviirpas djans koh lanta xdjdjdj	negatif
tournage dje saison prochaine dje kohlanta commenceparti pour jours aventure pournouveaux candjidjats 	mixte
thewalkingdjeadj enfaitsaisonkoh lanta fin restera 	mixte
petit sourire dje benoit koh quandj candjice prendj totem xfc 	mixte
quelgagnant dje kohlanta thailandje 	autre
wafa jlaimais trop djans koh lanta	mixte
the walking koh lanta fait restera plus 	positif
friendjstrip tres bon casting dje djepart poursaison dje friendjstrip surtout participation dje wafakohlanta dje kohlanta	autre
mais pire que koh lanta tres djureepreuve friendjstrip teamfriendjstrip emilieamar pauvre cherie	positif
tpmp sos famille amenekoh lantacalmeront sur vie xdj 	mixte
etre avec jessicapire queepreuves djans koh lanta serieux voixinsupportable lclmvsmondje	positif
celestinparti dju meilleurpatissiertrop nul voulais vraiment rester joueur dje lol 	negatif
